id,conversation_id,created_at,date,time,timezone,user_id,username,name,place,tweet,mentions,urls,photos,replies_count,retweets_count,likes_count,hashtags,cashtags,link,retweet,quote_url,video,near,geo,source,user_rt_id,user_rt,retweet_id,reply_to,retweet_date
1131919075989426182,1131916272441208834,1558705512000,2019-05-24,06:45:12,Pacific Daylight Time,138203134,aoc,Alexandria Ocasio-Cortez,,"In working with our staffer, Oversight Committee was able to pull in  request a great deal of docs and evidence in the case.  Bc Dems won the House, Dems control committees + Chairs.  It was the leadership of the Chairman @RepCummings that brought the issue to a hearing. /3",['repcummings'],[],[],79,1035,10844,[],[],https://twitter.com/AOC/status/1131919075989426182,False,,0,,,,,,,"[{'user_id': '138203134', 'username': 'AOC'}, {'user_id': '787373558', 'username': 'RepCummings'}]",
1131918140437344256,1131916272441208834,1558705289000,2019-05-24,06:41:29,Pacific Daylight Time,138203134,aoc,Alexandria Ocasio-Cortez,,"After vetting the case these organizers presented, she saw that it seemed they were. She passed it by me and our office engaged the Oversight Committee.  Committee staffers are CRITICAL. They have the expertise, tenure, relationships, etc to investigate issues + inquiries. /2",[],[],[],54,1037,11301,[],[],https://twitter.com/AOC/status/1131918140437344256,False,,0,,,,,,,"[{'user_id': '138203134', 'username': 'AOC'}]",
1131916272441208834,1131916272441208834,1558704843000,2019-05-24,06:34:03,Pacific Daylight Time,138203134,aoc,Alexandria Ocasio-Cortez,,Let’s talk abt how Gov works behind the scenes: Remember that Big Pharma hearing last week?  Here’s how it happened.  A 23 y/o staffer in my office met w/ local HIV advocates. They argued the CDC held the patent for PrEP & Gilead was price gouging.  She picked it up + dug in. /1,[],[],[],1063,10000,44112,[],[],https://twitter.com/AOC/status/1131916272441208834,False,,0,,,,,,,"[{'user_id': '138203134', 'username': 'AOC'}]",
1131307351494025216,1131305005661605888,1558559665000,2019-05-22,14:14:25,Pacific Daylight Time,138203134,aoc,Alexandria Ocasio-Cortez,,This hits too close to home 🙃,['notquitefrodo'],[],[],43,81,1018,[],[],https://twitter.com/AOC/status/1131307351494025216,False,,0,,,,,,,"[{'user_id': '138203134', 'username': 'AOC'}, {'user_id': '713390006', 'username': 'notquitefrodo'}]",
1131206490176610309,1131204943610880007,1558535618000,2019-05-22,07:33:38,Pacific Daylight Time,138203134,aoc,Alexandria Ocasio-Cortez,,"When I ran last year, everyone and their cousin endorsed my opponent.  After he lost,did people imply that the Gov’s endorsement wasn’t powerful anymore? That virtually every single union in NYC no longer had influence?  No! It was about the candidates and the race. It always is.",[],[],[],298,1036,13875,[],[],https://twitter.com/AOC/status/1131206490176610309,False,,0,,,,,,,"[{'user_id': '138203134', 'username': 'AOC'}]",
1131205540628054021,1131204943610880007,1558535392000,2019-05-22,07:29:52,Pacific Daylight Time,138203134,aoc,Alexandria Ocasio-Cortez,,"I endorsed @CabanForQueens for DA not out of a “power move,” but because to me it feels like the right thing to do.  Electing a public defender to a DA’s position with her platform could be transformative, &the organizers busting their butts on the ground have earned recognition.",['cabanforqueens'],[],[],141,895,11653,[],[],https://twitter.com/AOC/status/1131205540628054021,False,,0,,,,,,,"[{'user_id': '138203134', 'username': 'AOC'}, {'user_id': '1055070224305807361', 'username': 'CabanForQueens'}]",
1130970709839286272,1130904723849129985,1558479404000,2019-05-21,15:56:44,Pacific Daylight Time,138203134,aoc,Alexandria Ocasio-Cortez,,Thank you!,['shaunking'],[],[],285,329,9596,[],[],https://twitter.com/AOC/status/1130970709839286272,False,,0,,,,,,,"[{'user_id': '138203134', 'username': 'AOC'}, {'user_id': '755113', 'username': 'shaunking'}]",
1130887268527464448,1130887268527464448,1558459510000,2019-05-21,10:25:10,Pacific Daylight Time,138203134,aoc,Alexandria Ocasio-Cortez,,.@AyannaPressley is breathing 🔥 in FSC right now and it is glorious to watch.  Good job sis.,['ayannapressley'],[],[],268,448,6346,[],[],https://twitter.com/AOC/status/1130887268527464448,False,,0,,,,,,,"[{'user_id': '138203134', 'username': 'AOC'}, {'user_id': '31013444', 'username': 'AyannaPressley'}]",
1130860847566336001,1130858750758273024,1558453211000,2019-05-21,08:40:11,Pacific Daylight Time,138203134,aoc,Alexandria Ocasio-Cortez,,"Remember, Clinton was also impeached - that failed in Sen too. Our institutions didn’t suffer then, but they have been damaged greatly today w unwillingness to impeach.  Whether it’s Dem fear or GOP recklessness, doesn’t matter. Failure to impeach now is neglect of due process.",[],[],[],1812,7348,42854,[],[],https://twitter.com/AOC/status/1130860847566336001,False,,0,,,,,,,"[{'user_id': '138203134', 'username': 'AOC'}]",
1130539758877380613,1130539175114104833,1558376657000,2019-05-20,11:24:17,Pacific Daylight Time,138203134,aoc,Alexandria Ocasio-Cortez,,"Shout out to @RepJayapal for leading on Medicare for All. Her leadership on #M4A in the House has made it stronger than ever, and she also secured its first-ever hearing in the bill’s history. 💪🏽💜",['repjayapal'],[],[],346,1500,14980,['#m4a'],[],https://twitter.com/AOC/status/1130539758877380613,False,,0,,,,,,,"[{'user_id': '138203134', 'username': 'AOC'}, {'user_id': '815733290955112448', 'username': 'RepJayapal'}]",
1130155465596395520,1130155464317124608,1558285034000,2019-05-19,09:57:14,Pacific Daylight Time,138203134,aoc,Alexandria Ocasio-Cortez,,"It’s important to note that people shouldn’t be in a situation where they depend on a stranger’s enormous act of charity for this kind of liberation to begin with (aka college should be affordable), but it is an incredible act of community investment in this system as it is. 🎓",[],[],[],1908,5986,57061,[],[],https://twitter.com/AOC/status/1130155465596395520,False,,0,,,,,,,"[{'user_id': '138203134', 'username': 'AOC'}]",
1129795212920987650,1129795212920987650,1558199143000,2019-05-18,10:05:43,Pacific Daylight Time,138203134,aoc,Alexandria Ocasio-Cortez,,"How to Bail Out Main Street, Not Wall Street:  💳 Cap All Interest Rates at 15% (includes Credit Cards & all lending) 💸 Federal Student Loan Cancellation (for the past) 🎓 Tuition-Free Public Colleges (for the future) 👩🏾‍⚕️Medicare for All (no egregious medical debt w/single payer)",[],[],[],4496,17749,78379,[],[],https://twitter.com/AOC/status/1129795212920987650,False,,0,,,,,,,"[{'user_id': '138203134', 'username': 'AOC'}]",
1129747865205706753,1129746541412048901,1558187855000,2019-05-18,06:57:35,Pacific Daylight Time,138203134,aoc,Alexandria Ocasio-Cortez,,"White Supremacists get charged w hate crimes. Muslims get charged w terrorism.  This is a HUGE difference. Hate crimes are underreported, deprioritized, + aren’t treated as seriously as domestic terror charges.  Yet in the US, Neo-Nazi violence far outnumbers Islamic extremism.",[],[],[],1436,9808,47687,[],[],https://twitter.com/AOC/status/1129747865205706753,False,,0,,,,,,,"[{'user_id': '138203134', 'username': 'AOC'}]",
1129452432034029568,1129449948288815105,1558117418000,2019-05-17,11:23:38,Pacific Daylight Time,138203134,aoc,Alexandria Ocasio-Cortez,,What angers me about the GOP’s attempts to turn the United States into a far-right Christian theocracy is how dishonest they are about it.  At least be forthright about your desire to subvert and dismantle our democracy into a creepy theological order led by a mad king.,[],[],[],13951,22062,97601,[],[],https://twitter.com/AOC/status/1129452432034029568,False,,0,,,,,,,"[{'user_id': '138203134', 'username': 'AOC'}]",
1129451377946693632,1129449948288815105,1558117167000,2019-05-17,11:19:27,Pacific Daylight Time,138203134,aoc,Alexandria Ocasio-Cortez,,"The GOP doesn’t care about babies at all - especially brown, black, or poor ones. If they did, they’d: - cosponsor the Green New Deal or at LEAST have a real climate plan - guarantee healthcare so ALL can get prenatal care - not stand for the death+caging of babies on our border",[],[],[],5356,13907,74984,[],[],https://twitter.com/AOC/status/1129451377946693632,False,,0,,,,,,,"[{'user_id': '138203134', 'username': 'AOC'}]",
1129449948288815105,1129449948288815105,1558116826000,2019-05-17,11:13:46,Pacific Daylight Time,138203134,aoc,Alexandria Ocasio-Cortez,,"To the GOP extremists trying to invoke “the unborn” to jail people for abortion:  Where are you on climate change? OH right, you want to burn fossil fuels til there’s hell on Earth.  If they were truthful about their motives, they’d be consistent in their principles. They’re not.",[],[],[],6845,26254,128562,[],[],https://twitter.com/AOC/status/1129449948288815105,False,,0,,,,,,,"[{'user_id': '138203134', 'username': 'AOC'}]",
1129215937775845376,1129213168222375936,1558061034000,2019-05-16,19:43:54,Pacific Daylight Time,138203134,aoc,Alexandria Ocasio-Cortez,,"Yep! I’m just carrying it in the House and whipping votes there 😉 but if Mitch McConnell wants to actually use religious principles for good + reinstate usury laws, he’s more than welcome.",['adrielhampton'],[],[],189,119,1467,[],[],https://twitter.com/AOC/status/1129215937775845376,False,,0,,,,,,,"[{'user_id': '138203134', 'username': 'AOC'}, {'user_id': '15250836', 'username': 'adrielhampton'}]",
1128894602801553409,1128890390982123522,1557984421000,2019-05-15,22:27:01,Pacific Daylight Time,138203134,aoc,Alexandria Ocasio-Cortez,,"Ultimately, this is about women’s power.   When women are in control of their sexuality, it threatens a core element underpinning right-wing ideology: patriarchy.  It’s a brutal form of oppression to seize control of the 1 essential thing a person should command: their own body.",[],[],[],4199,29899,130773,[],[],https://twitter.com/AOC/status/1128894602801553409,False,,0,,,,,,,"[{'user_id': '138203134', 'username': 'AOC'}]",
1128890390982123522,1128890390982123522,1557983417000,2019-05-15,22:10:17,Pacific Daylight Time,138203134,aoc,Alexandria Ocasio-Cortez,,"Abortion bans aren’t just about controlling women’s bodies.  They’re about controlling women’s sexuality. Owning women.  From limiting birth control to banning comprehensive sex ed, US religious fundamentalists are working hard to outlaw sex that falls outside their theology.",[],[],[],12231,87913,325529,[],[],https://twitter.com/AOC/status/1128890390982123522,False,,0,,,,,,,"[{'user_id': '138203134', 'username': 'AOC'}]",
1128787337142525952,1128762998988910592,1557958847000,2019-05-15,15:20:47,Pacific Daylight Time,138203134,aoc,Alexandria Ocasio-Cortez,,Thank you Rep. Raskin - it’s all because I get to learn from the best! Thanks for your leadership in calling + prioritizing this hearing.,"['repraskin', 'mmcauliff']",[],[],21,73,1287,[],[],https://twitter.com/AOC/status/1128787337142525952,False,,0,,,,,,,"[{'user_id': '138203134', 'username': 'AOC'}, {'user_id': '806906355214852096', 'username': 'RepRaskin'}, {'user_id': '76133715', 'username': 'mmcauliff'}]",
1128775160872484864,1128762998988910592,1557955944000,2019-05-15,14:32:24,Pacific Daylight Time,138203134,aoc,Alexandria Ocasio-Cortez,,"Not technically the 1st time, a few weeks ago I briefly covered for @RepRaskin for a few minutes as he quickly ran to a vote in Judiciary. But this is definitely my first time chairing for a significant amount of time!","['mmcauliff', 'repraskin']",[],[],199,405,7620,[],[],https://twitter.com/AOC/status/1128775160872484864,False,,0,,,,,,,"[{'user_id': '138203134', 'username': 'AOC'}, {'user_id': '76133715', 'username': 'mmcauliff'}, {'user_id': '806906355214852096', 'username': 'RepRaskin'}]",
1128752212837109761,1128646103858065408,1557950473000,2019-05-15,13:01:13,Pacific Daylight Time,138203134,aoc,Alexandria Ocasio-Cortez,,"Actually it *would* be a felony for women - if those women are medical providers. See? According to your own semantic standard, you “lied.”  We can fact-check obvious semantics all day and make absurd bad faith claims if that’s how you want be. But I have better uses for my time.","['liz_wheeler', 'governorkayivey']",[],[],3297,107,1451,[],[],https://twitter.com/AOC/status/1128752212837109761,False,,0,,,,,,,"[{'user_id': '138203134', 'username': 'AOC'}, {'user_id': '264361128', 'username': 'Liz_Wheeler'}, {'user_id': '19668491', 'username': 'GovernorKayIvey'}]",
1128744629019598848,1128646103858065408,1557948665000,2019-05-15,12:31:05,Pacific Daylight Time,138203134,aoc,Alexandria Ocasio-Cortez,,"It’s a felony punishable by jail, incl cases of women pregnant by rape or incest. Twitter is 280 chars - read the context clues in grammar of the tweet.  But good to know you’re here to promote criminalizing medical providers aiding victims of rape and incest! 👍🏽 good job","['liz_wheeler', 'governorkayivey']",[],[],720,289,2545,[],[],https://twitter.com/AOC/status/1128744629019598848,False,,0,,,,,,,"[{'user_id': '138203134', 'username': 'AOC'}, {'user_id': '264361128', 'username': 'Liz_Wheeler'}, {'user_id': '19668491', 'username': 'GovernorKayIvey'}]",
1128647627434811393,1128646103858065408,1557925538000,2019-05-15,06:05:38,Pacific Daylight Time,138203134,aoc,Alexandria Ocasio-Cortez,,This law would force children - 12 year olds - to carry a pregnancy by their rapist.  This law would force people w/ mental disabilities to carry pregnancy by rape to term.  This law forces people to be pregnant against their own consent. It’s horrifying.,[],[],[],3130,24286,89646,[],[],https://twitter.com/AOC/status/1128647627434811393,False,,0,,,,,,,"[{'user_id': '138203134', 'username': 'AOC'}]",
1127988578410205187,1127984160830906371,1557768408000,2019-05-13,10:26:48,Pacific Daylight Time,138203134,aoc,Alexandria Ocasio-Cortez,,"But also if you’re a staffer getting invited to a spa weekend funded by lobbyists, maybe ask yourself why you’re saying yes to that.  It’s like those timeshare co’s who offer free vacations to people. You THINK you’re gonna say no, but they do it for a reason.",['andrewfeinberg'],[],[],81,293,1908,[],[],https://twitter.com/AOC/status/1127988578410205187,False,,0,,,,,,,"[{'user_id': '138203134', 'username': 'AOC'}, {'user_id': '2249531', 'username': 'AndrewFeinberg'}]",
1127987720868044800,1127984160830906371,1557768204000,2019-05-13,10:23:24,Pacific Daylight Time,138203134,aoc,Alexandria Ocasio-Cortez,,"So sometimes you think you’re getting some straightforward info by some professor here or there, as if it’s a CRS report or something.  But instead they just saying “objectively” that social security isn’t worth saving, etc. Without other viewpoints.",['andrewfeinberg'],[],[],25,177,1374,[],[],https://twitter.com/AOC/status/1127987720868044800,False,,0,,,,,,,"[{'user_id': '138203134', 'username': 'AOC'}, {'user_id': '2249531', 'username': 'AndrewFeinberg'}]",
1127987440885600256,1127984160830906371,1557768137000,2019-05-13,10:22:17,Pacific Daylight Time,138203134,aoc,Alexandria Ocasio-Cortez,,It’s not that simple. Oftentimes you have no idea you’re listening to a lobbyist bc they incorporate 3rd party groups with confusing names.  I saw this 1st hand at the Harvard “Orientation” hosted by AEI. It was marketed at “objective” (lobbyists always say they’re objective).,['andrewfeinberg'],[],[],32,177,1554,[],[],https://twitter.com/AOC/status/1127987440885600256,False,,0,,,,,,,"[{'user_id': '138203134', 'username': 'AOC'}, {'user_id': '2249531', 'username': 'AndrewFeinberg'}]",
1127986542415437824,1127984160830906371,1557767923000,2019-05-13,10:18:43,Pacific Daylight Time,138203134,aoc,Alexandria Ocasio-Cortez,,"It’s that bundle 💰 for elections, so you pick up their call,accept invites, become friends.  In practice it’s not transactional, it’s social.  So while ppl don’t see how lobbying influences votes, their whole enviro + staff has been exposed to mainly 1 point of view: lobbyists’.",[],[],[],601,2952,19569,[],[],https://twitter.com/AOC/status/1127986542415437824,False,,0,,,,,,,"[{'user_id': '138203134', 'username': 'AOC'}]",
1127984814102065153,1127984160830906371,1557767511000,2019-05-13,10:11:51,Pacific Daylight Time,138203134,aoc,Alexandria Ocasio-Cortez,,"When I was looking at lobbying from the outside, just as a normal voting citizen, it appeared to me as more transactional in nature than it actually is.  It’s not necessarily that a lobbyist calls you and says “vote/don’t vote for this bill or we won’t donate to you again...” /2",[],[],[],253,2016,14433,[],[],https://twitter.com/AOC/status/1127984814102065153,False,,0,,,,,,,"[{'user_id': '138203134', 'username': 'AOC'}]",
1127293435717869568,1127258010936598528,1557602673000,2019-05-11,12:24:33,Pacific Daylight Time,138203134,aoc,Alexandria Ocasio-Cortez,,"And in the meantime, as we continue fighting for Medicare for All, a living wage, & more:  Unionize your workplace. Demand a raise. And don’t stop until you get one. 💪🏽",[],[],[],3350,7323,61497,[],[],https://twitter.com/AOC/status/1127293435717869568,False,,0,,,,,,,"[{'user_id': '138203134', 'username': 'AOC'}]",
1127275942265671686,1127258010936598528,1557598503000,2019-05-11,11:15:03,Pacific Daylight Time,138203134,aoc,Alexandria Ocasio-Cortez,,"Ultimately, living in a moral society, a good nation, means establishing some basic standards of dignity: - healthcare as a right - a living wage - public education that prepares for civil society + economy (which now shld incl college) - all people having power in the economy",[],[],[],2673,11625,76420,[],[],https://twitter.com/AOC/status/1127275942265671686,False,,0,,,,,,,"[{'user_id': '138203134', 'username': 'AOC'}]",
1127270688925134849,1127258010936598528,1557597250000,2019-05-11,10:54:10,Pacific Daylight Time,138203134,aoc,Alexandria Ocasio-Cortez,,"When we say “tax the rich,” we mean nesting-doll yacht rich. For-profit prison rich. Betsy DeVos, student-loan-shark rich.  Trick-the-country-into-war rich. Subsidizing-workforce-w-food-stamps rich.  Because THAT kind of rich is simply not good for society, & it’s like 10 people.",[],[],[],9167,26759,115143,[],[],https://twitter.com/AOC/status/1127270688925134849,False,,0,,,,,,,"[{'user_id': '138203134', 'username': 'AOC'}]",
1127268922070319104,1127258010936598528,1557596829000,2019-05-11,10:47:09,Pacific Daylight Time,138203134,aoc,Alexandria Ocasio-Cortez,,"US GDP is at an all-time high. As a nation, we are more prosperous than we ever have been.  But that’s simply not the lived truth. Even now, I’m paid similar to a doctor or corporate lawyer - many who‘d think they are “rich,” but it’s nowhere near what we actually mean in policy.",[],[],[],907,3449,32489,[],[],https://twitter.com/AOC/status/1127268922070319104,False,,0,,,,,,,"[{'user_id': '138203134', 'username': 'AOC'}]",
1127265047179354112,1127258010936598528,1557595905000,2019-05-11,10:31:45,Pacific Daylight Time,138203134,aoc,Alexandria Ocasio-Cortez,,"The myth that bad credit or struggling w bills = irresponsibility is a heinous myth.  Paying people less than what’s needed to live is what’s actually irresponsible.  GDP + costs are rising, wages are not. That doesn’t mean YOU’RE bad. It means working people are set up to fail.",[],[],[],986,10843,57784,[],[],https://twitter.com/AOC/status/1127265047179354112,False,,0,,,,,,,"[{'user_id': '138203134', 'username': 'AOC'}]",
1127263277237583874,1127258010936598528,1557595483000,2019-05-11,10:24:43,Pacific Daylight Time,138203134,aoc,Alexandria Ocasio-Cortez,,"Now I’m going through a huge income transition compared to living off tips (which diff pay every week, very hard).  & I have HEALTH INSURANCE, which now means I have fewer expenses.  According to banks, I’d be more “responsible,” but my character hasn’t changed. Just my math. /3",[],[],[],852,4901,46235,[],[],https://twitter.com/AOC/status/1127263277237583874,False,,0,,,,,,,"[{'user_id': '138203134', 'username': 'AOC'}]",
1127260469381742594,1127258010936598528,1557594814000,2019-05-11,10:13:34,Pacific Daylight Time,138203134,aoc,Alexandria Ocasio-Cortez,,"When I was waitressing, I used to jerk awake in the middle of sleep worried that I may have forgotten if a bill cleared, or if I had enough 💰 to pay a Dr in cash.  Was that bc I was “irresponsible?” No. It’s bc I wasn’t being paid a living wage as cost of living skyrocketed. /2",[],[],[],1259,5631,49995,[],[],https://twitter.com/AOC/status/1127260469381742594,False,,0,,,,,,,"[{'user_id': '138203134', 'username': 'AOC'}]",
1127258010936598528,1127258010936598528,1557594227000,2019-05-11,10:03:47,Pacific Daylight Time,138203134,aoc,Alexandria Ocasio-Cortez,,Going from waitressing a year ago to now carries a LOT of life-adjustments.  But 3 paychecks in has shown me how 1 of the greatest scams in US is the idea that financial struggle is due to “poor character.”  It’s a huge myth designed to keep people from empowering themselves. /1,[],[],[],7264,40896,182306,[],[],https://twitter.com/AOC/status/1127258010936598528,False,,0,,,,,,,"[{'user_id': '138203134', 'username': 'AOC'}]",
1126991273439764480,1126985462260936706,1557530632000,2019-05-10,16:23:52,Pacific Daylight Time,138203134,aoc,Alexandria Ocasio-Cortez,,If you don’t understand this man’s sign - or don’t approach it with a desire to - then you do not understand this political moment.  The same folks who said Trump was impossible in 2016 are the same ones lecturing on what’s “electable” in 2020.   Don’t buy it. Vote your values.,[],[],[],1298,5040,42651,[],[],https://twitter.com/AOC/status/1126991273439764480,False,,0,,,,,,,"[{'user_id': '138203134', 'username': 'AOC'}]",
1126990102532698114,1126985462260936706,1557530353000,2019-05-10,16:19:13,Pacific Daylight Time,138203134,aoc,Alexandria Ocasio-Cortez,,"The forces getting in the way of solving our climate crisis are politicians themselves + lobbyists. It is the willingness to bend to corporate power - the same ones that use coal miners’ plights for a tax break, yet refuse to pay for those same miners’ healthcare for black lung.",[],[],[],475,3734,28158,[],[],https://twitter.com/AOC/status/1126990102532698114,False,,0,,,,,,,"[{'user_id': '138203134', 'username': 'AOC'}]",
1126988999367774210,1126985462260936706,1557530090000,2019-05-10,16:14:50,Pacific Daylight Time,138203134,aoc,Alexandria Ocasio-Cortez,,"All of this is to say don’t let any politician, no matter the party, lecture you about what is “possible” or “electable.”  Don’t ever let a politician imply that working people are “less-than” or “uneducated” - aka that they are the ones in the way of solving the climate crisis.",[],[],[],288,1903,21581,[],[],https://twitter.com/AOC/status/1126988999367774210,False,,0,,,,,,,"[{'user_id': '138203134', 'username': 'AOC'}]",
1126987330143830016,1126985462260936706,1557529692000,2019-05-10,16:08:12,Pacific Daylight Time,138203134,aoc,Alexandria Ocasio-Cortez,,"Then he said, “I like you. I can tell that you are genuine and fighting for us. You’re real and you get it.”  I thanked him and his family from the bottom of my heart.",[],[],[],392,1354,23923,[],[],https://twitter.com/AOC/status/1126987330143830016,False,,0,,,,,,,"[{'user_id': '138203134', 'username': 'AOC'}]",
1126986869558972417,1126985462260936706,1557529582000,2019-05-10,16:06:22,Pacific Daylight Time,138203134,aoc,Alexandria Ocasio-Cortez,,"I somehow got it out: “With all respect sir, how do you... manage to support both of us at the same time?”  This is what he said: “I’ve been saying for years that climate change is our most important crisis. You’re one of the only ones who‘s been willing to be decisive on it.”",[],[],[],394,1367,20985,[],[],https://twitter.com/AOC/status/1126986869558972417,False,,0,,,,,,,"[{'user_id': '138203134', 'username': 'AOC'}]",
1126985959516585984,1126985462260936706,1557529365000,2019-05-10,16:02:45,Pacific Daylight Time,138203134,aoc,Alexandria Ocasio-Cortez,,"I was pretty astonished.  We shook hands, he introduced himself, and told me he wanted to show his support.  I could barely get my question out - I wanted to honor his positivity, yet respectfully find a way to ask, “How?”",[],[],[],394,908,15350,[],[],https://twitter.com/AOC/status/1126985959516585984,False,,0,,,,,,,"[{'user_id': '138203134', 'username': 'AOC'}]",
1126860292695187456,1126860292695187456,1557499404000,2019-05-10,07:43:24,Pacific Daylight Time,138203134,aoc,Alexandria Ocasio-Cortez,,"Lastly, if anyone has recommendations for baby gear that folds up nicely or tips on how to prep a workplace for little ones, please give me your recs!  If you’re a new mom/parent + could bring your babies / kids to work, what would help that? What would you want to see? ⬇️",[],[],[],2114,1633,13619,[],[],https://twitter.com/AOC/status/1126860292695187456,False,,0,,,,,,,"[{'user_id': '138203134', 'username': 'AOC'}]",
1126855646429818880,1126840339644522496,1557498296000,2019-05-10,07:24:56,Pacific Daylight Time,138203134,aoc,Alexandria Ocasio-Cortez,,"8. This is convo is bigger than parental leave - it’s a larger conversation about how modern work has grown so hostile to family life. It doesn’t have to be that way!  Work + family can go together, but we have to break down the barriers that force people to choose between them.",[],[],[],695,2192,24182,[],[],https://twitter.com/AOC/status/1126855646429818880,False,,0,,,,,,,"[{'user_id': '138203134', 'username': 'AOC'}]",
