id,conversation_id,created_at,date,time,timezone,user_id,username,name,place,tweet,mentions,urls,photos,replies_count,retweets_count,likes_count,hashtags,cashtags,link,retweet,quote_url,video,near,geo,source,user_rt_id,user_rt,retweet_id,reply_to,retweet_date
1149163552730746881,1149158361109336065,1562816916000,2019-07-10,20:48:36,Pacific Daylight Time,138203134,aoc,Alexandria Ocasio-Cortez,,"132 members - incl GOP & Independents - voted against creating the Dept of Homeland Security.  Don’t let people rewrite history as if DHS/ICE always existed, or is a no-brainer. It’s a young agency, ill-conceived after 9/11 & sacrificed our civil liberties - like the Patriot Act.",[],[],[],1718,11415,55281,[],[],https://twitter.com/AOC/status/1149163552730746881,False,,0,,,,,,,"[{'user_id': '138203134', 'username': 'AOC'}]",
1149087820818079745,1149005879552991232,1562798860000,2019-07-10,15:47:40,Pacific Daylight Time,138203134,aoc,Alexandria Ocasio-Cortez,,Thanks - I appreciate that.,"['mrrbourne', 'catoedwards']",[],[],219,416,17663,[],[],https://twitter.com/AOC/status/1149087820818079745,False,,0,,,,,,,"[{'user_id': '138203134', 'username': 'AOC'}, {'user_id': '297395484', 'username': 'MrRBourne'}, {'user_id': '1169477054', 'username': 'CatoEdwards'}]",
1148714359302119424,1148713014746583045,1562709819000,2019-07-09,15:03:39,Pacific Daylight Time,138203134,aoc,Alexandria Ocasio-Cortez,,(Being a woman does not mean you’re immune from being bad to women or genderqueer people. Just like being a man doesn’t mean you don’t have a role in the movement for gender equity! We are all in this together.),[],[],[],1566,4447,48729,[],[],https://twitter.com/AOC/status/1148714359302119424,False,,0,,,,,,,"[{'user_id': '138203134', 'username': 'AOC'}]",
1148291459285733376,1148283312798126080,1562608992000,2019-07-08,11:03:12,Pacific Daylight Time,138203134,aoc,Alexandria Ocasio-Cortez,,"Climate change intensifies flooding, wildfires, & extreme weather.  It’s more than 1 day or 1 storm; it’s all of them. Places are flooding where they haven’t before; there are 90-degree days in Alaska in June. The GOP will mock & sow confusion until it’s their home swept away.",[],[],[],2245,5124,29894,[],[],https://twitter.com/AOC/status/1148291459285733376,False,,0,,,,,,,"[{'user_id': '138203134', 'username': 'AOC'}]",
1148286474376437760,1148285379906330624,1562607804000,2019-07-08,10:43:24,Pacific Daylight Time,138203134,aoc,Alexandria Ocasio-Cortez,,"If the GOP is suddenly so concerned w/ funding “humanitarian crises” they‘ve created, let’s come up w an *actual* funding package that ensures no person in public housing has to drink poisoned water or suffer cold winters again.  Simple: GOP needs to pay NYCHA the $34b they owe.",[],[],[],851,2048,14432,[],[],https://twitter.com/AOC/status/1148286474376437760,False,,0,,,,,,,"[{'user_id': '138203134', 'username': 'AOC'}]",
1148032301793775621,1148032301793775621,1562547204000,2019-07-07,17:53:24,Pacific Daylight Time,138203134,aoc,Alexandria Ocasio-Cortez,,"Ok everyone, planning to take a few days of rest within the next few months and am sourcing a few ideas.  What’s your favorite US National Park to visit? 🏞  (Any tips for visiting said park also welcome!)",[],[],[],19813,1803,29820,[],[],https://twitter.com/AOC/status/1148032301793775621,False,,0,,,,,,,"[{'user_id': '138203134', 'username': 'AOC'}]",
1147931296724856832,1147930869904093184,1562523123000,2019-07-07,11:12:03,Pacific Daylight Time,138203134,aoc,Alexandria Ocasio-Cortez,,"“I had watched for many years and seen how a few rich families held much of Argentina's wealth and power in their hands. So the government brought in an eight hour working day, sickness pay and fair wages to give poor workers a fair go.”  - Evita Perón",[],[],[],4306,5577,54620,[],[],https://twitter.com/AOC/status/1147931296724856832,False,,0,,,,,,,"[{'user_id': '138203134', 'username': 'AOC'}]",
1147671989383049216,1147671989383049216,1562461299000,2019-07-06,18:01:39,Pacific Daylight Time,138203134,aoc,Alexandria Ocasio-Cortez,,"I find it strange when members act as though social media isn’t important.  They set millions of 💵 on 🔥 to run TV ads so people can see their message.  I haven’t dialed for dollars *once* this year, & have more time to do my actual job. Yet we’d rather campaign like it’s 2008.",[],[],[],6812,15146,112079,[],[],https://twitter.com/AOC/status/1147671989383049216,False,,0,,,,,,,"[{'user_id': '138203134', 'username': 'AOC'}]",
1147204203804278785,1147168498470260738,1562349770000,2019-07-05,11:02:50,Pacific Daylight Time,138203134,aoc,Alexandria Ocasio-Cortez,,"Thank you, @SenSanders. It’s an honor to work alongside you and the millions of other people fighting for education, healthcare, and a living wage as rights.","['berniesanders', 'sensanders']",[],[],1587,3813,50984,[],[],https://twitter.com/AOC/status/1147204203804278785,False,,0,,,,,,,"[{'user_id': '138203134', 'username': 'AOC'}, {'user_id': '216776631', 'username': 'BernieSanders'}, {'user_id': '29442313', 'username': 'SenSanders'}]",
1147128988588023809,1147128726372724736,1562331838000,2019-07-05,06:03:58,Pacific Daylight Time,138203134,aoc,Alexandria Ocasio-Cortez,,(Updated the $ since previous one was estimate of his cancelled Veteran’s day military parade),[],[],[],2669,3023,30541,[],[],https://twitter.com/AOC/status/1147128988588023809,False,,0,,,,,,,"[{'user_id': '138203134', 'username': 'AOC'}]",
1147128726372724736,1147128726372724736,1562331775000,2019-07-05,06:02:55,Pacific Daylight Time,138203134,aoc,Alexandria Ocasio-Cortez,,"Trump spent millions on a poorly attended, 1 day parade days after saying he couldn’t afford toothpaste & soap for caged children.  Did he ask Congress for military parade💰? No.  Trump held these kids hostage to secure billions for their abusers. Congress needs to see that.",[],[],[],44346,37643,161316,[],[],https://twitter.com/AOC/status/1147128726372724736,False,,0,,,,,,,"[{'user_id': '138203134', 'username': 'AOC'}]",
1146510940998918149,1146510918576234496,1562184484000,2019-07-03,13:08:04,Pacific Daylight Time,138203134,aoc,Alexandria Ocasio-Cortez,,4. Econ: We need large-scale public investment to spur job creation for citizens&immigrants alike. Ideally that investment transitions us to a sustainable economy (climate & income-wise). We are overdue to rebuild American infra&it’s going to take ALL of us & immigrants to do it.,[],[],[],1430,1531,11854,[],[],https://twitter.com/AOC/status/1146510940998918149,False,,0,,,,,,,"[{'user_id': '138203134', 'username': 'AOC'}]",
1146510939593814017,1146510918576234496,1562184483000,2019-07-03,13:08:03,Pacific Daylight Time,138203134,aoc,Alexandria Ocasio-Cortez,,"3. Border policy: As @JulianCastro mentioned in the #DemDebate, it’s time to repeal Section 1325 & 1326, the statutes this admin is using to mindlessly throw people in cages.  We have to take these proceedings out of criminal code & into civil code. Torture accomplishes nothing.",['juliancastro'],[],[],1045,1703,12205,['#demdebate'],[],https://twitter.com/AOC/status/1146510939593814017,False,,0,,,,,,,"[{'user_id': '138203134', 'username': 'AOC'}, {'user_id': '19682187', 'username': 'JulianCastro'}]",
1146510938163568643,1146510918576234496,1562184483000,2019-07-03,13:08:03,Pacific Daylight Time,138203134,aoc,Alexandria Ocasio-Cortez,,"2. Climate change: There is broad consensus from military to activists that resource strains (droughts, famine, etc) & nat disasters are drivers of refugees.  People are fleeing places that were once livable &are no longer. It will get worse the longer we do nothing #GreenNewDeal",[],[],[],567,882,6685,['#greennewdeal'],[],https://twitter.com/AOC/status/1146510938163568643,False,,0,,,,,,,"[{'user_id': '138203134', 'username': 'AOC'}]",
1146510918576234496,1146510918576234496,1562184478000,2019-07-03,13:07:58,Pacific Daylight Time,138203134,aoc,Alexandria Ocasio-Cortez,,"A thread of some of the policy approaches we should consider wrt immigration:  1. Foreign policy: Reinstate US humanitarian aid in the Northern Triangle, where people are fleeing. US should start acting like a real partner in Latin America,& increase visas where we intervene.",[],[],[],1970,3541,18194,[],[],https://twitter.com/AOC/status/1146510918576234496,False,,0,,,,,,,"[{'user_id': '138203134', 'username': 'AOC'}]",
1146462305376493568,1146455078469062656,1562172888000,2019-07-03,09:54:48,Pacific Daylight Time,138203134,aoc,Alexandria Ocasio-Cortez,,Of course. Our prayers are with you - and we will work our hardest to honor his last wish to Congress.,['hayleyalvz'],[],[],14,14,266,[],[],https://twitter.com/AOC/status/1146462305376493568,False,,0,,,,,,,"[{'user_id': '138203134', 'username': 'AOC'}, {'user_id': '480910667', 'username': 'hayleyalvz'}]",
1146240357883088897,1146239531223539713,1562119972000,2019-07-02,19:12:52,Pacific Daylight Time,138203134,aoc,Alexandria Ocasio-Cortez,,"Are CBP officers waking up women in the middle of sleep a “funding” problem?  Is calling migrants “filthy” “wh*res” a funding problem?  Is threatening violence on members of Congress a “funding” problem?  No, it’s not. It’s a far deeper, systemic, more violent problem than that.",[],[],[],3685,14813,81947,[],[],https://twitter.com/AOC/status/1146240357883088897,False,,0,,,,,,,"[{'user_id': '138203134', 'username': 'AOC'}]",
1146053573404266496,1146052528997588992,1562075439000,2019-07-02,06:50:39,Pacific Daylight Time,138203134,aoc,Alexandria Ocasio-Cortez,,"When you pair: - 9,500 current + former CBP officers are part of a violently racist & sexually violent secret Facebook group - Corroborating accounts of abuse - CBP couldn’t control their own officers for a Congressional tour  What else do you call that but a rogue agency?",[],[],[],2128,10789,51478,[],[],https://twitter.com/AOC/status/1146053573404266496,False,,0,,,,,,,"[{'user_id': '138203134', 'username': 'AOC'}]",
1145879123820236800,1145879123820236800,1562033847000,2019-07-01,19:17:27,Pacific Daylight Time,138203134,aoc,Alexandria Ocasio-Cortez,,"And to these CBP officers saying they felt “threatened” by me -  They were literally discussing making a GoFundMe for an officer who attacked my on my tour.  They confiscated my phone, and they were all armed. I’m 5’4”.  They’re just upset I exposed their inhumane behavior.",[],[],[],17910,43051,211223,[],[],https://twitter.com/AOC/status/1145879123820236800,False,,0,,,,,,,"[{'user_id': '138203134', 'username': 'AOC'}]",
1145801283191955464,1145801283191955464,1562015288000,2019-07-01,14:08:08,Pacific Daylight Time,138203134,aoc,Alexandria Ocasio-Cortez,,"What’s haunting is that the women I met with today told me in no uncertain terms that they would experience retribution for telling us what they shared.  They all began sobbing - out of fear of being punished, out of sickness, out of desperation, lack of sleep, trauma, despair.",[],[],[],10123,34169,113507,[],[],https://twitter.com/AOC/status/1145801283191955464,False,,0,,,,,,,"[{'user_id': '138203134', 'username': 'AOC'}]",
1145768510783668232,1145766311794040834,1562007474000,2019-07-01,11:57:54,Pacific Daylight Time,138203134,aoc,Alexandria Ocasio-Cortez,,"Now I’m on my way to Clint, where the Trump admin was denying children toothpaste and soap.  This has been horrifying so far. It is hard to understate the enormity of the problem. We’re talking systemic cruelty w/ a dehumanizing culture that treats them like animals.",[],[],[],5487,22810,96576,[],[],https://twitter.com/AOC/status/1145768510783668232,False,,0,,,,,,,"[{'user_id': '138203134', 'username': 'AOC'}]",
1145766311794040834,1145766311794040834,1562006950000,2019-07-01,11:49:10,Pacific Daylight Time,138203134,aoc,Alexandria Ocasio-Cortez,,"After I forced myself into a cell w/ women&began speaking to them, one of them described their treatment at the hands of officers as “psychological warfare” - waking them at odd hours for no reason, calling them wh*res, etc.  Tell me what about that is due to a “lack of funding?”",[],[],[],18419,67936,228165,[],[],https://twitter.com/AOC/status/1145766311794040834,False,,0,,,,,,,"[{'user_id': '138203134', 'username': 'AOC'}]",
1145764653835964419,1145764653835964419,1562006555000,2019-07-01,11:42:35,Pacific Daylight Time,138203134,aoc,Alexandria Ocasio-Cortez,,"Now I’ve seen the inside of these facilities.  It’s not just the kids. It’s everyone. People drinking out of toilets, officers laughing in front of members Congress.  I brought it up to their superiors. They said “officers are under stress & act out sometimes.” No accountability.",[],[],[],13951,50555,147971,[],[],https://twitter.com/AOC/status/1145764653835964419,False,,0,,,,,,,"[{'user_id': '138203134', 'username': 'AOC'}]",
1145762201619357696,1145762201619357696,1562005970000,2019-07-01,11:32:50,Pacific Daylight Time,138203134,aoc,Alexandria Ocasio-Cortez,,Just left the 1st CBP facility.  I see why CBP officers were being so physically &sexually threatening towards me.  Officers were keeping women in cells w/ no water & had told them to drink out of the toilets.  This was them on their GOOD behavior in front of members of Congress.,[],[],[],28689,55019,143680,[],[],https://twitter.com/AOC/status/1145762201619357696,False,,0,,,,,,,"[{'user_id': '138203134', 'username': 'AOC'}]",
1145727696091193344,1145726686589329410,1561997743000,2019-07-01,09:15:43,Pacific Daylight Time,138203134,aoc,Alexandria Ocasio-Cortez,,"9,500 CBP officers sharing memes about dead migrants and discussing violence and sexual misconduct towards members of Congress.  How on earth can CBP’s culture be trusted to care for refugees humanely?  PS I have no plans to change my itinerary & will visit the CBP station today.",[],[],[],3174,20377,86345,[],[],https://twitter.com/AOC/status/1145727696091193344,False,,0,,,,,,,"[{'user_id': '138203134', 'username': 'AOC'}]",
1145477409858154497,1145473190455459841,1561938071000,2019-06-30,16:41:11,Pacific Daylight Time,138203134,aoc,Alexandria Ocasio-Cortez,,"(And that’s if they even take out their own trash, which I doubt)",[],[],[],2007,3514,49977,[],[],https://twitter.com/AOC/status/1145477409858154497,False,,0,,,,,,,"[{'user_id': '138203134', 'username': 'AOC'}]",
1145476950346981377,1145473190455459841,1561937961000,2019-06-30,16:39:21,Pacific Daylight Time,138203134,aoc,Alexandria Ocasio-Cortez,,"In other words, Republicans who criticize my being a waitress as evidence of lacking skill can take their classism to the trash.  You are insulting the capacities and potential of virtually every working person in America (&the 🌎) for having experience that’s earned, not bought.",[],[],[],3912,11353,81772,[],[],https://twitter.com/AOC/status/1145476950346981377,False,,0,,,,,,,"[{'user_id': '138203134', 'username': 'AOC'}]",
1145475314383908865,1145473190455459841,1561937571000,2019-06-30,16:32:51,Pacific Daylight Time,138203134,aoc,Alexandria Ocasio-Cortez,,"Some of the most nuanced, intelligent, & grounded people I‘ve ever met weren’t at BU, MIT or Harvard events when I was a student.  They were the plumbers & waitresses I hung out with at happy hour, who had ferocious intellectual curiosity *and* a lived context of the real world.",[],[],[],650,3485,29983,[],[],https://twitter.com/AOC/status/1145475314383908865,False,,0,,,,,,,"[{'user_id': '138203134', 'username': 'AOC'}]",
1145474525284356096,1145473190455459841,1561937383000,2019-06-30,16:29:43,Pacific Daylight Time,138203134,aoc,Alexandria Ocasio-Cortez,,"Working people that GOP dismiss as “just a waitress/cook/etc” contain multitudes, & are just as capable & intelligent as anyone.  Classism - judging someone’s character by their income - is disappointing to see from them.  What is so appalling to GOP about having an honest job?",[],[],[],1725,5845,38124,[],[],https://twitter.com/AOC/status/1145474525284356096,False,,0,,,,,,,"[{'user_id': '138203134', 'username': 'AOC'}]",
1145473190455459841,1145473190455459841,1561937065000,2019-06-30,16:24:25,Pacific Daylight Time,138203134,aoc,Alexandria Ocasio-Cortez,,"As always, I‘m proud of my work in restaurants.  I also worked for Sen. Ted Kennedy, piloted literacy projects in the South Bronx, studied Development Economics in W Africa, served as an Educational Director & won international science competitions before I ran for office, too.",[],[],[],9837,18086,135025,[],[],https://twitter.com/AOC/status/1145473190455459841,False,,0,,,,,,,"[{'user_id': '138203134', 'username': 'AOC'}]",
1145327268597772289,1145326946345259008,1561902274000,2019-06-30,06:44:34,Pacific Daylight Time,138203134,aoc,Alexandria Ocasio-Cortez,,"On climate, it’s easy to follow – and there are detriments to following. You are too late. You do not control your destiny. But it is enormously easy because you don’t have to determine the future.  It seems as if, really, it’s a decision on whether we’re going to lead or not. /2",[],[],[],758,1465,13572,[],[],https://twitter.com/AOC/status/1145327268597772289,False,,0,,,,,,,"[{'user_id': '138203134', 'username': 'AOC'}]",
1145012704098361344,1145007976157257730,1561827276000,2019-06-29,09:54:36,Pacific Daylight Time,138203134,aoc,Alexandria Ocasio-Cortez,,"But of course, just because a statute is abolished doesn’t mean the unfairness is gone. Remaining are life & death implications of other statutes & *how* laws are enforced.  That’s a key part of policy in a wide range of issues from schooling to marijuana + yes, immigration too.",[],[],[],885,1854,14262,[],[],https://twitter.com/AOC/status/1145012704098361344,False,,0,,,,,,,"[{'user_id': '138203134', 'username': 'AOC'}]",
1145009527953248256,1145007976157257730,1561826519000,2019-06-29,09:41:59,Pacific Daylight Time,138203134,aoc,Alexandria Ocasio-Cortez,,Dred Scott was the landmark Supreme Court case that found the US Constitution didn’t give citizenship to black people.  The 1st US immigration law was the Chinese Exclusion Act. It was a race-based policy that was upheld until 1942.  The “National Origins Formula” lasted til ‘65.,[],[],[],702,2493,16053,[],[],https://twitter.com/AOC/status/1145009527953248256,False,,0,,,,,,,"[{'user_id': '138203134', 'username': 'AOC'}]",
1145007976157257730,1145007976157257730,1561826149000,2019-06-29,09:35:49,Pacific Daylight Time,138203134,aoc,Alexandria Ocasio-Cortez,,"The history of Citizenship in the US is deeply woven with the history of racism. It has been used as the legal enforcer of racism for most of US history.  Citizenship affords power, & that’s why citizenship of African Americans was long denied too - to both slaves & descendants.",[],[],[],7089,9389,45075,[],[],https://twitter.com/AOC/status/1145007976157257730,False,,0,,,,,,,"[{'user_id': '138203134', 'username': 'AOC'}]",
1144769563529306113,1144739914384367617,1561769307000,2019-06-28,17:48:27,Pacific Daylight Time,138203134,aoc,Alexandria Ocasio-Cortez,,Yes! 🇺🇸⚽️✨,['mpinoe'],[],[],304,825,21728,[],[],https://twitter.com/AOC/status/1144769563529306113,False,,0,,,,,,,"[{'user_id': '138203134', 'username': 'AOC'}, {'user_id': '122130797', 'username': 'mPinoe'}]",
1144722846062698496,1144722846062698496,1561758169000,2019-06-28,14:42:49,Pacific Daylight Time,138203134,aoc,Alexandria Ocasio-Cortez,,Gotta love the rich irony of people who fondly recount stories of how their family’s last names were changed on Ellis Island after their relatives snuck onto a boat escaping some horror now taking fervent anti-immigrant stances & branding innocent human beings as “illegal.”,[],[],[],19717,39264,170515,[],[],https://twitter.com/AOC/status/1144722846062698496,False,,0,,,,,,,"[{'user_id': '138203134', 'username': 'AOC'}]",
1144681536551346184,1144681536551346184,1561748320000,2019-06-28,11:58:40,Pacific Daylight Time,138203134,aoc,Alexandria Ocasio-Cortez,,"One narrative in this country that we need to turn on its head is the lie that immigrants are “takers,” or represent a weight on society.  It’s wrong. Immigrants are *makers.* They create+offer opportunity. They aren’t a weight to carry; in fact, they are our nation’s shoulders.",[],[],[],14181,22245,99546,[],[],https://twitter.com/AOC/status/1144681536551346184,False,,0,,,,,,,"[{'user_id': '138203134', 'username': 'AOC'}]",
1144617966140628993,1144614557320712193,1561733163000,2019-06-28,07:46:03,Pacific Daylight Time,138203134,aoc,Alexandria Ocasio-Cortez,,"It’s worked in recent history, btw - which is why they keep doing it. It got Dems to kill the public option years ago (imagine the last decade w a public option!)  I *wish* the party was as bold as GOP accuses. We’d win more, imo.",[],[],[],863,2801,23676,[],[],https://twitter.com/AOC/status/1144617966140628993,False,,0,,,,,,,"[{'user_id': '138203134', 'username': 'AOC'}]",
1144328990854922240,1144325518201905152,1561664266000,2019-06-27,12:37:46,Pacific Daylight Time,138203134,aoc,Alexandria Ocasio-Cortez,,We have time. We can stay in town. We can at LEAST add some amendments to this Senate bill. But to pass it completely unamended with no House input? That seems a bridge too far.,[],[],[],1546,2238,17866,[],[],https://twitter.com/AOC/status/1144328990854922240,False,,0,,,,,,,"[{'user_id': '138203134', 'username': 'AOC'}]",
1144328271418597376,1144325518201905152,1561664095000,2019-06-27,12:34:55,Pacific Daylight Time,138203134,aoc,Alexandria Ocasio-Cortez,,"0 negotiation with the House. We offered crucial amendments to protect children and families - none are even being considered.  A minority is different than a majority. And while the Senate has to deal with its lack of power there, a House majority should have a seat @ the table.",[],[],[],964,2365,17519,[],[],https://twitter.com/AOC/status/1144328271418597376,False,,0,,,,,,,"[{'user_id': '138203134', 'username': 'AOC'}]",
1144327771755372544,1144326512176488448,1561663976000,2019-06-27,12:32:56,Pacific Daylight Time,138203134,aoc,Alexandria Ocasio-Cortez,,"0 conferencing with House Dems. 0 amendments accepted - including CRUCIAL amendments that would prevent more suffering.  There is enormous frustration here with the capitulation of the Senate minority. But that aside, we have a majority in the House and need to use it.",['jaketapper'],[],[],294,386,3243,[],[],https://twitter.com/AOC/status/1144327771755372544,False,,0,,,,,,,"[{'user_id': '138203134', 'username': 'AOC'}, {'user_id': '14529929', 'username': 'jaketapper'}]",
1144325518201905152,1144325518201905152,1561663438000,2019-06-27,12:23:58,Pacific Daylight Time,138203134,aoc,Alexandria Ocasio-Cortez,,Under no circumstances should the House vote for a McConnell-only bill w/ no negotiation with Democrats. Hell no.  That’s an abdication of power we should refuse to accept. They will keep hurting kids if we do.,[],[],[],8577,10565,55355,[],[],https://twitter.com/AOC/status/1144325518201905152,False,,0,,,,,,,"[{'user_id': '138203134', 'username': 'AOC'}]",
1144312249412128770,1144310761092767744,1561660275000,2019-06-27,11:31:15,Pacific Daylight Time,138203134,aoc,Alexandria Ocasio-Cortez,,"This President will not lift a finger to save these kids.  It is well within his power, but he & Mitch McConnell would rather cast blame than do anything.  They need to get on board w/ a clean humanitarian bill. We can’t write no-strings blank checks to abusive facilities.",[],[],[],2032,7032,44055,[],[],https://twitter.com/AOC/status/1144312249412128770,False,,0,,,,,,,"[{'user_id': '138203134', 'username': 'AOC'}]",
1144310761092767744,1144310761092767744,1561659920000,2019-06-27,11:25:20,Pacific Daylight Time,138203134,aoc,Alexandria Ocasio-Cortez,,"In meeting I asked “Why can the president take money from other agencies to build his little wall, but can’t move money to get kids toothpaste?”  It’s bc his “nat’l emergency” is ONLY to build his wall.  But he won’t declare an emergency to save these kids & get them help.",[],[],[],6395,18756,90774,[],[],https://twitter.com/AOC/status/1144310761092767744,False,,0,,,,,,,"[{'user_id': '138203134', 'username': 'AOC'}]",
1144309949557858304,1144308436701712386,1561659726000,2019-06-27,11:22:06,Pacific Daylight Time,138203134,aoc,Alexandria Ocasio-Cortez,,"His Senate bill is a militarization bill. McConnell killed the House Bill & dropped this one right before recess to force passage.  Well, too bad. This is our job. Cancel vacation, fly the Senate in. Pass a clean humanitarian bill & stop trying to squeeze crises for more pain.",[],[],[],1139,4476,23260,[],[],https://twitter.com/AOC/status/1144309949557858304,False,,0,,,,,,,"[{'user_id': '138203134', 'username': 'AOC'}]",
1143228772910600192,1143228772910600192,1561401954000,2019-06-24,11:45:54,Pacific Daylight Time,138203134,aoc,Alexandria Ocasio-Cortez,,"Reminder: the member who directly + explicitly compared concentration camps on our border to the Holocaust was *Liz Cheney.*  The horrors of the Holocaust went beyond the use of concentration camps, yet camps were part of the process.  They have also been used before and after.",[],[],[],6754,9774,54101,[],[],https://twitter.com/AOC/status/1143228772910600192,False,,0,,,,,,,"[{'user_id': '138203134', 'username': 'AOC'}]",
1142873623377694722,1142873623377694722,1561317280000,2019-06-23,12:14:40,Pacific Daylight Time,138203134,aoc,Alexandria Ocasio-Cortez,,"I have absolutely zero patience for completely certified, card-carrying and flag-waving racists. None. 🚫   They can take their little tiki torches somewhere else.  We don’t give them an inch, a second, a sliver of sunlight nor the time of day. And neither should you.",[],[],[],17355,40201,218733,[],[],https://twitter.com/AOC/status/1142873623377694722,False,,0,,,,,,,"[{'user_id': '138203134', 'username': 'AOC'}]",
