id,conversation_id,created_at,date,time,timezone,user_id,username,name,place,tweet,mentions,urls,photos,replies_count,retweets_count,likes_count,hashtags,cashtags,link,retweet,quote_url,video,near,geo,source,user_rt_id,user_rt,retweet_id,reply_to,retweet_date
1136263833461370888,1136260729366089728,1559741383000,2019-06-05,06:29:43,Pacific Daylight Time,138203134,aoc,Alexandria Ocasio-Cortez,,"People are like “HEY there is NOTHING wrong with dad jeans.” 😂  Exactly, Jim. Wear them with pride. I see you and affirm you. Take to the streets on this special day.👖🚩",[],[],[],753,2085,38901,[],[],https://twitter.com/AOC/status/1136263833461370888,False,,0,,,,,,,"[{'user_id': '138203134', 'username': 'AOC'}]",
1135333239558746114,1135326387827597312,1559519512000,2019-06-02,16:51:52,Pacific Daylight Time,138203134,aoc,Alexandria Ocasio-Cortez,,"Have you seen online platforms make strong, healthy decisions to prevent bigotry and disinformation?  Take a minute to celebrate that here w/ a comment or example, or write what steps you wish your favorite platform would do more of below ⬇️",[],[],[],1114,722,6926,[],[],https://twitter.com/AOC/status/1135333239558746114,False,,0,,,,,,,"[{'user_id': '138203134', 'username': 'AOC'}]",
1135327926788984832,1135326387827597312,1559518245000,2019-06-02,16:30:45,Pacific Daylight Time,138203134,aoc,Alexandria Ocasio-Cortez,,"Even from a “market competition” perspective, it’s a bad long-term strategy.  The reason young people are leaving Facebook in droves is bc its unchecked toxicity makes it an awful place to be.  Think abt this as Big Tech lobbies for monopoly power to prevent mkt competition.",[],[],[],445,1316,11141,[],[],https://twitter.com/AOC/status/1135327926788984832,False,,0,,,,,,,"[{'user_id': '138203134', 'username': 'AOC'}]",
1135316065238622208,1135310167313178625,1559515417000,2019-06-02,15:43:37,Pacific Daylight Time,138203134,aoc,Alexandria Ocasio-Cortez,,"✅ Medicare for All IS sound policy - one may disagree w/ it, but plenty of other countries have single payer + better outcomes than the US ✅ M4A IS good politics - it polls VERY well in swing states ✅ “Third-Way” (aka lobbyist-backed Dems) WILL lose the presidency to Trump",[],[],[],2157,5528,36846,[],[],https://twitter.com/AOC/status/1135316065238622208,False,,0,,,,,,,"[{'user_id': '138203134', 'username': 'AOC'}]",
1135204062205566977,1135190462535471104,1559488714000,2019-06-02,08:18:34,Pacific Daylight Time,138203134,aoc,Alexandria Ocasio-Cortez,,"Sorry - should clarify!  They’re yours to pick up at Queens Pride and our Pride events all month.  (Fun fact: we sometimes make limited edition campaign swag solely for in-person events, for people who organize. 🐣 but if there’s interest, we can put these buttons in the shop)",[],[],[],385,404,10349,[],[],https://twitter.com/AOC/status/1135204062205566977,False,,0,,,,,,,"[{'user_id': '138203134', 'username': 'AOC'}]",
1135190462535471104,1135190462535471104,1559485471000,2019-06-02,07:24:31,Pacific Daylight Time,138203134,aoc,Alexandria Ocasio-Cortez,,"Hey everyone - I was super excited to march in Queens Pride today, but sadly I came down with a really bad cold this weekend and won’t be able to make it 😭  Our organizers will be marching + tabling at the festival with resources for the community. Celebrate extra for me! 💕🌈",[],[],[],2063,2539,43255,[],[],https://twitter.com/AOC/status/1135190462535471104,False,,0,,,,,,,"[{'user_id': '138203134', 'username': 'AOC'}]",
1134459280579604480,1134458586841698304,1559311144000,2019-05-31,06:59:04,Pacific Daylight Time,138203134,aoc,Alexandria Ocasio-Cortez,,"& I mean improve ALL people’s lives, not only “swing voters’” lives.  If all you want to talk about is wages but not the wage gap; marijuana but not criminal justice reform; trade deals but not labor; feminism but not trans rights, it’s YOU diminishing your electorate, not them.",[],[],[],777,5346,32383,[],[],https://twitter.com/AOC/status/1134459280579604480,False,,0,,,,,,,"[{'user_id': '138203134', 'username': 'AOC'}]",
1134173432025886720,1134171797002293249,1559242992000,2019-05-30,12:03:12,Pacific Daylight Time,138203134,aoc,Alexandria Ocasio-Cortez,,"(I do want to say that while there was some real intense BS at times, the people I worked with there were incredible. I made close, trusted friendships that I still have to this day✨ being in the weeds with people day and day out can create incredible bonds)",[],[],[],226,517,9295,[],[],https://twitter.com/AOC/status/1134173432025886720,False,,0,,,,,,,"[{'user_id': '138203134', 'username': 'AOC'}]",
1134153315594448896,1134145430428798977,1559238196000,2019-05-30,10:43:16,Pacific Daylight Time,138203134,aoc,Alexandria Ocasio-Cortez,,"Some people have brought up Congressional dorms - certainly a possibility.  This does happen informally; lots of members live in the same building/apt. Key to any solution (dorm, stipend, w/e) is compatibility w family/spouse- many work overtime, unrecognized, to support members.",[],[],[],261,579,6300,[],[],https://twitter.com/AOC/status/1134153315594448896,False,,0,,,,,,,"[{'user_id': '138203134', 'username': 'AOC'}]",
1134150939483488258,1134145430428798977,1559237630000,2019-05-30,10:33:50,Pacific Daylight Time,138203134,aoc,Alexandria Ocasio-Cortez,,"There are plenty of examples. Another big one is spousal loopholes. They’re tough discussions & politically unpopular.  It’s one under-discussed side to cracking the nut of money in politics.  Multi-millionaires can also weaponize these convos to their advantage, for cuts.",[],[],[],136,782,7627,[],[],https://twitter.com/AOC/status/1134150939483488258,False,,0,,,,,,,"[{'user_id': '138203134', 'username': 'AOC'}]",
1134149305739239424,1134145430428798977,1559237240000,2019-05-30,10:27:20,Pacific Daylight Time,138203134,aoc,Alexandria Ocasio-Cortez,,"For ex, members of Congress have strict restrictions that most of the public don’t have.  1 case: bc of our jobs we *have* to have 2 residences & pay for it out of pocket. BUT we‘re banned from writing it off as a work expense.  Boo hoo, right? Well, that incentivizes loopholes.",[],[],[],220,553,5228,[],[],https://twitter.com/AOC/status/1134149305739239424,False,,0,,,,,,,"[{'user_id': '138203134', 'username': 'AOC'}]",
1134147925297258498,1134145430428798977,1559236911000,2019-05-30,10:21:51,Pacific Daylight Time,138203134,aoc,Alexandria Ocasio-Cortez,,"Keeping it real, the 🐘 in the room w/ passing a lobbying ban on members requires a nearly-impossible discussion about Congressional pay.  It is understandably unpopular to discuss giving Congress any raises or perks - & bc of that, there’s incentive to keep $ loopholes open. /2",[],[],[],235,706,6315,[],[],https://twitter.com/AOC/status/1134147925297258498,False,,0,,,,,,,"[{'user_id': '138203134', 'username': 'AOC'}]",
1134136091450236928,1134135062037966849,1559234090000,2019-05-30,09:34:50,Pacific Daylight Time,138203134,aoc,Alexandria Ocasio-Cortez,,Also LATINX outlets like @REMEZCLA did digital as well,['remezcla'],[],[],56,126,1830,[],[],https://twitter.com/AOC/status/1134136091450236928,False,,0,,,,,,,"[{'user_id': '138203134', 'username': 'AOC'}, {'user_id': '17768320', 'username': 'REMEZCLA'}]",
1134135694685851648,1134135062037966849,1559233995000,2019-05-30,09:33:15,Pacific Daylight Time,138203134,aoc,Alexandria Ocasio-Cortez,,"Other early outlets included: - online progressive outlets (ex. @TYT) - local outlets (ex. @WNYC, @villagevoice) - nonprofit outlets (ex. @theintercept) - WOMEN’S outlets (ex. @Refinery29, & the day or two before, @voguemagazine digital)","['tyt', 'wnyc', 'villagevoice', 'theintercept', 'refinery29', 'voguemagazine']",[],[],50,217,2395,[],[],https://twitter.com/AOC/status/1134135694685851648,False,,0,,,,,,,"[{'user_id': '138203134', 'username': 'AOC'}, {'user_id': '393588826', 'username': 'TYT'}, {'user_id': '6576492', 'username': 'WNYC'}, {'user_id': '22059385', 'username': 'villagevoice'}, {'user_id': '2329066872', 'username': 'theintercept'}, {'user_id': '19546942', 'username': 'Refinery29'}, {'user_id': '136361303', 'username': 'voguemagazine'}]",
1133564756302938112,1133405733196898304,1559097873000,2019-05-28,19:44:33,Pacific Daylight Time,138203134,aoc,Alexandria Ocasio-Cortez,,Don’t let them bully you out of liking Voyager!!,"['johniadarola', 'briebriejoy']",[],[],124,150,2182,[],[],https://twitter.com/AOC/status/1133564756302938112,False,,0,,,,,,,"[{'user_id': '138203134', 'username': 'AOC'}, {'user_id': '25694156', 'username': 'johniadarola'}, {'user_id': '1332630685', 'username': 'briebriejoy'}]",
1133562375561469952,1133405733196898304,1559097305000,2019-05-28,19:35:05,Pacific Daylight Time,138203134,aoc,Alexandria Ocasio-Cortez,,"A TNG Q episode, perhaps",['briebriejoy'],[],[],697,327,10796,[],[],https://twitter.com/AOC/status/1133562375561469952,False,,0,,,,,,,"[{'user_id': '138203134', 'username': 'AOC'}, {'user_id': '1332630685', 'username': 'briebriejoy'}]",
1133542870693105666,1133535069711343616,1559092655000,2019-05-28,18:17:35,Pacific Daylight Time,138203134,aoc,Alexandria Ocasio-Cortez,,"Use real citrus juice for your sours, people!  You deserve so much better than what you’re settling for 😭",[],[],[],1069,2931,51426,[],[],https://twitter.com/AOC/status/1133542870693105666,False,,0,,,,,,,"[{'user_id': '138203134', 'username': 'AOC'}]",
1133540427565547520,1133535069711343616,1559092072000,2019-05-28,18:07:52,Pacific Daylight Time,138203134,aoc,Alexandria Ocasio-Cortez,,At the event I will also unveil my newest platform policy: Abolish Sour Mix 2020 😉,[],[],[],758,2709,48900,[],[],https://twitter.com/AOC/status/1133540427565547520,False,,0,,,,,,,"[{'user_id': '138203134', 'username': 'AOC'}]",
1133539002425008129,1133535069711343616,1559091732000,2019-05-28,18:02:12,Pacific Daylight Time,138203134,aoc,Alexandria Ocasio-Cortez,,"A Garibaldi/Garibaldi spritz is an underrated brunch cocktail.  (For those reading: it’s a Campari&OJ. Pull back on the Campari so it’s not too “woof.” For the spritz, add prosecco or sparkling water, depending on how forward you want it.  Mocktail: replace Campari w/ pom juice!)",['lukeoneil47'],[],[],77,114,2804,[],[],https://twitter.com/AOC/status/1133539002425008129,False,,0,,,,,,,"[{'user_id': '138203134', 'username': 'AOC'}, {'user_id': '108338399', 'username': 'lukeoneil47'}]",
1133494952535764992,1133493345819484161,1559081230000,2019-05-28,15:07:10,Pacific Daylight Time,138203134,aoc,Alexandria Ocasio-Cortez,,"All of this is to say that words matter, and can have consequences for safety.  For those who believe in “free speech”: whose free speech do you believe in?  Bc some folks using free speech to defend racism are also supporting folks passing laws to allow running over protesters.",[],[],[],1666,4582,29489,[],[],https://twitter.com/AOC/status/1133494952535764992,False,,0,,,,,,,"[{'user_id': '138203134', 'username': 'AOC'}]",
1133494055923589123,1133493345819484161,1559081016000,2019-05-28,15:03:36,Pacific Daylight Time,138203134,aoc,Alexandria Ocasio-Cortez,,"I don’t even get to see all of them. Just the ones that have been flagged as particularly troubling.  It happens whenever Fox gets particularly aggressive + hateful, too. Young interns have to constantly hear hateful messages (far beyond disagreement) from ppl we don’t even rep.",[],[],[],763,3007,22589,[],[],https://twitter.com/AOC/status/1133494055923589123,False,,0,,,,,,,"[{'user_id': '138203134', 'username': 'AOC'}]",
1133062596460974080,1133062594279936000,1558978148000,2019-05-27,10:29:08,Pacific Daylight Time,138203134,aoc,Alexandria Ocasio-Cortez,,"This is not a critique of congestion pricing per se, but it’s to say you can’t just tag any random climate policy + call it GND.  Nowhere in the text do we mention congestion pricing.  If you’re a journalist that’s going to report on/talk about the GND, READ THE RESOLUTION.",[],[],[],701,2597,20382,[],[],https://twitter.com/AOC/status/1133062596460974080,False,,0,,,,,,,"[{'user_id': '138203134', 'username': 'AOC'}]",
1132995670229606400,1132995670229606400,1558962192000,2019-05-27,06:03:12,Pacific Daylight Time,138203134,aoc,Alexandria Ocasio-Cortez,,"Today, #MemorialDay, we honor the lives of all those who gave their lives, both abroad and at home, in service to our country.  It’s a hard day for many. Take time to be there for one another; to check in, share stories, reflect, or mark quietly with a moment of gratitude.",[],[],[],986,5456,35204,['#memorialday'],[],https://twitter.com/AOC/status/1132995670229606400,False,,0,,,,,,,"[{'user_id': '138203134', 'username': 'AOC'}]",
1132849652351455232,1132848411407814656,1558927379000,2019-05-26,20:22:59,Pacific Daylight Time,138203134,aoc,Alexandria Ocasio-Cortez,,"🎶We need a Green New Deal/ To save our planet for sure/ Lots of sun and wind power, Will help us endure! 🎶  Jerry is 97 years old and dedicates his Instagram to spreading joy and acts of kindness. This is his second song of support, and he writes them himself! 😭",[],[],[],883,3489,35893,[],[],https://twitter.com/AOC/status/1132849652351455232,False,,0,,,,,,,"[{'user_id': '138203134', 'username': 'AOC'}]",
1132337107953889280,1132333655961919488,1558805178000,2019-05-25,10:26:18,Pacific Daylight Time,138203134,aoc,Alexandria Ocasio-Cortez,,"Notice the people willing to explain this away, yet when Ilhan’s words are taken out of context, they are the 1st to jump on her.  Look at how these accusations are selectively enforced on the left, esp when it’s the *alt-right* actually committing antisemitic violence in the US.",[],[],[],1423,5347,38553,[],[],https://twitter.com/AOC/status/1132337107953889280,False,,0,,,,,,,"[{'user_id': '138203134', 'username': 'AOC'}]",
1131922734211043329,1131916272441208834,1558706384000,2019-05-24,06:59:44,Pacific Daylight Time,138203134,aoc,Alexandria Ocasio-Cortez,,"It ALL started with everyday people.  You would really be surprised how much work here gets started because a journalist picked up on a story, or advocates organized people to command notice of an issue.  It’s inspiring how much power everyday people have. We just need to use it.",[],[],[],689,4719,37192,[],[],https://twitter.com/AOC/status/1131922734211043329,False,,0,,,,,,,"[{'user_id': '138203134', 'username': 'AOC'}]",
1131921962928943104,1131916272441208834,1558706200000,2019-05-24,06:56:40,Pacific Daylight Time,138203134,aoc,Alexandria Ocasio-Cortez,,We held the hearing. PrEP is going generic a year early.  It was thanks to: - Everyday people who advocated & didn’t quit until someone listened - A young staffer who listened & dug in - Committee staff that took her seriously - Generous leadership that cultivates the next gen /5,[],[],[],208,3459,29992,[],[],https://twitter.com/AOC/status/1131921962928943104,False,,0,,,,,,,"[{'user_id': '138203134', 'username': 'AOC'}]",
1131920548236288000,1131916272441208834,1558705863000,2019-05-24,06:51:03,Pacific Daylight Time,138203134,aoc,Alexandria Ocasio-Cortez,,"Chairman/woman leadership varies widely in style.  For ex, Seniority matters a LOT in Congress. But Chairman Cummings is generous w/ junior members. He invests a lot of time in training a high standard of excellence on the Committee of ALL members.  So he gave us a rare shot. /4",[],[],[],76,935,10821,[],[],https://twitter.com/AOC/status/1131920548236288000,False,,0,,,,,,,"[{'user_id': '138203134', 'username': 'AOC'}]",
1131919075989426182,1131916272441208834,1558705512000,2019-05-24,06:45:12,Pacific Daylight Time,138203134,aoc,Alexandria Ocasio-Cortez,,"In working with our staffer, Oversight Committee was able to pull in  request a great deal of docs and evidence in the case.  Bc Dems won the House, Dems control committees + Chairs.  It was the leadership of the Chairman @RepCummings that brought the issue to a hearing. /3",['repcummings'],[],[],79,1035,10844,[],[],https://twitter.com/AOC/status/1131919075989426182,False,,0,,,,,,,"[{'user_id': '138203134', 'username': 'AOC'}, {'user_id': '787373558', 'username': 'RepCummings'}]",
1131918140437344256,1131916272441208834,1558705289000,2019-05-24,06:41:29,Pacific Daylight Time,138203134,aoc,Alexandria Ocasio-Cortez,,"After vetting the case these organizers presented, she saw that it seemed they were. She passed it by me and our office engaged the Oversight Committee.  Committee staffers are CRITICAL. They have the expertise, tenure, relationships, etc to investigate issues + inquiries. /2",[],[],[],54,1037,11301,[],[],https://twitter.com/AOC/status/1131918140437344256,False,,0,,,,,,,"[{'user_id': '138203134', 'username': 'AOC'}]",
1131916272441208834,1131916272441208834,1558704843000,2019-05-24,06:34:03,Pacific Daylight Time,138203134,aoc,Alexandria Ocasio-Cortez,,Let’s talk abt how Gov works behind the scenes: Remember that Big Pharma hearing last week?  Here’s how it happened.  A 23 y/o staffer in my office met w/ local HIV advocates. They argued the CDC held the patent for PrEP & Gilead was price gouging.  She picked it up + dug in. /1,[],[],[],1063,10000,44112,[],[],https://twitter.com/AOC/status/1131916272441208834,False,,0,,,,,,,"[{'user_id': '138203134', 'username': 'AOC'}]",
1131307351494025216,1131305005661605888,1558559665000,2019-05-22,14:14:25,Pacific Daylight Time,138203134,aoc,Alexandria Ocasio-Cortez,,This hits too close to home 🙃,['notquitefrodo'],[],[],43,81,1018,[],[],https://twitter.com/AOC/status/1131307351494025216,False,,0,,,,,,,"[{'user_id': '138203134', 'username': 'AOC'}, {'user_id': '713390006', 'username': 'notquitefrodo'}]",
1131206490176610309,1131204943610880007,1558535618000,2019-05-22,07:33:38,Pacific Daylight Time,138203134,aoc,Alexandria Ocasio-Cortez,,"When I ran last year, everyone and their cousin endorsed my opponent.  After he lost,did people imply that the Gov’s endorsement wasn’t powerful anymore? That virtually every single union in NYC no longer had influence?  No! It was about the candidates and the race. It always is.",[],[],[],298,1036,13875,[],[],https://twitter.com/AOC/status/1131206490176610309,False,,0,,,,,,,"[{'user_id': '138203134', 'username': 'AOC'}]",
1131205540628054021,1131204943610880007,1558535392000,2019-05-22,07:29:52,Pacific Daylight Time,138203134,aoc,Alexandria Ocasio-Cortez,,"I endorsed @CabanForQueens for DA not out of a “power move,” but because to me it feels like the right thing to do.  Electing a public defender to a DA’s position with her platform could be transformative, &the organizers busting their butts on the ground have earned recognition.",['cabanforqueens'],[],[],141,895,11653,[],[],https://twitter.com/AOC/status/1131205540628054021,False,,0,,,,,,,"[{'user_id': '138203134', 'username': 'AOC'}, {'user_id': '1055070224305807361', 'username': 'CabanForQueens'}]",
1130970709839286272,1130904723849129985,1558479404000,2019-05-21,15:56:44,Pacific Daylight Time,138203134,aoc,Alexandria Ocasio-Cortez,,Thank you!,['shaunking'],[],[],285,329,9596,[],[],https://twitter.com/AOC/status/1130970709839286272,False,,0,,,,,,,"[{'user_id': '138203134', 'username': 'AOC'}, {'user_id': '755113', 'username': 'shaunking'}]",
1130887268527464448,1130887268527464448,1558459510000,2019-05-21,10:25:10,Pacific Daylight Time,138203134,aoc,Alexandria Ocasio-Cortez,,.@AyannaPressley is breathing 🔥 in FSC right now and it is glorious to watch.  Good job sis.,['ayannapressley'],[],[],268,448,6346,[],[],https://twitter.com/AOC/status/1130887268527464448,False,,0,,,,,,,"[{'user_id': '138203134', 'username': 'AOC'}, {'user_id': '31013444', 'username': 'AyannaPressley'}]",
1130860847566336001,1130858750758273024,1558453211000,2019-05-21,08:40:11,Pacific Daylight Time,138203134,aoc,Alexandria Ocasio-Cortez,,"Remember, Clinton was also impeached - that failed in Sen too. Our institutions didn’t suffer then, but they have been damaged greatly today w unwillingness to impeach.  Whether it’s Dem fear or GOP recklessness, doesn’t matter. Failure to impeach now is neglect of due process.",[],[],[],1812,7348,42854,[],[],https://twitter.com/AOC/status/1130860847566336001,False,,0,,,,,,,"[{'user_id': '138203134', 'username': 'AOC'}]",
1130539758877380613,1130539175114104833,1558376657000,2019-05-20,11:24:17,Pacific Daylight Time,138203134,aoc,Alexandria Ocasio-Cortez,,"Shout out to @RepJayapal for leading on Medicare for All. Her leadership on #M4A in the House has made it stronger than ever, and she also secured its first-ever hearing in the bill’s history. 💪🏽💜",['repjayapal'],[],[],346,1500,14980,['#m4a'],[],https://twitter.com/AOC/status/1130539758877380613,False,,0,,,,,,,"[{'user_id': '138203134', 'username': 'AOC'}, {'user_id': '815733290955112448', 'username': 'RepJayapal'}]",
1130155465596395520,1130155464317124608,1558285034000,2019-05-19,09:57:14,Pacific Daylight Time,138203134,aoc,Alexandria Ocasio-Cortez,,"It’s important to note that people shouldn’t be in a situation where they depend on a stranger’s enormous act of charity for this kind of liberation to begin with (aka college should be affordable), but it is an incredible act of community investment in this system as it is. 🎓",[],[],[],1908,5986,57060,[],[],https://twitter.com/AOC/status/1130155465596395520,False,,0,,,,,,,"[{'user_id': '138203134', 'username': 'AOC'}]",
1129795212920987650,1129795212920987650,1558199143000,2019-05-18,10:05:43,Pacific Daylight Time,138203134,aoc,Alexandria Ocasio-Cortez,,"How to Bail Out Main Street, Not Wall Street:  💳 Cap All Interest Rates at 15% (includes Credit Cards & all lending) 💸 Federal Student Loan Cancellation (for the past) 🎓 Tuition-Free Public Colleges (for the future) 👩🏾‍⚕️Medicare for All (no egregious medical debt w/single payer)",[],[],[],4496,17749,78378,[],[],https://twitter.com/AOC/status/1129795212920987650,False,,0,,,,,,,"[{'user_id': '138203134', 'username': 'AOC'}]",
1129747865205706753,1129746541412048901,1558187855000,2019-05-18,06:57:35,Pacific Daylight Time,138203134,aoc,Alexandria Ocasio-Cortez,,"White Supremacists get charged w hate crimes. Muslims get charged w terrorism.  This is a HUGE difference. Hate crimes are underreported, deprioritized, + aren’t treated as seriously as domestic terror charges.  Yet in the US, Neo-Nazi violence far outnumbers Islamic extremism.",[],[],[],1436,9808,47687,[],[],https://twitter.com/AOC/status/1129747865205706753,False,,0,,,,,,,"[{'user_id': '138203134', 'username': 'AOC'}]",
1129452432034029568,1129449948288815105,1558117418000,2019-05-17,11:23:38,Pacific Daylight Time,138203134,aoc,Alexandria Ocasio-Cortez,,What angers me about the GOP’s attempts to turn the United States into a far-right Christian theocracy is how dishonest they are about it.  At least be forthright about your desire to subvert and dismantle our democracy into a creepy theological order led by a mad king.,[],[],[],13951,22062,97601,[],[],https://twitter.com/AOC/status/1129452432034029568,False,,0,,,,,,,"[{'user_id': '138203134', 'username': 'AOC'}]",
1129451377946693632,1129449948288815105,1558117167000,2019-05-17,11:19:27,Pacific Daylight Time,138203134,aoc,Alexandria Ocasio-Cortez,,"The GOP doesn’t care about babies at all - especially brown, black, or poor ones. If they did, they’d: - cosponsor the Green New Deal or at LEAST have a real climate plan - guarantee healthcare so ALL can get prenatal care - not stand for the death+caging of babies on our border",[],[],[],5356,13907,74984,[],[],https://twitter.com/AOC/status/1129451377946693632,False,,0,,,,,,,"[{'user_id': '138203134', 'username': 'AOC'}]",
1129449948288815105,1129449948288815105,1558116826000,2019-05-17,11:13:46,Pacific Daylight Time,138203134,aoc,Alexandria Ocasio-Cortez,,"To the GOP extremists trying to invoke “the unborn” to jail people for abortion:  Where are you on climate change? OH right, you want to burn fossil fuels til there’s hell on Earth.  If they were truthful about their motives, they’d be consistent in their principles. They’re not.",[],[],[],6845,26254,128562,[],[],https://twitter.com/AOC/status/1129449948288815105,False,,0,,,,,,,"[{'user_id': '138203134', 'username': 'AOC'}]",
1129215937775845376,1129213168222375936,1558061034000,2019-05-16,19:43:54,Pacific Daylight Time,138203134,aoc,Alexandria Ocasio-Cortez,,"Yep! I’m just carrying it in the House and whipping votes there 😉 but if Mitch McConnell wants to actually use religious principles for good + reinstate usury laws, he’s more than welcome.",['adrielhampton'],[],[],189,119,1467,[],[],https://twitter.com/AOC/status/1129215937775845376,False,,0,,,,,,,"[{'user_id': '138203134', 'username': 'AOC'}, {'user_id': '15250836', 'username': 'adrielhampton'}]",
1128894602801553409,1128890390982123522,1557984421000,2019-05-15,22:27:01,Pacific Daylight Time,138203134,aoc,Alexandria Ocasio-Cortez,,"Ultimately, this is about women’s power.   When women are in control of their sexuality, it threatens a core element underpinning right-wing ideology: patriarchy.  It’s a brutal form of oppression to seize control of the 1 essential thing a person should command: their own body.",[],[],[],4199,29899,130773,[],[],https://twitter.com/AOC/status/1128894602801553409,False,,0,,,,,,,"[{'user_id': '138203134', 'username': 'AOC'}]",
1128890390982123522,1128890390982123522,1557983417000,2019-05-15,22:10:17,Pacific Daylight Time,138203134,aoc,Alexandria Ocasio-Cortez,,"Abortion bans aren’t just about controlling women’s bodies.  They’re about controlling women’s sexuality. Owning women.  From limiting birth control to banning comprehensive sex ed, US religious fundamentalists are working hard to outlaw sex that falls outside their theology.",[],[],[],12231,87913,325536,[],[],https://twitter.com/AOC/status/1128890390982123522,False,,0,,,,,,,"[{'user_id': '138203134', 'username': 'AOC'}]",
