id,conversation_id,created_at,date,time,timezone,user_id,username,name,place,tweet,mentions,urls,photos,replies_count,retweets_count,likes_count,hashtags,cashtags,link,retweet,quote_url,video,near,geo,source,user_rt_id,user_rt,retweet_id,reply_to,retweet_date
951651923328987136,950841903188123649,1515726474000,2018-01-11,19:07:54,Pacific Daylight Time,1339835893,hillaryclinton,Hillary Clinton,,Nancy has a record of beating the odds - from DC to CA - where she helped Gov Brown do a fantastic job. All who know her are sending strength & love as she faces this latest challenge.  Onward my friend. -H,['nancyemcfadden'],[],[],82,193,778,[],[],https://twitter.com/HillaryClinton/status/951651923328987136,False,,0,,,,,,,"[{'user_id': '1339835893', 'username': 'HillaryClinton'}, {'user_id': '3280010282', 'username': 'NancyEMcFadden'}]",
948244463138328577,948244159986651136,1514914072000,2018-01-02,09:27:52,Pacific Daylight Time,1339835893,hillaryclinton,Hillary Clinton,,Families across America had to start 2018 worried that their kids wouldn’t have health care. Failing to act now shows the true face of Republicans & their donor-driven immoral agenda. You control the Senate agenda @SenateMajLdr. Enough is enough.,['senatemajldr'],[],[],6342,7924,28405,[],[],https://twitter.com/HillaryClinton/status/948244463138328577,False,,0,,,,,,,"[{'user_id': '1339835893', 'username': 'HillaryClinton'}, {'user_id': '1249982359', 'username': 'senatemajldr'}]",
947313751992274944,947313751992274944,1514692173000,2017-12-30,19:49:33,Pacific Daylight Time,1339835893,hillaryclinton,Hillary Clinton,,"The Iranian people, especially the young, are protesting for the freedom and future they deserve. I hope their government responds peacefully and supports their hopes.",[],[],[],7867,18789,109901,[],[],https://twitter.com/HillaryClinton/status/947313751992274944,False,,0,,,,,,,"[{'user_id': '1339835893', 'username': 'HillaryClinton'}]",
944279653883228160,944277382684463105,1513968788000,2017-12-22,10:53:08,Pacific Daylight Time,1339835893,hillaryclinton,Hillary Clinton,,Thank you to everyone who has donated to Onward Together in our first year -- we’re only able to support these great groups because of you. Let’s do even more in 2018. Onward!,[],[],[],3171,2803,14312,[],[],https://twitter.com/HillaryClinton/status/944279653883228160,False,,0,,,,,,,"[{'user_id': '1339835893', 'username': 'HillaryClinton'}]",
944279421065814016,944277382684463105,1513968732000,2017-12-22,10:52:12,Pacific Daylight Time,1339835893,hillaryclinton,Hillary Clinton,,"Along with @IndivisibleTeam, @ColorOfChange, @EmergeAmerica, @swingleft, and @runforsomething, I know these groups will continue to do the incredible work of making our democracy stronger in 2018, and I'm proud to be on their team.","['indivisibleteam', 'colorofchange', 'emergeamerica', 'swingleft', 'runforsomething']",[],[],554,2231,11111,[],[],https://twitter.com/HillaryClinton/status/944279421065814016,False,,0,,,,,,,"[{'user_id': '1339835893', 'username': 'HillaryClinton'}, {'user_id': '810590628727914496', 'username': 'IndivisibleTeam'}, {'user_id': '27793335', 'username': 'ColorOfChange'}, {'user_id': '188803750', 'username': 'EmergeAmerica'}, {'user_id': '800704496246484992', 'username': 'swingleft'}, {'user_id': '809420163711909888', 'username': 'runforsomething'}]",
944279114172850177,944277382684463105,1513968659000,2017-12-22,10:50:59,Pacific Daylight Time,1339835893,hillaryclinton,Hillary Clinton,,"And with the help of @collectivepac, 23 African-American candidates have been elected to local, state, and federal offices since August 2016.",['collectivepac'],[],[],371,1432,5744,[],[],https://twitter.com/HillaryClinton/status/944279114172850177,False,,0,,,,,,,"[{'user_id': '1339835893', 'username': 'HillaryClinton'}, {'user_id': '737980128832159744', 'username': 'CollectivePAC'}]",
944278916621066240,944277382684463105,1513968612000,2017-12-22,10:50:12,Pacific Daylight Time,1339835893,hillaryclinton,Hillary Clinton,,More than 400 students and leaders met last month at the @votolatino Power Summit to share resources and tools for national advocacy.,['votolatino'],[],[],141,1055,4725,[],[],https://twitter.com/HillaryClinton/status/944278916621066240,False,,0,,,,,,,"[{'user_id': '1339835893', 'username': 'HillaryClinton'}, {'user_id': '9589252', 'username': 'votolatino'}]",
944278786874527744,944277382684463105,1513968581000,2017-12-22,10:49:41,Pacific Daylight Time,1339835893,hillaryclinton,Hillary Clinton,,The team at @latinovictoryus is working to elect more Latino candidates at every level of government.,['latinovictoryus'],[],[],264,1197,5121,[],[],https://twitter.com/HillaryClinton/status/944278786874527744,False,,0,,,,,,,"[{'user_id': '1339835893', 'username': 'HillaryClinton'}, {'user_id': '2302481323', 'username': 'latinovictoryus'}]",
944278119237681152,944277382684463105,1513968422000,2017-12-22,10:47:02,Pacific Daylight Time,1339835893,hillaryclinton,Hillary Clinton,,"At @alliance4youth, young people are using local organizing to address economic inequality, attacks on voting rights, and more.",['alliance4youth'],[],[],187,1157,4896,[],[],https://twitter.com/HillaryClinton/status/944278119237681152,False,,0,,,,,,,"[{'user_id': '1339835893', 'username': 'HillaryClinton'}, {'user_id': '843952980034383872', 'username': 'alliance4youth'}]",
944277880028237826,944277382684463105,1513968365000,2017-12-22,10:46:05,Pacific Daylight Time,1339835893,hillaryclinton,Hillary Clinton,,"450 brand-new civic leaders and activists attended the very first @ArenaSummit -- and they're on track to train 5,000 people by the end of 2018.",['arenasummit'],[],[],159,1295,5429,[],[],https://twitter.com/HillaryClinton/status/944277880028237826,False,,0,,,,,,,"[{'user_id': '1339835893', 'username': 'HillaryClinton'}, {'user_id': '814917353515417601', 'username': 'arenasummit'}]",
944277660087324674,944277382684463105,1513968312000,2017-12-22,10:45:12,Pacific Daylight Time,1339835893,hillaryclinton,Hillary Clinton,,The organizers at @iVoteFund worked with partners on the ground to get automatic voter registration on the ballot in Nevada.,['ivotefund'],[],[],311,1635,6843,[],[],https://twitter.com/HillaryClinton/status/944277660087324674,False,,0,,,,,,,"[{'user_id': '1339835893', 'username': 'HillaryClinton'}, {'user_id': '2294811674', 'username': 'iVoteFund'}]",
944277382684463105,944277382684463105,1513968246000,2017-12-22,10:44:06,Pacific Daylight Time,1339835893,hillaryclinton,Hillary Clinton,,"Onward Together is ending 2017 by supporting six more incredible organizations fighting to protect voting rights and to make it easier for young, diverse candidates to get on the ballot and get elected.",[],[],[],3646,10628,49253,[],[],https://twitter.com/HillaryClinton/status/944277382684463105,False,,0,,,,,,,"[{'user_id': '1339835893', 'username': 'HillaryClinton'}]",
941390586845597696,941153786600607745,1513279980000,2017-12-14,11:33:00,Pacific Daylight Time,1339835893,hillaryclinton,Hillary Clinton,,"@ELaffGarb, thinking of you, @nelba_MG, and all the Sandy Hook families this week. Thank you for your courage.","['elaffgarb', 'dhochsprung', 'nelba_mg']",[],[],38,452,1861,[],[],https://twitter.com/HillaryClinton/status/941390586845597696,False,,0,,,,,,,"[{'user_id': '1339835893', 'username': 'HillaryClinton'}, {'user_id': '823738296', 'username': 'ELaffGarb'}, {'user_id': '716350590', 'username': 'DHochsprung'}, {'user_id': '4699964858', 'username': 'Nelba_MG'}]",
940786378069049344,940786378069049344,1513135926000,2017-12-12,19:32:06,Pacific Daylight Time,1339835893,hillaryclinton,Hillary Clinton,,"Tonight, Alabama voters elected a senator who'll make them proud.   And if Democrats can win in Alabama, we can -- and must -- compete everywhere.  Onward!",[],[],[],11018,79328,435816,[],[],https://twitter.com/HillaryClinton/status/940786378069049344,False,,0,,,,,,,"[{'user_id': '1339835893', 'username': 'HillaryClinton'}]",
940751455782391808,940751455782391808,1513127600000,2017-12-12,17:13:20,Pacific Daylight Time,1339835893,hillaryclinton,Hillary Clinton,,Mayor Ed Lee’s death is a terrible loss for the people of San Francisco. He was a good friend & a vocal advocate for the city he served & loved. My thoughts are with his family.,[],[],[],963,4531,41873,[],[],https://twitter.com/HillaryClinton/status/940751455782391808,False,,0,,,,,,,"[{'user_id': '1339835893', 'username': 'HillaryClinton'}]",
938849829521907712,938848512564965376,1512674217000,2017-12-07,11:16:57,Pacific Daylight Time,1339835893,hillaryclinton,Hillary Clinton,,"I’m going to keep tweeting about this, and speaking out every chance I get, until it is fixed.",[],[],[],2794,4684,28330,[],[],https://twitter.com/HillaryClinton/status/938849829521907712,False,,0,,,,,,,"[{'user_id': '1339835893', 'username': 'HillaryClinton'}]",
938849659321290754,938848512564965376,1512674176000,2017-12-07,11:16:16,Pacific Daylight Time,1339835893,hillaryclinton,Hillary Clinton,,"So in these surreal times, let’s rally together & take action.  Call your House and Senate members at 202-224-3121 and tell them to take care of kids now and protect our seniors, the poor & vulnerable from future attacks. Tell them that it’s the very least they can do.",[],[],[],988,8078,25284,[],[],https://twitter.com/HillaryClinton/status/938849659321290754,False,,0,,,,,,,"[{'user_id': '1339835893', 'username': 'HillaryClinton'}]",
938849468019036161,938848512564965376,1512674130000,2017-12-07,11:15:30,Pacific Daylight Time,1339835893,hillaryclinton,Hillary Clinton,,"How is it that in the middle of dividing up $1.5 trillion dollars between corporations & the ultra-wealthy, Republicans can’t find the time & money to take care of children? These are perverse priorities. Congress needs to pass CHIP now, as they have every year since the 1990s.",[],[],[],1007,7649,18514,[],[],https://twitter.com/HillaryClinton/status/938849468019036161,False,,0,,,,,,,"[{'user_id': '1339835893', 'username': 'HillaryClinton'}]",
938849087381819392,938848512564965376,1512674040000,2017-12-07,11:14:00,Pacific Daylight Time,1339835893,hillaryclinton,Hillary Clinton,,"It gets worse. During the campaign I warned that the Rs would come after social security, Medicare, & Medicaid & now they are. Imagine buying a Rolex & paying for it with money you saved to take care of your kids. That’s what Congress is doing w/ your tax dollars.",[],[],[],1486,8455,19118,[],[],https://twitter.com/HillaryClinton/status/938849087381819392,False,,0,,,,,,,"[{'user_id': '1339835893', 'username': 'HillaryClinton'}]",
938848879142989829,938848512564965376,1512673990000,2017-12-07,11:13:10,Pacific Daylight Time,1339835893,hillaryclinton,Hillary Clinton,,"Meanwhile, Senate Republicans rushed to pass so-called tax reform - a giveaway for those who least need it.",[],[],[],577,3515,12179,[],[],https://twitter.com/HillaryClinton/status/938848879142989829,False,,0,,,,,,,"[{'user_id': '1339835893', 'username': 'HillaryClinton'}]",
938848781528981505,938848512564965376,1512673967000,2017-12-07,11:12:47,Pacific Daylight Time,1339835893,hillaryclinton,Hillary Clinton,,"The Children's Health Insurance Program, which provides health care for 9 million kids & has been reauthorized on a bipartisan basis every year for almost 2 decades, is hanging in limbo because Congress let it expire over 2 months ago.",[],[],[],579,6563,17120,[],[],https://twitter.com/HillaryClinton/status/938848781528981505,False,,0,,,,,,,"[{'user_id': '1339835893', 'username': 'HillaryClinton'}]",
938848512564965376,938848512564965376,1512673903000,2017-12-07,11:11:43,Pacific Daylight Time,1339835893,hillaryclinton,Hillary Clinton,,"There’s a lot to be frustrated by right now, to say the least. Here’s something that we should be able to fix.",[],[],[],2369,8909,43364,[],[],https://twitter.com/HillaryClinton/status/938848512564965376,False,,0,,,,,,,"[{'user_id': '1339835893', 'username': 'HillaryClinton'}]",
937059004013977600,937059004013977600,1512247250000,2017-12-02,12:40:50,Pacific Daylight Time,1339835893,hillaryclinton,Hillary Clinton,,Sometimes it’s hard to know what to do after a loss. Not this time.  This tax bill is only going to get worse as people learn more about it. There are 6 GOP Senators that have to run on it & 2 open seats in 2018.  We all need to get to work.,[],[],[],13463,63537,216627,[],[],https://twitter.com/HillaryClinton/status/937059004013977600,False,,0,,,,,,,"[{'user_id': '1339835893', 'username': 'HillaryClinton'}]",
931292070312140804,931022121190469638,1510872306000,2017-11-16,14:45:06,Pacific Daylight Time,1339835893,hillaryclinton,Hillary Clinton,,"Two friends on a perfect day. Sincerely, me.","['bensplatt', 'dearevanhansen']",[],[],367,2656,23956,[],[],https://twitter.com/HillaryClinton/status/931292070312140804,False,,0,,,,,,,"[{'user_id': '1339835893', 'username': 'HillaryClinton'}, {'user_id': '237047303', 'username': 'BenSPLATT'}, {'user_id': '2915629133', 'username': 'DearEvanHansen'}]",
929402248102383616,929402248102383616,1510421738000,2017-11-11,09:35:38,Pacific Daylight Time,1339835893,hillaryclinton,Hillary Clinton,,"Thank you to all who have worn our country's uniform, and the families who serve with them. Happy Veterans Day.",[],[],[],2530,12732,90494,[],[],https://twitter.com/HillaryClinton/status/929402248102383616,False,,0,,,,,,,"[{'user_id': '1339835893', 'username': 'HillaryClinton'}]",
928283650860486659,928279927396368384,1510155043000,2017-11-08,07:30:43,Pacific Daylight Time,1339835893,hillaryclinton,Hillary Clinton,,"As we celebrate, let’s also remember the work ahead. Proud that groups that Onward Together supports—including @SwingLeft, which is laser-focused on taking back the House—have been making incredible progress in the fight for 2018 and beyond. Onward!",['swingleft'],[],[],884,3454,20240,[],[],https://twitter.com/HillaryClinton/status/928283650860486659,False,,0,,,,,,,"[{'user_id': '1339835893', 'username': 'HillaryClinton'}, {'user_id': '800704496246484992', 'username': 'swingleft'}]",
928283343648587777,928279927396368384,1510154970000,2017-11-08,07:29:30,Pacific Daylight Time,1339835893,hillaryclinton,Hillary Clinton,,"So many groups own a piece of last night's victory, from @theDemocrats to @EMILYsList to @TheDLCC. It's remarkable to watch our Democratic family—groups with decades of victories and those born in the aftermath of the last election—team up to make nights like last night possible.","['thedemocrats', 'emilyslist']",[],[],423,2824,17672,[],[],https://twitter.com/HillaryClinton/status/928283343648587777,False,,0,,,,,,,"[{'user_id': '1339835893', 'username': 'HillaryClinton'}, {'user_id': '14377605', 'username': 'TheDemocrats'}, {'user_id': '63262233', 'username': 'emilyslist'}]",
928282921643003906,928279927396368384,1510154869000,2017-11-08,07:27:49,Pacific Daylight Time,1339835893,hillaryclinton,Hillary Clinton,,And the important work done by @ColorofChange’s PAC was instrumental in winning the district attorney race in Philadelphia.,['colorofchange'],[],[],130,1507,7536,[],[],https://twitter.com/HillaryClinton/status/928282921643003906,False,,0,,,,,,,"[{'user_id': '1339835893', 'username': 'HillaryClinton'}, {'user_id': '27793335', 'username': 'ColorOfChange'}]",
928282631397134337,928279927396368384,1510154800000,2017-11-08,07:26:40,Pacific Daylight Time,1339835893,hillaryclinton,Hillary Clinton,,"Our friends at @IndivisibleTeam report that their local groups made more than 600,000 calls into the Commonwealth to help elect @RalphNortham @FairfaxJustin @MarkHerringVA.","['indivisibleteam', 'ralphnortham', 'fairfaxjustin', 'markherringva']",[],[],149,1788,8350,[],[],https://twitter.com/HillaryClinton/status/928282631397134337,False,,0,,,,,,,"[{'user_id': '1339835893', 'username': 'HillaryClinton'}, {'user_id': '810590628727914496', 'username': 'IndivisibleTeam'}, {'user_id': '331036671', 'username': 'RalphNortham'}, {'user_id': '780606002', 'username': 'FairfaxJustin'}, {'user_id': '205299497', 'username': 'MarkHerringVA'}]",
928281815542128641,928279927396368384,1510154606000,2017-11-08,07:23:26,Pacific Daylight Time,1339835893,hillaryclinton,Hillary Clinton,,".@EmergeAmerica-trained candidates won all across the country, including 9 of the seats Democrats won in Virginia's House of Delegates.",['emergeamerica'],[],[],177,1827,8688,[],[],https://twitter.com/HillaryClinton/status/928281815542128641,False,,0,,,,,,,"[{'user_id': '1339835893', 'username': 'HillaryClinton'}, {'user_id': '188803750', 'username': 'EmergeAmerica'}]",
928281041927921669,928279927396368384,1510154421000,2017-11-08,07:20:21,Pacific Daylight Time,1339835893,hillaryclinton,Hillary Clinton,,"They tell me about 10% of first-time candidates usually win, but 40% of @runforsomething candidates came out on top yesterday.",['runforsomething'],[],[],221,2629,12071,[],[],https://twitter.com/HillaryClinton/status/928281041927921669,False,,0,,,,,,,"[{'user_id': '1339835893', 'username': 'HillaryClinton'}, {'user_id': '809420163711909888', 'username': 'runforsomething'}]",
928280098813472768,928279927396368384,1510154196000,2017-11-08,07:16:36,Pacific Daylight Time,1339835893,hillaryclinton,Hillary Clinton,,Congratulations to @RunforSomething founders @amandalitman + @RossMoRock for a huge night! 25 of the local candidates they helped to recruit and run won.,"['runforsomething', 'amandalitman', 'rossmorock']",[],[],259,2424,12265,[],[],https://twitter.com/HillaryClinton/status/928280098813472768,False,,0,,,,,,,"[{'user_id': '1339835893', 'username': 'HillaryClinton'}, {'user_id': '809420163711909888', 'username': 'runforsomething'}, {'user_id': '3488471', 'username': 'amandalitman'}, {'user_id': '18695802', 'username': 'RossMoRock'}]",
928279927396368384,928279927396368384,1510154155000,2017-11-08,07:15:55,Pacific Daylight Time,1339835893,hillaryclinton,Hillary Clinton,,Last night was a great reminder of what’s possible when we come together and fight for what we believe in. So I wanted to take a few minutes to celebrate the extraordinary successes of a few groups I—and Onward Together—proudly fight alongside.,[],[],[],3688,18068,108502,[],[],https://twitter.com/HillaryClinton/status/928279927396368384,False,,0,,,,,,,"[{'user_id': '1339835893', 'username': 'HillaryClinton'}]",
927938766576201728,927877148249075712,1510072816000,2017-11-07,08:40:16,Pacific Daylight Time,1339835893,hillaryclinton,Hillary Clinton,,"And if you live in New York state like I do, there are a lot of important races today, so go out and vote—I did!",[],[],[],891,2062,12505,[],[],https://twitter.com/HillaryClinton/status/927938766576201728,False,,0,,,,,,,"[{'user_id': '1339835893', 'username': 'HillaryClinton'}]",
927938290304548864,927877148249075712,1510072703000,2017-11-07,08:38:23,Pacific Daylight Time,1339835893,hillaryclinton,Hillary Clinton,,New Jersey: you have the chance to elect @PhilMurphyNJ @SheilaOliverNJ and other great Dems today. Take it!,"['philmurphynj', 'sheilaolivernj']",[],[],508,2377,11046,[],[],https://twitter.com/HillaryClinton/status/927938290304548864,False,,0,,,,,,,"[{'user_id': '1339835893', 'username': 'HillaryClinton'}, {'user_id': '3438358100', 'username': 'PhilMurphyNJ'}, {'user_id': '1578735846', 'username': 'SheilaOliverNJ'}]",
927937963064987648,927877148249075712,1510072625000,2017-11-07,08:37:05,Pacific Daylight Time,1339835893,hillaryclinton,Hillary Clinton,,Virginians: my friends @RalphNortham @FairfaxJustin @MarkHerringVA need you to show up and vote to get across the finish line.,"['ralphnortham', 'fairfaxjustin', 'markherringva']",[],[],454,2508,7577,[],[],https://twitter.com/HillaryClinton/status/927937963064987648,False,,0,,,,,,,"[{'user_id': '1339835893', 'username': 'HillaryClinton'}, {'user_id': '331036671', 'username': 'RalphNortham'}, {'user_id': '780606002', 'username': 'FairfaxJustin'}, {'user_id': '205299497', 'username': 'MarkHerringVA'}]",
927876262722498560,927876262722498560,1510057914000,2017-11-07,04:31:54,Pacific Daylight Time,1339835893,hillaryclinton,Hillary Clinton,,"Live in VA, NJ, WA, NY or anywhere with an election today? Consider this my personal ask/nudge/plea for you to go to the polls and VOTE.",[],[],[],5565,28276,115282,[],[],https://twitter.com/HillaryClinton/status/927876262722498560,False,,0,,,,,,,"[{'user_id': '1339835893', 'username': 'HillaryClinton'}]",
925515496576962562,925515496576962562,1509495064000,2017-10-31,17:11:04,Pacific Daylight Time,1339835893,hillaryclinton,Hillary Clinton,,"New York's resilience is stronger than a cowardly act of terror. Thinking of the victims, their families, & the responders who saved lives.",[],[],[],4271,23069,139461,[],[],https://twitter.com/HillaryClinton/status/925515496576962562,False,,0,,,,,,,"[{'user_id': '1339835893', 'username': 'HillaryClinton'}]",
917559594880241664,917558102630830080,1507598229000,2017-10-09,18:17:09,Pacific Daylight Time,1339835893,hillaryclinton,Hillary Clinton,,Call Congress @ (202) 224-3121. Tell them we must work together to get this done for the children & families counting on CHIP. 7/7,[],[],[],2087,10835,28671,[],[],https://twitter.com/HillaryClinton/status/917559594880241664,False,,0,,,,,,,"[{'user_id': '1339835893', 'username': 'HillaryClinton'}]",
917559195448283139,917558102630830080,1507598134000,2017-10-09,18:15:34,Pacific Daylight Time,1339835893,hillaryclinton,Hillary Clinton,,"Grateful to the Senate Finance Committee for passing a strong and much needed bipartisan reauthorization bill. Now, let's get this done. 6/7",[],[],[],681,4691,20430,[],[],https://twitter.com/HillaryClinton/status/917559195448283139,False,,0,,,,,,,"[{'user_id': '1339835893', 'username': 'HillaryClinton'}]",
917558953923563523,917558102630830080,1507598076000,2017-10-09,18:14:36,Pacific Daylight Time,1339835893,hillaryclinton,Hillary Clinton,,The test of any society is how it treats its children. We cannot allow millions of kids to lose access to basic health care. 5/7,[],[],[],1732,7180,21985,[],[],https://twitter.com/HillaryClinton/status/917558953923563523,False,,0,,,,,,,"[{'user_id': '1339835893', 'username': 'HillaryClinton'}]",
917558682254282752,917558102630830080,1507598011000,2017-10-09,18:13:31,Pacific Daylight Time,1339835893,hillaryclinton,Hillary Clinton,,"Right now, many states are getting ready to send out notices to parents, letting them know that their kids’ coverage is in jeopardy. 4/7",[],[],[],545,4514,13300,[],[],https://twitter.com/HillaryClinton/status/917558682254282752,False,,0,,,,,,,"[{'user_id': '1339835893', 'username': 'HillaryClinton'}]",
917558214585208834,917558102630830080,1507597900000,2017-10-09,18:11:40,Pacific Daylight Time,1339835893,hillaryclinton,Hillary Clinton,,"Back in the '90s, Democrats and Republicans worked together to pass CHIP. Today, it covers 9 million kids. 2/7",[],[],[],444,4974,16052,[],[],https://twitter.com/HillaryClinton/status/917558214585208834,False,,0,,,,,,,"[{'user_id': '1339835893', 'username': 'HillaryClinton'}]",
917558102630830080,917558102630830080,1507597873000,2017-10-09,18:11:13,Pacific Daylight Time,1339835893,hillaryclinton,Hillary Clinton,,"This hasn't gotten enough attn: For the first time, Congress missed the deadline to reauthorize the Children's Health Insurance Program. 1/7",[],[],[],3330,46125,95903,[],[],https://twitter.com/HillaryClinton/status/917558102630830080,False,,0,,,,,,,"[{'user_id': '1339835893', 'username': 'HillaryClinton'}]",
914853632083877888,914853171478097922,1506953077000,2017-10-02,07:04:37,Pacific Daylight Time,1339835893,hillaryclinton,Hillary Clinton,,"Our grief isn't enough. We can and must put politics aside, stand up to the NRA, and work together to try to stop this from happening again.",[],[],[],27614,65016,217555,[],[],https://twitter.com/HillaryClinton/status/914853632083877888,False,,0,,,,,,,"[{'user_id': '1339835893', 'username': 'HillaryClinton'}]",
914853465926639618,914853171478097922,1506953038000,2017-10-02,07:03:58,Pacific Daylight Time,1339835893,hillaryclinton,Hillary Clinton,,"The crowd fled at the sound of gunshots.   Imagine the deaths if the shooter had a silencer, which the NRA wants to make easier to get.",[],[],[],30921,56784,161422,[],[],https://twitter.com/HillaryClinton/status/914853465926639618,False,,0,,,,,,,"[{'user_id': '1339835893', 'username': 'HillaryClinton'}]",
914853171478097922,914853171478097922,1506952967000,2017-10-02,07:02:47,Pacific Daylight Time,1339835893,hillaryclinton,Hillary Clinton,,"Las Vegas, we are grieving with you—the victims, those who lost loved ones, the responders, & all affected by this cold-blooded massacre.",[],[],[],4626,43214,210294,[],[],https://twitter.com/HillaryClinton/status/914853171478097922,False,,0,,,,,,,"[{'user_id': '1339835893', 'username': 'HillaryClinton'}]",
913498006615359488,913452227104202752,1506629871000,2017-09-28,13:17:51,Pacific Daylight Time,1339835893,hillaryclinton,Hillary Clinton,,"Julia, you're in our thoughts and our hearts. Inspired but not surprised to see you using your platform for good in this difficult moment.",['officialjld'],[],[],217,3502,29112,[],[],https://twitter.com/HillaryClinton/status/913498006615359488,False,,0,,,,,,,"[{'user_id': '1339835893', 'username': 'HillaryClinton'}, {'user_id': '502281810', 'username': 'OfficialJLD'}]",
910487525583671296,910487525583671296,1505912116000,2017-09-20,05:55:16,Pacific Daylight Time,1339835893,hillaryclinton,Hillary Clinton,,Nothing is more important than saving the Affordable Care Act from another cruel effort to take health care away from millions of people.,[],[],[],7455,39031,150224,[],[],https://twitter.com/HillaryClinton/status/910487525583671296,False,,0,,,,,,,"[{'user_id': '1339835893', 'username': 'HillaryClinton'}]",
