id,conversation_id,created_at,date,time,timezone,user_id,username,name,place,tweet,mentions,urls,photos,replies_count,retweets_count,likes_count,hashtags,cashtags,link,retweet,quote_url,video,near,geo,source,user_rt_id,user_rt,retweet_id,reply_to,retweet_date
1050122197845590017,1050122196641861632,1539203616000,2018-10-10,13:33:36,Pacific Daylight Time,1339835893,hillaryclinton,Hillary Clinton,,"They told me about their grief, and also about their anger and frustration toward a political system that couldn’t seem to take action to prevent other kids from dying from unnecessary gun violence.",[],[],[],275,466,2592,[],[],https://twitter.com/HillaryClinton/status/1050122197845590017,False,,0,,,,,,,"[{'user_id': '1339835893', 'username': 'HillaryClinton'}]",
1050122196641861632,1050122196641861632,1539203616000,2018-10-10,13:33:36,Pacific Daylight Time,1339835893,hillaryclinton,Hillary Clinton,,Some of the most painful and rewarding conversations I have had on the campaign trail were with parents who had lost their children to gun violence.,[],[],[],1865,3648,19446,[],[],https://twitter.com/HillaryClinton/status/1050122196641861632,False,,0,,,,,,,"[{'user_id': '1339835893', 'username': 'HillaryClinton'}]",
1050057500710588417,1050046804270682117,1539188191000,2018-10-10,09:16:31,Pacific Daylight Time,1339835893,hillaryclinton,Hillary Clinton,,"The world is watching. Northern Ireland has been a symbol to people everywhere of democracy’s power to transcend divisions and deliver prosperity, peace, and progress. We need that symbol, that reality, now more than ever.",[],[],[],344,706,3699,[],[],https://twitter.com/HillaryClinton/status/1050057500710588417,False,,0,,,,,,,"[{'user_id': '1339835893', 'username': 'HillaryClinton'}]",
1050057340660183041,1050046804270682117,1539188153000,2018-10-10,09:15:53,Pacific Daylight Time,1339835893,hillaryclinton,Hillary Clinton,,"Democracy is a habit. It must be practiced again and again. Yes, that means voting. But it also means debating and compromising, participating in shared institutions, and honoring the rights and needs of all citizens.",[],[],[],603,1383,6044,[],[],https://twitter.com/HillaryClinton/status/1050057340660183041,False,,0,,,,,,,"[{'user_id': '1339835893', 'username': 'HillaryClinton'}]",
1050055128810745856,1050046804270682117,1539187626000,2018-10-10,09:07:06,Pacific Daylight Time,1339835893,hillaryclinton,Hillary Clinton,,"It’s crucial that however it comes out, Brexit should not be allowed to undermine the peace and prosperity that has been so dearly won here.",[],[],[],179,462,2537,[],[],https://twitter.com/HillaryClinton/status/1050055128810745856,False,,0,,,,,,,"[{'user_id': '1339835893', 'username': 'HillaryClinton'}]",
1050053210663194624,1050046804270682117,1539187169000,2018-10-10,08:59:29,Pacific Daylight Time,1339835893,hillaryclinton,Hillary Clinton,,I do not come today as an authority with all the answers—only you will find those—but as a friend who knows how hard the people of Northern Ireland have worked and suffered to transcend old conflicts. You deserve a future worthy of that struggle.,[],[],[],185,439,2331,[],[],https://twitter.com/HillaryClinton/status/1050053210663194624,False,,0,,,,,,,"[{'user_id': '1339835893', 'username': 'HillaryClinton'}]",
1049772183705321472,1049772181465559042,1539120167000,2018-10-09,14:22:47,Pacific Daylight Time,1339835893,hillaryclinton,Hillary Clinton,,"Now is the time to bring human rights out of the ivory tower and into what Eleanor Roosevelt called ""small places close to home""—into neighborhoods and schools, offices, factories, and farms, and the hearts and daily interactions of men and women everywhere.",[],[],[],441,1790,9330,[],[],https://twitter.com/HillaryClinton/status/1049772183705321472,False,,0,,,,,,,"[{'user_id': '1339835893', 'username': 'HillaryClinton'}]",
1049772182635724800,1049772181465559042,1539120166000,2018-10-09,14:22:46,Pacific Daylight Time,1339835893,hillaryclinton,Hillary Clinton,,"In the years since, in country after country, human rights have come to be seen not as a high-minded luxury but as a core national interest. But we have urgent work to do.",[],[],[],269,883,4919,[],[],https://twitter.com/HillaryClinton/status/1049772182635724800,False,,0,,,,,,,"[{'user_id': '1339835893', 'username': 'HillaryClinton'}]",
1049772181465559042,1049772181465559042,1539120166000,2018-10-09,14:22:46,Pacific Daylight Time,1339835893,hillaryclinton,Hillary Clinton,,"Seventy years ago this December, 58 countries came together at the end of World War II to offer the world a roadmap for peace and prosperity strong enough to withstand the appeals of demagogues and the ravages of poverty and fear.",[],[],[],1141,5439,24163,[],[],https://twitter.com/HillaryClinton/status/1049772181465559042,False,,0,,,,,,,"[{'user_id': '1339835893', 'username': 'HillaryClinton'}]",
1048257349738291200,1048257349738291200,1538759002000,2018-10-05,10:03:22,Pacific Daylight Time,1339835893,hillaryclinton,Hillary Clinton,,Denis Mukwege and Nadia Murad’s work to end the use of sexual violence as a weapon of war has brought awareness to a horrific practice and helped survivors get the care they need. My heartfelt congratulations to both for their well-deserved Nobel Peace Prize.,[],[],[],1901,7125,35545,[],[],https://twitter.com/HillaryClinton/status/1048257349738291200,False,,0,,,,,,,"[{'user_id': '1339835893', 'username': 'HillaryClinton'}]",
1047952599654289408,1047952599654289408,1538686344000,2018-10-04,13:52:24,Pacific Daylight Time,1339835893,hillaryclinton,Hillary Clinton,,"A full 10 weeks since the administration's deadline to reunite families they separated at the border, over 100 families are still waiting. #FamiliesBelongTogether",[],[],[],2950,13517,42624,['#familiesbelongtogether'],[],https://twitter.com/HillaryClinton/status/1047952599654289408,False,,0,,,,,,,"[{'user_id': '1339835893', 'username': 'HillaryClinton'}]",
1046829045617500160,1046829030115356673,1538418468000,2018-10-01,11:27:48,Pacific Daylight Time,1339835893,hillaryclinton,Hillary Clinton,,"Pitch in to their campaigns if you can, reach out to friends in their districts to encourage their support, or start with a like or a follow. November 6th is only 36 days away, so there's no time to waste.",[],[],[],456,986,4402,[],[],https://twitter.com/HillaryClinton/status/1046829045617500160,False,,0,,,,,,,"[{'user_id': '1339835893', 'username': 'HillaryClinton'}]",
1046829030115356673,1046829030115356673,1538418464000,2018-10-01,11:27:44,Pacific Daylight Time,1339835893,hillaryclinton,Hillary Clinton,,"If you're angry and ready for change, there's a concrete way to fight back: help candidates with progressive values win their elections on November 6th.   Here are some excellent @runforsomething-endorsed candidates who deserve your support:",['runforsomething'],[],[],2247,8474,29391,[],[],https://twitter.com/HillaryClinton/status/1046829030115356673,False,,0,,,,,,,"[{'user_id': '1339835893', 'username': 'HillaryClinton'}, {'user_id': '809420163711909888', 'username': 'runforsomething'}]",
1044572887674507264,1044572880728555520,1537880558000,2018-09-25,06:02:38,Pacific Daylight Time,1339835893,hillaryclinton,Hillary Clinton,,"There are excellent candidates running all over the country who will raise wages, bring down health-care costs, fight for justice, and provide some much-needed congressional oversight of the White House. Make sure you're ready to vote for them.",[],[],[],1091,2114,7406,[],[],https://twitter.com/HillaryClinton/status/1044572887674507264,False,,0,,,,,,,"[{'user_id': '1339835893', 'username': 'HillaryClinton'}]",
1044572886554603520,1044572880728555520,1537880558000,2018-09-25,06:02:38,Pacific Daylight Time,1339835893,hillaryclinton,Hillary Clinton,,Have questions about voting? Call the DNC's voter hotline at 833-336-VOTE.,[],[],[],388,2147,5503,[],[],https://twitter.com/HillaryClinton/status/1044572886554603520,False,,0,,,,,,,"[{'user_id': '1339835893', 'username': 'HillaryClinton'}]",
1044572880728555520,1044572880728555520,1537880556000,2018-09-25,06:02:36,Pacific Daylight Time,1339835893,hillaryclinton,Hillary Clinton,,"In honor of National Voter Registration Day, I want to highlight some  tools you can use to get registered to vote and register friends. With only six weeks before the election, it's all hands on deck.",[],[],[],1716,12306,39068,[],[],https://twitter.com/HillaryClinton/status/1044572880728555520,False,,0,,,,,,,"[{'user_id': '1339835893', 'username': 'HillaryClinton'}]",
1043225832943169537,1043225824441315329,1537559395000,2018-09-21,12:49:55,Pacific Daylight Time,1339835893,hillaryclinton,Hillary Clinton,,"Donate your time or money to their campaigns if you can. Our government should represent us, and Congress is only 20% women right now. Let's change that ratio!",[],[],[],1128,1959,8078,[],[],https://twitter.com/HillaryClinton/status/1043225832943169537,False,,0,,,,,,,"[{'user_id': '1339835893', 'username': 'HillaryClinton'}]",
1043225824441315329,1043225824441315329,1537559393000,2018-09-21,12:49:53,Pacific Daylight Time,1339835893,hillaryclinton,Hillary Clinton,,"With a historic number of women running this year, we have a tremendous opportunity to make our government better reflect our country. We'd all be lucky to see these four extraordinary candidates win their races for Congress this fall:",[],[],[],1809,7264,34073,[],[],https://twitter.com/HillaryClinton/status/1043225824441315329,False,,0,,,,,,,"[{'user_id': '1339835893', 'username': 'HillaryClinton'}]",
1042777146220011520,1042777146220011520,1537452420000,2018-09-20,07:07:00,Pacific Daylight Time,1339835893,hillaryclinton,Hillary Clinton,,"A reported 211 families are still waiting to be reunited since the administration separated them at the border. It's been a full eight weeks since the deadline to reunite them, and we all need to continue speaking out about this inexcusable delay. #FamiliesBelongTogether",[],[],[],4406,15986,50148,['#familiesbelongtogether'],[],https://twitter.com/HillaryClinton/status/1042777146220011520,False,,0,,,,,,,"[{'user_id': '1339835893', 'username': 'HillaryClinton'}]",
1042067977003253760,1042067961832513536,1537283341000,2018-09-18,08:09:01,Pacific Daylight Time,1339835893,hillaryclinton,Hillary Clinton,,"Democracy works only when we accept that we’re in this together.   We can’t just ask, “Am I better off than I was four years ago?” We have to ask, “Are we better off? Are we as a country better, stronger, and fairer?” Ultimately, healing our country will come down to each of us.",[],[],[],6000,3267,13695,[],[],https://twitter.com/HillaryClinton/status/1042067977003253760,False,,0,,,,,,,"[{'user_id': '1339835893', 'username': 'HillaryClinton'}]",
1042067975489159169,1042067961832513536,1537283340000,2018-09-18,08:09:00,Pacific Daylight Time,1339835893,hillaryclinton,Hillary Clinton,,"Above all, we need to find a way to restitch our fraying social fabric and rekindle our civic spirit. We need to bring back civics education in our schools. We need systemic economic reforms that reduce inequality and give a strong voice to working families.",[],[],[],1326,2216,10486,[],[],https://twitter.com/HillaryClinton/status/1042067975489159169,False,,0,,,,,,,"[{'user_id': '1339835893', 'username': 'HillaryClinton'}]",
1042067974360842241,1042067961832513536,1537283340000,2018-09-18,08:09:00,Pacific Daylight Time,1339835893,hillaryclinton,Hillary Clinton,,"We need to improve and protect our elections, from instituting paper ballot backups to repairing the Voting Rights Act, getting secret money out of politics, and—you won't be surprised to hear my support for this—abolishing the Electoral College.",[],[],[],2773,2032,6999,[],[],https://twitter.com/HillaryClinton/status/1042067974360842241,False,,0,,,,,,,"[{'user_id': '1339835893', 'username': 'HillaryClinton'}]",
1042067972230184960,1042067961832513536,1537283339000,2018-09-18,08:08:59,Pacific Daylight Time,1339835893,hillaryclinton,Hillary Clinton,,"Then, we need to do some housecleaning. Just as Nixon’s abuses of power led to reforms, post-Trump all future presidential candidates should be required by law to release their tax returns. They also should not be exempt from ethics requirements and conflict-of-interest rules.",[],[],[],1680,2179,7357,[],[],https://twitter.com/HillaryClinton/status/1042067972230184960,False,,0,,,,,,,"[{'user_id': '1339835893', 'username': 'HillaryClinton'}]",
1042067970913169411,1042067961832513536,1537283339000,2018-09-18,08:08:59,Pacific Daylight Time,1339835893,hillaryclinton,Hillary Clinton,,"First: We’ve got to mobilize turnout in the midterms. There are fantastic candidates all over the country who’ll do great things, and we could finally see some congressional oversight of the White House.",[],[],[],645,1440,5238,[],[],https://twitter.com/HillaryClinton/status/1042067970913169411,False,,0,,,,,,,"[{'user_id': '1339835893', 'username': 'HillaryClinton'}]",
1042067969294180352,1042067961832513536,1537283339000,2018-09-18,08:08:59,Pacific Daylight Time,1339835893,hillaryclinton,Hillary Clinton,,"With our democracy in crisis and our institutions and traditions under siege, we need to do everything we can to fight back. Here's how.",[],[],[],996,1354,4798,[],[],https://twitter.com/HillaryClinton/status/1042067969294180352,False,,0,,,,,,,"[{'user_id': '1339835893', 'username': 'HillaryClinton'}]",
1042067968077836288,1042067961832513536,1537283338000,2018-09-18,08:08:58,Pacific Daylight Time,1339835893,hillaryclinton,Hillary Clinton,,"Whether it was stealing a Supreme Court seat, gerrymandering congressional districts to disenfranchise African Americans, or muzzling government climate scientists, Republicans were undermining American democracy long before Trump made it to the Oval Office.",[],[],[],1154,2522,7470,[],[],https://twitter.com/HillaryClinton/status/1042067968077836288,False,,0,,,,,,,"[{'user_id': '1339835893', 'username': 'HillaryClinton'}]",
1042067966861434880,1042067961832513536,1537283338000,2018-09-18,08:08:58,Pacific Daylight Time,1339835893,hillaryclinton,Hillary Clinton,,"We should be clear about this: The increasing radicalism and irresponsibility of the Republican Party, including decades of demeaning government, demonizing Democrats, and debasing norms, is what gave us Donald Trump.",[],[],[],2132,2074,6428,[],[],https://twitter.com/HillaryClinton/status/1042067966861434880,False,,0,,,,,,,"[{'user_id': '1339835893', 'username': 'HillaryClinton'}]",
1042067965645148161,1042067961832513536,1537283338000,2018-09-18,08:08:58,Pacific Daylight Time,1339835893,hillaryclinton,Hillary Clinton,,"There is a tendency, when talking about these things, to wring our hands about ""both sides."" But the truth is that this is not a symmetrical problem.",[],[],[],887,1129,4846,[],[],https://twitter.com/HillaryClinton/status/1042067965645148161,False,,0,,,,,,,"[{'user_id': '1339835893', 'username': 'HillaryClinton'}]",
1042067964403572736,1042067961832513536,1537283338000,2018-09-18,08:08:58,Pacific Daylight Time,1339835893,hillaryclinton,Hillary Clinton,,Donald Trump refuses to be subject to the law. The legitimacy of our elections is in doubt. The president is waging war on the truth. The administration is undermining the national unity that makes democracy possible. And then there's the breathtaking corruption.,[],[],[],18134,3413,12172,[],[],https://twitter.com/HillaryClinton/status/1042067964403572736,False,,0,,,,,,,"[{'user_id': '1339835893', 'username': 'HillaryClinton'}]",
1042067963166318592,1042067961832513536,1537283337000,2018-09-18,08:08:57,Pacific Daylight Time,1339835893,hillaryclinton,Hillary Clinton,,"On the day after the election, I hoped my fears for our country's future were overblown.   They were not.",[],[],[],2896,5215,20974,[],[],https://twitter.com/HillaryClinton/status/1042067963166318592,False,,0,,,,,,,"[{'user_id': '1339835893', 'username': 'HillaryClinton'}]",
1040312397062463488,1040312390569664512,1536864778000,2018-09-13,11:52:58,Pacific Daylight Time,1339835893,hillaryclinton,Hillary Clinton,,"In sum: Kavanaugh doesn't think judges should consider public safety or allow common-sense gun laws. Meanwhile, 96 Americans are killed with guns every day.   Call your senators: (202) 224-3121",[],[],[],2516,4978,16555,[],[],https://twitter.com/HillaryClinton/status/1040312397062463488,False,,0,,,,,,,"[{'user_id': '1339835893', 'username': 'HillaryClinton'}]",
1040312395154030593,1040312390569664512,1536864777000,2018-09-13,11:52:57,Pacific Daylight Time,1339835893,hillaryclinton,Hillary Clinton,,"“Gun bans and gun regulations that are not longstanding or sufficiently rooted in the text, history and tradition are not consistent with the Second Amendment individual right,"" he added.",[],[],[],558,1609,7553,[],[],https://twitter.com/HillaryClinton/status/1040312395154030593,False,,0,,,,,,,"[{'user_id': '1339835893', 'username': 'HillaryClinton'}]",
1040312393623064576,1040312390569664512,1536864777000,2018-09-13,11:52:57,Pacific Daylight Time,1339835893,hillaryclinton,Hillary Clinton,,"Judge Kavanaugh dissented when the D.C. appeals court ruled in 2011 that the city could ban semiautomatic rifles and require handgun registration. He argued that courts shouldn't consider the public safety benefits of gun laws: ""Our task is to apply the Constitution.""",[],[],[],774,1846,4999,[],[],https://twitter.com/HillaryClinton/status/1040312393623064576,False,,0,,,,,,,"[{'user_id': '1339835893', 'username': 'HillaryClinton'}]",
1040312390569664512,1040312390569664512,1536864776000,2018-09-13,11:52:56,Pacific Daylight Time,1339835893,hillaryclinton,Hillary Clinton,,"Let's talk about Brett Kavanaugh's past rulings on guns. He's out of the mainstream, even among other conservative judges, in his willingness to strike down legislatures' public safety measures to prevent gun violence if they don't align with his politics.",[],[],[],2193,9954,33069,[],[],https://twitter.com/HillaryClinton/status/1040312390569664512,False,,0,,,,,,,"[{'user_id': '1339835893', 'username': 'HillaryClinton'}]",
1040237329779179521,1040237329779179521,1536846880000,2018-09-13,06:54:40,Pacific Daylight Time,1339835893,hillaryclinton,Hillary Clinton,,The administration is now seven weeks late in meeting its deadline to reunite families they separated at the border. Hundreds of families have spent the past seven weeks waiting and worrying. There's no possible excuse for continuing to keep them apart. #FamiliesBelongTogether,[],[],[],3881,20031,61137,['#familiesbelongtogether'],[],https://twitter.com/HillaryClinton/status/1040237329779179521,False,,0,,,,,,,"[{'user_id': '1339835893', 'username': 'HillaryClinton'}]",
1039864924552548352,1039864914486149121,1536758092000,2018-09-12,06:14:52,Pacific Daylight Time,1339835893,hillaryclinton,Hillary Clinton,,Let’s be clear: Women have just as much right as men to make the most personal health decisions without government interference. We are equal citizens and we will insist on nothing less in this country.   Please call your senators and relay the message: (202) 224-3121,[],[],[],3070,10182,37838,[],[],https://twitter.com/HillaryClinton/status/1039864924552548352,False,,0,,,,,,,"[{'user_id': '1339835893', 'username': 'HillaryClinton'}]",
1039864923365539840,1039864914486149121,1536758092000,2018-09-12,06:14:52,Pacific Daylight Time,1339835893,hillaryclinton,Hillary Clinton,,"Sen. @kamalaharris asked Brett Kavanaugh last week: ""Can you think of any laws that give the government the power to make decisions about the male body?"" He said he was not. Because there are none.",['kamalaharris'],[],[],1504,5933,27658,[],[],https://twitter.com/HillaryClinton/status/1039864923365539840,False,,0,,,,,,,"[{'user_id': '1339835893', 'username': 'HillaryClinton'}, {'user_id': '30354991', 'username': 'KamalaHarris'}]",
1039864922002386944,1039864914486149121,1536758091000,2018-09-12,06:14:51,Pacific Daylight Time,1339835893,hillaryclinton,Hillary Clinton,,"Imagine an America in which women are barred from getting IUDs or birth control pills, and doctors are criminalized for prescribing them. It's an America in which women would be punished for insisting on being full and equal partners in society.",[],[],[],1775,4040,14844,[],[],https://twitter.com/HillaryClinton/status/1039864922002386944,False,,0,,,,,,,"[{'user_id': '1339835893', 'username': 'HillaryClinton'}]",
1039864919573909506,1039864914486149121,1536758091000,2018-09-12,06:14:51,Pacific Daylight Time,1339835893,hillaryclinton,Hillary Clinton,,"When Kavanaugh called birth control ""abortion-inducing drugs,"" he made it clear that safe and legal abortion isn't the only fundamental reproductive right at grave risk if he is confirmed. Access to birth control is, too.",[],[],[],2169,4385,15160,[],[],https://twitter.com/HillaryClinton/status/1039864919573909506,False,,0,,,,,,,"[{'user_id': '1339835893', 'username': 'HillaryClinton'}]",
1039864915631190018,1039864914486149121,1536758090000,2018-09-12,06:14:50,Pacific Daylight Time,1339835893,hillaryclinton,Hillary Clinton,,Kavanaugh didn't use that term because he misunderstands the basic  science of birth control—the fact that birth control prevents fertilization of eggs in the first place. He used that term because it's a dog whistle to the extreme right.,[],[],[],1591,4401,17624,[],[],https://twitter.com/HillaryClinton/status/1039864915631190018,False,,0,,,,,,,"[{'user_id': '1339835893', 'username': 'HillaryClinton'}]",
1039864914486149121,1039864914486149121,1536758090000,2018-09-12,06:14:50,Pacific Daylight Time,1339835893,hillaryclinton,Hillary Clinton,,"I want to be sure we're all clear about something that Brett Kavanaugh said in his confirmation hearings last week. He referred to birth-control pills as ""abortion-inducing drugs."" That set off a lot of alarm bells for me, and it should for you, too.",[],[],[],19015,39229,133419,[],[],https://twitter.com/HillaryClinton/status/1039864914486149121,False,,0,,,,,,,"[{'user_id': '1339835893', 'username': 'HillaryClinton'}]",
1039536164947062785,1039536164947062785,1536679710000,2018-09-11,08:28:30,Pacific Daylight Time,1339835893,hillaryclinton,Hillary Clinton,,"May we always remember those we lost 17 years ago. May the love, bravery, and selflessness so many showed that day light our path forward.",[],[],[],5639,22503,144123,[],[],https://twitter.com/HillaryClinton/status/1039536164947062785,False,,0,,,,,,,"[{'user_id': '1339835893', 'username': 'HillaryClinton'}]",
1038045131998285825,1038045116835885056,1536324220000,2018-09-07,05:43:40,Pacific Daylight Time,1339835893,hillaryclinton,Hillary Clinton,,We're not fighting for the planet in some abstract sense here. We're fighting for our continued ability to live on it.   Call your senators: (202) 224-3121,[],[],[],3032,5358,18577,[],[],https://twitter.com/HillaryClinton/status/1038045131998285825,False,,0,,,,,,,"[{'user_id': '1339835893', 'username': 'HillaryClinton'}]",
1038045130840657920,1038045116835885056,1536324219000,2018-09-07,05:43:39,Pacific Daylight Time,1339835893,hillaryclinton,Hillary Clinton,,"Just last year, Kavanaugh ruled that the EPA's attempt to phase out hydrofluorocarbons, a particularly dangerous greenhouse gas found in refrigeration and air conditioning units, was outside its authority.",[],[],[],487,3252,11401,[],[],https://twitter.com/HillaryClinton/status/1038045130840657920,False,,0,,,,,,,"[{'user_id': '1339835893', 'username': 'HillaryClinton'}]",
1038045126394671104,1038045116835885056,1536324218000,2018-09-07,05:43:38,Pacific Daylight Time,1339835893,hillaryclinton,Hillary Clinton,,"In 2016, he argued that the Clean Air Act was a ""thin statute"" to support the Obama administration's Clean Power Plan to cut carbon pollution from power plants.",[],[],[],139,1045,2977,[],[],https://twitter.com/HillaryClinton/status/1038045126394671104,False,,0,,,,,,,"[{'user_id': '1339835893', 'username': 'HillaryClinton'}]",
1038045123634855936,1038045116835885056,1536324218000,2018-09-07,05:43:38,Pacific Daylight Time,1339835893,hillaryclinton,Hillary Clinton,,Kavanaugh wrote a majority opinion for the D.C. Circuit Court in 2012 that struck down a federal program to curb cross-state pollution from power plants.,[],[],[],127,1300,3264,[],[],https://twitter.com/HillaryClinton/status/1038045123634855936,False,,0,,,,,,,"[{'user_id': '1339835893', 'username': 'HillaryClinton'}]",
1038045121265057792,1038045116835885056,1536324217000,2018-09-07,05:43:37,Pacific Daylight Time,1339835893,hillaryclinton,Hillary Clinton,,"During the Obama years, Kavanaugh came down against the EPA in every one of the three major cases he heard about the agency's authority to regulate greenhouse gases.",[],[],[],184,1771,3872,[],[],https://twitter.com/HillaryClinton/status/1038045121265057792,False,,0,,,,,,,"[{'user_id': '1339835893', 'username': 'HillaryClinton'}]",
1038045120031903744,1038045116835885056,1536324217000,2018-09-07,05:43:37,Pacific Daylight Time,1339835893,hillaryclinton,Hillary Clinton,,"Replacing Kennedy with Kavanaugh would swing the Court to a new, hard-right majority that would rule against curbing greenhouse gases for years—maybe decades—that we can’t afford to waste on inaction.",[],[],[],212,1546,4134,[],[],https://twitter.com/HillaryClinton/status/1038045120031903744,False,,0,,,,,,,"[{'user_id': '1339835893', 'username': 'HillaryClinton'}]",
