id,conversation_id,created_at,date,time,timezone,user_id,username,name,place,tweet,mentions,urls,photos,replies_count,retweets_count,likes_count,hashtags,cashtags,link,retweet,quote_url,video,near,geo,source,user_rt_id,user_rt,retweet_id,reply_to,retweet_date
1104020251551903746,1104020251551903746,1552053914000,2019-03-08,06:05:14,Pacific Daylight Time,1339835893,hillaryclinton,Hillary Clinton,,Important legislation introduced yesterday: The Reproductive Rights Are Human Rights Act would correct the Trump administration's dangerous decision to remove reporting on reproductive rights from the State Department's annual reports on human rights practices around the world.,[],[],[],889,4119,16807,[],[],https://twitter.com/HillaryClinton/status/1104020251551903746,False,,0,,,,,,,"[{'user_id': '1339835893', 'username': 'HillaryClinton'}]",
1101954824554336262,1101928860722053120,1551561478000,2019-03-02,13:17:58,Pacific Daylight Time,1339835893,hillaryclinton,Hillary Clinton,,A second call you can make right now to help families who want to reunite with their kids:   Call your member of Congress and ask them to put pressure on CBP to grant asylum to parents applying in Mexicali today.   The Capitol switchboard number is 202-224-3121.,[],[],[],1950,4964,15496,[],[],https://twitter.com/HillaryClinton/status/1101954824554336262,False,,0,,,,,,,"[{'user_id': '1339835893', 'username': 'HillaryClinton'}]",
1101928860722053120,1101928860722053120,1551555287000,2019-03-02,11:34:47,Pacific Daylight Time,1339835893,hillaryclinton,Hillary Clinton,,".@fams2gether, @ACLU and others are in Mexicali today working to reunify families the administration has separated. Help by calling @CBP now at 1-855-681-1349 and demand that CBP allow parents to apply for asylum—their legal right—so they can be reunited with their children.","['fams2gether', 'aclu', 'cbp']",[],[],2285,7087,22932,[],[],https://twitter.com/HillaryClinton/status/1101928860722053120,False,,0,,,,,,,"[{'user_id': '1339835893', 'username': 'HillaryClinton'}, {'user_id': '1275136292', 'username': 'fams2gether'}, {'user_id': '13393052', 'username': 'ACLU'}, {'user_id': '16613128', 'username': 'CBP'}]",
1100882271802966018,1100882271802966018,1551305761000,2019-02-27,14:16:01,Pacific Daylight Time,1339835893,hillaryclinton,Hillary Clinton,,"The House just passed a bill to require background checks on all gun sales in the country. It's the first gun control legislation to pass since 1994. Thank @gabbygiffords, @lucymcbath, @speakerpelosi and so many others for their work on this issue by calling your senators!","['gabbygiffords', 'lucymcbath', 'speakerpelosi']",[],[],2661,14305,86222,[],[],https://twitter.com/HillaryClinton/status/1100882271802966018,False,,0,,,,,,,"[{'user_id': '1339835893', 'username': 'HillaryClinton'}, {'user_id': '44177383', 'username': 'GabbyGiffords'}, {'user_id': '947956236804337664', 'username': 'lucymcbath'}, {'user_id': '15764644', 'username': 'SpeakerPelosi'}]",
1100462059676946433,1100462057659469824,1551205575000,2019-02-26,10:26:15,Pacific Daylight Time,1339835893,hillaryclinton,Hillary Clinton,,"Permanent funding should be a bipartisan matter and easy to get done. Indeed, it should have been done already.   Call your member of Congress now and ask them to vote for the ""Never Forget the Heroes"" Act: (202) 224-3121",[],[],[],437,1428,6738,[],[],https://twitter.com/HillaryClinton/status/1100462059676946433,False,,0,,,,,,,"[{'user_id': '1339835893', 'username': 'HillaryClinton'}]",
1100462057659469824,1100462057659469824,1551205574000,2019-02-26,10:26:14,Pacific Daylight Time,1339835893,hillaryclinton,Hillary Clinton,,"An important thing you can do today: Call your member of Congress and ask her or him to vote for permanent funding for the September 11th Victim Compensation Fund, which is running out of money as people continue to suffer effects of the attacks.",[],[],[],928,5440,22434,[],[],https://twitter.com/HillaryClinton/status/1100462057659469824,False,,0,,,,,,,"[{'user_id': '1339835893', 'username': 'HillaryClinton'}]",
1100141336404078592,1100141334260842496,1551129108000,2019-02-25,13:11:48,Pacific Daylight Time,1339835893,hillaryclinton,Hillary Clinton,,"I met with @aijenpoo and @aliciagarza to talk about ways we could continue working together, and a partnership was born.","['aijenpoo', 'aliciagarza']",[],[],138,499,4162,[],[],https://twitter.com/HillaryClinton/status/1100141336404078592,False,,0,,,,,,,"[{'user_id': '1339835893', 'username': 'HillaryClinton'}, {'user_id': '142905425', 'username': 'aijenpoo'}, {'user_id': '57039392', 'username': 'aliciagarza'}]",
1100141335561101312,1100141334260842496,1551129108000,2019-02-25,13:11:48,Pacific Daylight Time,1339835893,hillaryclinton,Hillary Clinton,,"Since last summer, @OnwardTogether has raised more than $1.8 million for the groups working to protect the kids and families separated by ICE, including Families Belong Together, NDWA's initiative to fight the Trump administration's family separation policy.",['onwardtogether'],[],[],236,494,1891,[],[],https://twitter.com/HillaryClinton/status/1100141335561101312,False,,0,,,,,,,"[{'user_id': '1339835893', 'username': 'HillaryClinton'}, {'user_id': '821424486868254720', 'username': 'OnwardTogether'}]",
1100141334260842496,1100141334260842496,1551129108000,2019-02-25,13:11:48,Pacific Daylight Time,1339835893,hillaryclinton,Hillary Clinton,,"The National @DomesticWorkers Alliance has worked to protect domestic workers, immigrants, women, and their families for more than a decade, and I'm proud to say that NDWA has joined @OnwardTogether as an official partner.","['domesticworkers', 'onwardtogether']",[],[],563,1814,9405,[],[],https://twitter.com/HillaryClinton/status/1100141334260842496,False,,0,,,,,,,"[{'user_id': '1339835893', 'username': 'HillaryClinton'}, {'user_id': '307912317', 'username': 'domesticworkers'}, {'user_id': '821424486868254720', 'username': 'OnwardTogether'}]",
1099868899737288704,1099868899737288704,1551064154000,2019-02-24,19:09:14,Pacific Daylight Time,1339835893,hillaryclinton,Hillary Clinton,,"“Immigrants and women move humanity forward.” Well said, @chefjoseandres. #Oscars",['chefjoseandres'],[],[],2469,9297,61014,['#oscars'],[],https://twitter.com/HillaryClinton/status/1099868899737288704,False,,0,,,,,,,"[{'user_id': '1339835893', 'username': 'HillaryClinton'}, {'user_id': '73206956', 'username': 'chefjoseandres'}]",
1099332899248263170,1099332899248263170,1550936362000,2019-02-23,07:39:22,Pacific Daylight Time,1339835893,hillaryclinton,Hillary Clinton,,"I urge Nicolás Maduro to allow humanitarian aid inside Venezuela’s borders peacefully. People are in need of life-saving medicines, children are subsisting on one meal a day, and a peaceful delivery of food and supplies is to the benefit of all.",[],[],[],5873,18019,65286,[],[],https://twitter.com/HillaryClinton/status/1099332899248263170,False,,0,,,,,,,"[{'user_id': '1339835893', 'username': 'HillaryClinton'}]",
1099076213363146752,1099076213363146752,1550875163000,2019-02-22,14:39:23,Pacific Daylight Time,1339835893,hillaryclinton,Hillary Clinton,,The administration just put a gag rule in place that bars Title X health care providers from referring patients for safe and legal abortions.   It's an attack on Planned Parenthood and 1.6 million patients who may not be able to afford care anywhere else. #IStandWithPP #NoGagRule,[],[],[],10827,22187,58895,"['#istandwithpp', '#nogagrule']",[],https://twitter.com/HillaryClinton/status/1099076213363146752,False,,0,,,,,,,"[{'user_id': '1339835893', 'username': 'HillaryClinton'}]",
1098692734423101441,1098692734423101441,1550783735000,2019-02-21,13:15:35,Pacific Daylight Time,1339835893,hillaryclinton,Hillary Clinton,,"Congratulations to @IamMinyon and her co-authors on the @NAACP Image Award nominations of “For Colored Girls Who Have Considered Politics."" It's a wonderful, necessary book.","['iamminyon', 'naacp']",[],[],658,2148,12758,[],[],https://twitter.com/HillaryClinton/status/1098692734423101441,False,,0,,,,,,,"[{'user_id': '1339835893', 'username': 'HillaryClinton'}, {'user_id': '16528755', 'username': 'IamMinyon'}, {'user_id': '44988185', 'username': 'NAACP'}]",
1097579983856418822,1097579983856418822,1550518434000,2019-02-18,11:33:54,Pacific Daylight Time,1339835893,hillaryclinton,Hillary Clinton,,The real national emergencies:  - Relentless gun violence.  - Children separated from their families at the border. - Climate change. - Americans dying for lack of health care.,[],[],[],22808,43674,199312,[],[],https://twitter.com/HillaryClinton/status/1097579983856418822,False,,0,,,,,,,"[{'user_id': '1339835893', 'username': 'HillaryClinton'}]",
1096434674849759233,1096434674849759233,1550245371000,2019-02-15,07:42:51,Pacific Daylight Time,1339835893,hillaryclinton,Hillary Clinton,,"Democracy should mean free and fair access to the ballot box. But in America, voting rights are under attack. I’m honored to have been invited to join the 54th Bridge Crossing Jubilee in Selma, Alabama on March 3rd to march for voting rights with @liftourvote. #liftourvote2020",['liftourvote'],[],[],4139,6989,39833,['#liftourvote2020'],[],https://twitter.com/HillaryClinton/status/1096434674849759233,False,,0,,,,,,,"[{'user_id': '1339835893', 'username': 'HillaryClinton'}, {'user_id': '1090045726929940480', 'username': 'LiftOurVote'}]",
1096048618455347200,1096048613833216000,1550153328000,2019-02-14,06:08:48,Pacific Daylight Time,1339835893,hillaryclinton,Hillary Clinton,,"Join a cause today, support a gun-sense candidate, or find another way to pitch in.   We can save lives, honor victims, and give too many grieving communities the knowledge that ""Never again"" means ""Never again.""",[],[],[],688,2588,16039,[],[],https://twitter.com/HillaryClinton/status/1096048618455347200,False,,0,,,,,,,"[{'user_id': '1339835893', 'username': 'HillaryClinton'}]",
1096048617541038080,1096048613833216000,1550153328000,2019-02-14,06:08:48,Pacific Daylight Time,1339835893,hillaryclinton,Hillary Clinton,,"Just yesterday, the House Judiciary Committee voted to advance a measure that would require background checks for all gun sales and most gun transfers.  Rep. @LucyMcBath, who lost a child to gun violence, cast her vote by saying: ""For my son Jordan Davis, I vote aye.""",['lucymcbath'],[],[],509,3100,21738,[],[],https://twitter.com/HillaryClinton/status/1096048617541038080,False,,0,,,,,,,"[{'user_id': '1339835893', 'username': 'HillaryClinton'}, {'user_id': '947956236804337664', 'username': 'lucymcbath'}]",
1096048616588873729,1096048613833216000,1550153328000,2019-02-14,06:08:48,Pacific Daylight Time,1339835893,hillaryclinton,Hillary Clinton,,"We must remember and reaffirm that gun violence is not an intractable problem.   We will not accept it. We know what to do to solve it.   @MomsDemand, @Everytown, @AMarch4OurLives, and so many others are making progress every day.","['momsdemand', 'everytown', 'amarch4ourlives']",[],[],198,972,4302,[],[],https://twitter.com/HillaryClinton/status/1096048616588873729,False,,0,,,,,,,"[{'user_id': '1339835893', 'username': 'HillaryClinton'}, {'user_id': '1017637447', 'username': 'MomsDemand'}, {'user_id': '250386727', 'username': 'Everytown'}, {'user_id': '965015705123930114', 'username': 'AMarch4OurLives'}]",
1093717460010848257,1093717460010848257,1549597537000,2019-02-07,19:45:37,Pacific Daylight Time,1339835893,hillaryclinton,Hillary Clinton,,"I, our country, and Twitter will miss @JohnDingell’s quick wit, good heart, and profound sense of patriotism. My thoughts are with @RepDebDingell, the whole Dingell family, and the wide community of friends, constituents, and fellow Americans who admired and respected him.","['johndingell', 'repdebdingell']",[],[],622,3804,28599,[],[],https://twitter.com/HillaryClinton/status/1093717460010848257,False,,0,,,,,,,"[{'user_id': '1339835893', 'username': 'HillaryClinton'}, {'user_id': '109025212', 'username': 'JohnDingell'}, {'user_id': '2970279814', 'username': 'RepDebDingell'}]",
1093528928696918017,1093528928696918017,1549552588000,2019-02-07,07:16:28,Pacific Daylight Time,1339835893,hillaryclinton,Hillary Clinton,,"Pope Francis this week in the Arabian Peninsula, the first papal trip there in history: “You are a choir composed of numerous nations, languages and rites; a diversity that the Holy Spirit loves and wants to harmonize ever more, in order to make a symphony."" Amen.",[],[],[],1394,3307,21783,[],[],https://twitter.com/HillaryClinton/status/1093528928696918017,False,,0,,,,,,,"[{'user_id': '1339835893', 'username': 'HillaryClinton'}]",
1093185073745145857,1093185073745145857,1549470606000,2019-02-06,08:30:06,Pacific Daylight Time,1339835893,hillaryclinton,Hillary Clinton,,"""America is made stronger by the presence of immigrants, not walls."" —@StaceyAbrams",['staceyabrams'],[],[],4305,12895,79445,[],[],https://twitter.com/HillaryClinton/status/1093185073745145857,False,,0,,,,,,,"[{'user_id': '1339835893', 'username': 'HillaryClinton'}, {'user_id': '216065430', 'username': 'staceyabrams'}]",
1089994176937177090,1089960240559415298,1548709837000,2019-01-28,13:10:37,Pacific Daylight Time,1339835893,hillaryclinton,Hillary Clinton,,"You are an inspiration, my friend.",['chefjoseandres'],[],[],36,112,1279,[],[],https://twitter.com/HillaryClinton/status/1089994176937177090,False,,0,,,,,,,"[{'user_id': '1339835893', 'username': 'HillaryClinton'}, {'user_id': '73206956', 'username': 'chefjoseandres'}]",
1089993836489830400,1089993760929472514,1548709756000,2019-01-28,13:09:16,Pacific Daylight Time,1339835893,hillaryclinton,Hillary Clinton,,"Through a grant from José, Franco and Natalia Medina were able to invest in a USDA-grade cleaning station, freezer, and storage unit for their farm. Now they can expand to selling produce to restaurants and grocery stores.",[],[],[],231,965,6945,[],[],https://twitter.com/HillaryClinton/status/1089993836489830400,False,,0,,,,,,,"[{'user_id': '1339835893', 'username': 'HillaryClinton'}]",
1086460566175182848,1086375849807335424,1547867359000,2019-01-18,19:09:19,Pacific Daylight Time,1339835893,hillaryclinton,Hillary Clinton,,Whatever it takes to keep you with us Carl. I’m holding you to it.,['carlreiner'],[],[],377,1989,14035,[],[],https://twitter.com/HillaryClinton/status/1086460566175182848,False,,0,,,,,,,"[{'user_id': '1339835893', 'username': 'HillaryClinton'}, {'user_id': '637338906', 'username': 'carlreiner'}]",
1085949334288584704,1085949334288584704,1547745471000,2019-01-17,09:17:51,Pacific Daylight Time,1339835893,hillaryclinton,Hillary Clinton,,"Thank you, Mary Oliver, for giving so many of us words to live by.  ""Tell me, what is it you plan to do with your one wild and precious life?""",[],[],[],1038,6006,39406,[],[],https://twitter.com/HillaryClinton/status/1085949334288584704,False,,0,,,,,,,"[{'user_id': '1339835893', 'username': 'HillaryClinton'}]",
1085185906313703424,1085185906313703424,1547563456000,2019-01-15,06:44:16,Pacific Daylight Time,1339835893,hillaryclinton,Hillary Clinton,,"Yesterday, the New York state legislature voted to pass new bills allowing early voting, pre-registration for 16- and 17-year-olds, and consolidated state and federal primaries. They're great first steps to fixing our democracy. Congratulations to all, and let's keep going!",[],[],[],4339,13713,88737,[],[],https://twitter.com/HillaryClinton/status/1085185906313703424,False,,0,,,,,,,"[{'user_id': '1339835893', 'username': 'HillaryClinton'}]",
1084889898203660288,1084889898203660288,1547492882000,2019-01-14,11:08:02,Pacific Daylight Time,1339835893,hillaryclinton,Hillary Clinton,,"@KLSecondCity Please pass on to Nora that I'm thinking of her, rooting for her, and a proud member of #TeamNora.",['klsecondcity'],[],[],38,76,400,['#teamnora'],[],https://twitter.com/HillaryClinton/status/1084889898203660288,False,,0,,,,,,,"[{'user_id': '1339835893', 'username': 'HillaryClinton'}, {'user_id': '23936128', 'username': 'KLsecondcity'}]",
1084086220827836422,1084086064048992256,1547301271000,2019-01-12,05:54:31,Pacific Daylight Time,1339835893,hillaryclinton,Hillary Clinton,,Americans can't afford another day. Call your senator and demand a vote to re-open: (202) 224-3121  And make sure your friends and family in Kentucky call @senatemajldr:  Louisville: (502) 582-6304 Lexington: (859) 224-8286 Bowling Green: (270) 781-1673 Washington: (202) 224-2541,['senatemajldr'],[],[],2162,10108,24357,[],[],https://twitter.com/HillaryClinton/status/1084086220827836422,False,,0,,,,,,,"[{'user_id': '1339835893', 'username': 'HillaryClinton'}, {'user_id': '1249982359', 'username': 'senatemajldr'}]",
1084086064048992256,1084086064048992256,1547301233000,2019-01-12,05:53:53,Pacific Daylight Time,1339835893,hillaryclinton,Hillary Clinton,,"As of today, this shutdown is the longest in history.   The costs are already high: People are missing paychecks, losing business, or working without pay. Our national parks are overrun with trash. The FDA and FBI warn of the harm to our food safety and national security.",[],[],[],5690,17742,72018,[],[],https://twitter.com/HillaryClinton/status/1084086064048992256,False,,0,,,,,,,"[{'user_id': '1339835893', 'username': 'HillaryClinton'}]",
1083039875090264065,1082661684035104768,1547051802000,2019-01-09,08:36:42,Pacific Daylight Time,1339835893,hillaryclinton,Hillary Clinton,,"Update: She won!   Congrats to Senator-elect @JenniferBoysko, the first Democratic victory of 2019 in Virginia—and not the last by any stretch.",['jenniferboysko'],[],[],563,2260,15685,[],[],https://twitter.com/HillaryClinton/status/1083039875090264065,False,,0,,,,,,,"[{'user_id': '1339835893', 'username': 'HillaryClinton'}, {'user_id': '912926138', 'username': 'JenniferBoysko'}]",
1082649827899523073,1082649827899523073,1546958808000,2019-01-08,06:46:48,Pacific Daylight Time,1339835893,hillaryclinton,Hillary Clinton,,"A week ago, 200,000 previously uninsured Virginians got access to health care through Medicaid expansion thanks to votes from @KathyKLTran, @PWCDanica, @JCarrollFoy, @DelegateFowler, and other 2017 state leg winners. Elections have consequences, and sometimes they're great ones.","['kathykltran', 'pwcdanica', 'jcarrollfoy', 'delegatefowler']",[],[],697,2962,15370,[],[],https://twitter.com/HillaryClinton/status/1082649827899523073,False,,0,,,,,,,"[{'user_id': '1339835893', 'username': 'HillaryClinton'}, {'user_id': '1226177652', 'username': 'KathyKLTran'}, {'user_id': '169586297', 'username': 'pwcdanica'}, {'user_id': '833159137554989056', 'username': 'JCarrollFoy'}, {'user_id': '829574053782548480', 'username': 'DelegateFowler'}]",
1076176803126001665,1076176794393415680,1545415518000,2018-12-21,10:05:18,Pacific Daylight Time,1339835893,hillaryclinton,Hillary Clinton,,"There was a 10-point increase in youth turnout from 2014 to 2018, due in part to the hard work done by @Alliance4Youth. More than 30% of young people voted in 2018! In Chicago, young people outperformed all other generations on Election Day for the first time ever.",['alliance4youth'],[],[],452,830,4217,[],[],https://twitter.com/HillaryClinton/status/1076176803126001665,False,,0,,,,,,,"[{'user_id': '1339835893', 'username': 'HillaryClinton'}, {'user_id': '843952980034383872', 'username': 'alliance4youth'}]",
1076176802387759104,1076176794393415680,1545415518000,2018-12-21,10:05:18,Pacific Daylight Time,1339835893,hillaryclinton,Hillary Clinton,,"Five @EmergeAmerica alumni are headed to Congress, and 145 were elected to state legislatures. Emerge alums also helped put an end to the Republican supermajorities in the Michigan and Pennsylvania senates.",['emergeamerica'],[],[],161,337,1511,[],[],https://twitter.com/HillaryClinton/status/1076176802387759104,False,,0,,,,,,,"[{'user_id': '1339835893', 'username': 'HillaryClinton'}, {'user_id': '188803750', 'username': 'EmergeAmerica'}]",
1076176801674772483,1076176794393415680,1545415518000,2018-12-21,10:05:18,Pacific Daylight Time,1339835893,hillaryclinton,Hillary Clinton,,"For many campaigns, @SwingLeft was the wave. On average, for their top 15 campaigns, Swing Left drove more than 50% of their canvassing shifts. More than 60,000 volunteers knocked an estimated 5 million doors and made 2.5 million phone calls.",['swingleft'],[],[],125,360,1402,[],[],https://twitter.com/HillaryClinton/status/1076176801674772483,False,,0,,,,,,,"[{'user_id': '1339835893', 'username': 'HillaryClinton'}, {'user_id': '800704496246484992', 'username': 'swingleft'}]",
1076176800676569088,1076176794393415680,1545415518000,2018-12-21,10:05:18,Pacific Daylight Time,1339835893,hillaryclinton,Hillary Clinton,,"In 2018, @LatinoVictoryUS increased their endorsed candidates 500% over the previous year. Of their 58 candidates, 43 candidates won, bringing their 2018 win rate to a whopping 74%. The number of Democratic Latina members of Congress nearly doubled.",['latinovictoryus'],[],[],84,315,1165,[],[],https://twitter.com/HillaryClinton/status/1076176800676569088,False,,0,,,,,,,"[{'user_id': '1339835893', 'username': 'HillaryClinton'}, {'user_id': '2302481323', 'username': 'latinovictoryus'}]",
1076176799883816965,1076176794393415680,1545415518000,2018-12-21,10:05:18,Pacific Daylight Time,1339835893,hillaryclinton,Hillary Clinton,,"In two years, @RunforSomething has recruited 28,000 young, diverse progressives who want to run for office and elected more than 200 of them to local office in 40 states. In 2018, their candidates were 3 of the 12 Texas House pick-ups and 3 of the 11 Florida House pick-ups.",['runforsomething'],[],[],77,381,1418,[],[],https://twitter.com/HillaryClinton/status/1076176799883816965,False,,0,,,,,,,"[{'user_id': '1339835893', 'username': 'HillaryClinton'}, {'user_id': '809420163711909888', 'username': 'runforsomething'}]",
1076176798872948742,1076176794393415680,1545415517000,2018-12-21,10:05:17,Pacific Daylight Time,1339835893,hillaryclinton,Hillary Clinton,,".@ArenaSummit supported 54 candidates in the 2018 election cycle, and 27 of their candidates on the ballot won their elections. Their 2018 New York candidates went 7 for 9—ensuring Democrats defeated the IDC, took back the N.Y. State Senate, and won a majority in the U.S. House.",['arenasummit'],[],[],45,266,1004,[],[],https://twitter.com/HillaryClinton/status/1076176798872948742,False,,0,,,,,,,"[{'user_id': '1339835893', 'username': 'HillaryClinton'}, {'user_id': '814917353515417601', 'username': 'arenasummit'}]",
1076176798159912961,1076176794393415680,1545415517000,2018-12-21,10:05:17,Pacific Daylight Time,1339835893,hillaryclinton,Hillary Clinton,,".@VotoLatino registered thousands of voters through online digital ads and targeting, peer-to-peer outreach through their local chapters, and national partner engagement. In Texas, where Voto Latino has had a program since 2010, early votes surpassed 2014 totals by 149%.",['votolatino'],[],[],72,323,1187,[],[],https://twitter.com/HillaryClinton/status/1076176798159912961,False,,0,,,,,,,"[{'user_id': '1339835893', 'username': 'HillaryClinton'}, {'user_id': '9589252', 'username': 'votolatino'}]",
1076176797413330944,1076176794393415680,1545415517000,2018-12-21,10:05:17,Pacific Daylight Time,1339835893,hillaryclinton,Hillary Clinton,,".@ColorOfChange PAC’s #VotingWhileBlack program reached more than 5 million voters, and now African Americans have a new cohort of officeholders at both the local and state level.",['colorofchange'],[],[],56,291,994,['#votingwhileblack'],[],https://twitter.com/HillaryClinton/status/1076176797413330944,False,,0,,,,,,,"[{'user_id': '1339835893', 'username': 'HillaryClinton'}, {'user_id': '27793335', 'username': 'ColorOfChange'}]",
1076176796658401281,1076176794393415680,1545415517000,2018-12-21,10:05:17,Pacific Daylight Time,1339835893,hillaryclinton,Hillary Clinton,,"Three candidates that @iVoteFund supported for Secretary of State won—all pick-ups, all young women, all Democrats. And they were able to raise and invest $7 million in Secretary of State races, their most ever.",['ivotefund'],[],[],36,273,1006,[],[],https://twitter.com/HillaryClinton/status/1076176796658401281,False,,0,,,,,,,"[{'user_id': '1339835893', 'username': 'HillaryClinton'}, {'user_id': '2294811674', 'username': 'iVoteFund'}]",
1076176795916034049,1076176794393415680,1545415517000,2018-12-21,10:05:17,Pacific Daylight Time,1339835893,hillaryclinton,Hillary Clinton,,".@CollectivePAC helped elect over 54 African Americans to local, state and federal offices, trained over 300 operatives and staff through the Black Campaign School, and engaged over 1.5 million black voters.",['collectivepac'],[],[],46,284,1002,[],[],https://twitter.com/HillaryClinton/status/1076176795916034049,False,,0,,,,,,,"[{'user_id': '1339835893', 'username': 'HillaryClinton'}, {'user_id': '737980128832159744', 'username': 'CollectivePAC'}]",
1076176795160989696,1076176794393415680,1545415517000,2018-12-21,10:05:17,Pacific Daylight Time,1339835893,hillaryclinton,Hillary Clinton,,"Nine @IndivisibleTeam-endorsed candidates won. Overall, the margin in their endorsed races swung 8 points to the left. Among races rated “Solid R,"" that swing was 15 points.",['indivisibleteam'],[],[],47,313,1144,[],[],https://twitter.com/HillaryClinton/status/1076176795160989696,False,,0,,,,,,,"[{'user_id': '1339835893', 'username': 'HillaryClinton'}, {'user_id': '810590628727914496', 'username': 'IndivisibleTeam'}]",
