id,conversation_id,created_at,date,time,timezone,user_id,username,name,place,tweet,mentions,urls,photos,replies_count,retweets_count,likes_count,hashtags,cashtags,link,retweet,quote_url,video,near,geo,source,user_rt_id,user_rt,retweet_id,reply_to,retweet_date
989576382664577025,989576382664577025,1524768369000,2018-04-26,11:46:09,Pacific Daylight Time,1249982359,senatemajldr,Leader McConnell,,".@SenatorLankford is giving Democrats their own chance to show that principled convictions matter more than political convenience. I'm proud to back his proposal, and glad to see the Rules Committee advance it to the #Senate floor yesterday.",['senatorlankford'],[],[],633,68,223,['#senate'],[],https://twitter.com/senatemajldr/status/989576382664577025,False,,0,,,,,,,"[{'user_id': '1249982359', 'username': 'senatemajldr'}, {'user_id': '225921757', 'username': 'SenatorLankford'}]",
989538262384611329,989538262384611329,1524759281000,2018-04-26,09:14:41,Pacific Daylight Time,1249982359,senatemajldr,Leader McConnell,,"After the #Senate confirms our 70th Secretary of @StateDept, we will vote on the nomination of Ric Grenell to serve as our Ambassador to Germany.",['statedept'],[],[],282,107,381,['#senate'],[],https://twitter.com/senatemajldr/status/989538262384611329,False,,0,,,,,,,"[{'user_id': '1249982359', 'username': 'senatemajldr'}, {'user_id': '9624742', 'username': 'StateDept'}]",
989498424558018560,989498424558018560,1524749783000,2018-04-26,06:36:23,Pacific Daylight Time,1249982359,senatemajldr,Leader McConnell,,"Today, the #Senate will confirm Mike Pompeo as our nation’s 70th Secretary of @StateDept on a bipartisan vote, the 2nd time in a little over a year that Mr. Pompeo has been confirmed on a bipartisan vote for one of @POTUS' @Cabinet positions.","['statedept', 'potus', 'cabinet']",[],[],351,264,912,['#senate'],[],https://twitter.com/senatemajldr/status/989498424558018560,False,,0,,,,,,,"[{'user_id': '1249982359', 'username': 'senatemajldr'}, {'user_id': '9624742', 'username': 'StateDept'}, {'user_id': '822215679726100480', 'username': 'POTUS'}, {'user_id': '818928162449068032', 'username': 'Cabinet'}]",
989213173545873409,989213173545873409,1524681773000,2018-04-25,11:42:53,Pacific Daylight Time,1249982359,senatemajldr,Leader McConnell,,"Tonight, 7:00 Eastern  ⬇️ I will be joining @marthamaccallum on @TheStoryFNC to discuss #Senate Democrats' continued historic obstruction of @POTUS' nominees.","['marthamaccallum', 'thestoryfnc', 'potus']",[],[],474,68,170,['#senate'],[],https://twitter.com/senatemajldr/status/989213173545873409,False,,0,,,,,,,"[{'user_id': '1249982359', 'username': 'senatemajldr'}, {'user_id': '46681100', 'username': 'marthamaccallum'}, {'user_id': '855120710871732226', 'username': 'TheStoryFNC'}, {'user_id': '822215679726100480', 'username': 'POTUS'}]",
988864205146284032,988864205146284032,1524598573000,2018-04-24,12:36:13,Pacific Daylight Time,1249982359,senatemajldr,Leader McConnell,,The passage of the historic #TaxCutsandJobsAct was just the latest illustration of the diverging paths Republicans and Democrats envision for the U.S. #economy.  #TaxReform is working for the American people.,[],[],[],647,106,423,"['#taxcutsandjobsact', '#economy', '#taxreform']",[],https://twitter.com/senatemajldr/status/988864205146284032,False,,0,,,,,,,"[{'user_id': '1249982359', 'username': 'senatemajldr'}]",
988780527686692864,988780527686692864,1524578623000,2018-04-24,07:03:43,Pacific Daylight Time,1249982359,senatemajldr,Leader McConnell,,#ICYMI → the #Senate Foreign Relations Cmte favorably recommended Mike Pompeo to be our nation's 70th Secretary of @StateDept. The Senate will vote to confirm him this week.,['statedept'],[],[],244,123,458,"['#icymi', '#senate']",[],https://twitter.com/senatemajldr/status/988780527686692864,False,,0,,,,,,,"[{'user_id': '1249982359', 'username': 'senatemajldr'}, {'user_id': '9624742', 'username': 'StateDept'}]",
988518763220922368,988518763220922368,1524516213000,2018-04-23,13:43:33,Pacific Daylight Time,1249982359,senatemajldr,Leader McConnell,,"The #Senate will also vote later today to advance the nomination of Kyle Duncan serve on the Fifth Circuit Court of Appeals, who’s legal credentials show @POTUS has made another outstanding choice.",['potus'],[],[],266,165,524,['#senate'],[],https://twitter.com/senatemajldr/status/988518763220922368,False,,0,,,,,,,"[{'user_id': '1249982359', 'username': 'senatemajldr'}, {'user_id': '822215679726100480', 'username': 'POTUS'}]",
988503447854108674,988503447854108674,1524512562000,2018-04-23,12:42:42,Pacific Daylight Time,1249982359,senatemajldr,Leader McConnell,,"Today, the Foreign Relations Cmte will consider @POTUS' choice for the next Secretary of @StateDept. It's hard to imagine a better nominee or someone more thoroughly qualified than Mike Pompeo.","['potus', 'statedept']",[],[],679,475,2282,[],[],https://twitter.com/senatemajldr/status/988503447854108674,False,,0,,,,,,,"[{'user_id': '1249982359', 'username': 'senatemajldr'}, {'user_id': '822215679726100480', 'username': 'POTUS'}, {'user_id': '9624742', 'username': 'StateDept'}]",
987044172795465729,987044171826515970,1524164643000,2018-04-19,12:04:03,Pacific Daylight Time,1249982359,senatemajldr,Leader McConnell,,"Consumer confidence at a 14 year ⬆️. Jobless claims, a 45 year ⬇️.   #TaxReform is working for the American people and the American #economy.",[],[],[],189,38,134,"['#taxreform', '#economy']",[],https://twitter.com/senatemajldr/status/987044172795465729,False,,0,,,,,,,"[{'user_id': '1249982359', 'username': 'senatemajldr'}]",
987044171826515970,987044171826515970,1524164643000,2018-04-19,12:04:03,Pacific Daylight Time,1249982359,senatemajldr,Leader McConnell,,"This GOP Congress and @POTUS think the Gov needs to give workers and job creators breathing room. So we passed record-setting rollbacks of harmful federal rules that had thrown a wet blanket on the #economy, & enacted sweeping #TaxReform to help families and reignite growth.",['potus'],[],[],412,71,259,"['#economy', '#taxreform']",[],https://twitter.com/senatemajldr/status/987044171826515970,False,,0,,,,,,,"[{'user_id': '1249982359', 'username': 'senatemajldr'}, {'user_id': '822215679726100480', 'username': 'POTUS'}]",
986992479818928134,986992479818928134,1524152319000,2018-04-19,08:38:39,Pacific Daylight Time,1249982359,senatemajldr,Leader McConnell,,".@NASA has been led by an acting administrator for a record 15 months, so I hope all Senators will join me in voting to confirm Jim Bridenstine today.",['nasa'],[],[],368,96,343,[],[],https://twitter.com/senatemajldr/status/986992479818928134,False,,0,,,,,,,"[{'user_id': '1249982359', 'username': 'senatemajldr'}, {'user_id': '11348282', 'username': 'NASA'}]",
986972406576242688,986972405255016449,1524147533000,2018-04-19,07:18:53,Pacific Daylight Time,1249982359,senatemajldr,Leader McConnell,,"The Protecting Moms and Infants Act authorizes increased funding for a competitive federal grant to help organizations address this particular part of the #opioidcrisis, and continues our years-long efforts to protect the most vulnerable.",[],[],[],109,22,65,['#opioidcrisis'],[],https://twitter.com/senatemajldr/status/986972406576242688,False,,0,,,,,,,"[{'user_id': '1249982359', 'username': 'senatemajldr'}]",
986972405255016449,986972405255016449,1524147533000,2018-04-19,07:18:53,Pacific Daylight Time,1249982359,senatemajldr,Leader McConnell,,"Today, I’ll introduce the Protecting Moms and Infants Act, which directs the Secretary of @HHSGov to report on the implementation of the strategies developed in the Protecting Our Infants Act in order to help fight the #opioidcrisis that is plaguing our nation.",['hhsgov'],[],[],192,34,100,['#opioidcrisis'],[],https://twitter.com/senatemajldr/status/986972405255016449,False,,0,,,,,,,"[{'user_id': '1249982359', 'username': 'senatemajldr'}, {'user_id': '44783853', 'username': 'HHSGov'}]",
986600533480927232,986600533480927232,1524058871000,2018-04-18,06:41:11,Pacific Daylight Time,1249982359,senatemajldr,Leader McConnell,,"Thanks to @SenToomey & Senator @JerryMoran, the #Senate will be rolling back another piece of Obama-era overreach by nullifying a particularly egregious overstep by his @CFPB and notch another victory in this Congress’s record of rolling back overregulation.","['sentoomey', 'jerrymoran', 'cfpb']",[],[],796,116,394,['#senate'],[],https://twitter.com/senatemajldr/status/986600533480927232,False,,0,,,,,,,"[{'user_id': '1249982359', 'username': 'senatemajldr'}, {'user_id': '221162525', 'username': 'SenToomey'}, {'user_id': '18632666', 'username': 'JerryMoran'}, {'user_id': '234826866', 'username': 'CFPB'}]",
986407036983357440,986407036983357440,1524012738000,2018-04-17,17:52:18,Pacific Daylight Time,1249982359,senatemajldr,Leader McConnell,,"Barbara Bush wielded her formidable qualities on behalf of her nation, the family she loved, and the many worthy causes she supported. Today a nation joins the Bush family, their many friends, and all the country in their grief, and in prayer.",[],[],[],301,141,645,[],[],https://twitter.com/senatemajldr/status/986407036983357440,False,,0,,,,,,,"[{'user_id': '1249982359', 'username': 'senatemajldr'}]",
986300748504993792,986300748504993792,1523987397000,2018-04-17,10:49:57,Pacific Daylight Time,1249982359,senatemajldr,Leader McConnell,,I will be joining @TeamCavuto at appx 4:00 this afternoon to discuss #TaxDay and how #TaxReform is already benefiting the American people. @FoxNews,"['teamcavuto', 'foxnews']",[],[],196,26,89,"['#taxday', '#taxreform']",[],https://twitter.com/senatemajldr/status/986300748504993792,False,,0,,,,,,,"[{'user_id': '1249982359', 'username': 'senatemajldr'}, {'user_id': '223970563', 'username': 'TeamCavuto'}, {'user_id': '1367531', 'username': 'FoxNews'}]",
986282256217059329,986282256217059329,1523982988000,2018-04-17,09:36:28,Pacific Daylight Time,1249982359,senatemajldr,Leader McConnell,,"Thanks to the #TaxCutsandJobsAct 4,000,000+ Americans (and counting) are receiving special bonuses, pay raises, or new benefits from their employers as a direct result of #TaxReform. #TaxDay",[],[],[],597,126,438,"['#taxcutsandjobsact', '#taxreform', '#taxday']",[],https://twitter.com/senatemajldr/status/986282256217059329,False,,0,,,,,,,"[{'user_id': '1249982359', 'username': 'senatemajldr'}]",
986251186755002368,986251186755002368,1523975581000,2018-04-17,07:33:01,Pacific Daylight Time,1249982359,senatemajldr,Leader McConnell,,"ICYMI - yesterday afternoon, I filed cloture on @USCG Authorization Act, a comprehensive package that equips an adaptable force to meet a host of important missions. I hope each Senator will join me in ensuring its passage this week.",['uscg'],[],[],81,13,71,[],[],https://twitter.com/senatemajldr/status/986251186755002368,False,,0,,,,,,,"[{'user_id': '1249982359', 'username': 'senatemajldr'}, {'user_id': '15113565', 'username': 'USCG'}]",
986244162096893952,986244162096893952,1523973906000,2018-04-17,07:05:06,Pacific Daylight Time,1249982359,senatemajldr,Leader McConnell,,"Thanks to @SenToomey and Senator @JerryMoran, we will protect consumers from a brazen attempt by the past director of the @CFPB to stretch his authority and interfere in the auto industry. Now it’s time for the auto industry to come along for the economic tune-up.","['sentoomey', 'jerrymoran', 'cfpb']",[],[],92,27,78,[],[],https://twitter.com/senatemajldr/status/986244162096893952,False,,0,,,,,,,"[{'user_id': '1249982359', 'username': 'senatemajldr'}, {'user_id': '221162525', 'username': 'SenToomey'}, {'user_id': '18632666', 'username': 'JerryMoran'}, {'user_id': '234826866', 'username': 'CFPB'}]",
986007317857611778,986007317857611778,1523917438000,2018-04-16,15:23:58,Pacific Daylight Time,1249982359,senatemajldr,Leader McConnell,,"Today I met w/ @POTUS' nominee for Director of the @CIA, Gina Haspel. She has dedicated her professional life to the national security of the United States, and has repeatedly proven to be a consummate intelligence officer and leader. I look forward to supporting her nomination.","['potus', 'cia']",[],[],556,209,1045,[],[],https://twitter.com/senatemajldr/status/986007317857611778,False,,0,,,,,,,"[{'user_id': '1249982359', 'username': 'senatemajldr'}, {'user_id': '822215679726100480', 'username': 'POTUS'}, {'user_id': '2359926157', 'username': 'CIA'}]",
985980394280488961,985980394280488961,1523911019000,2018-04-16,13:36:59,Pacific Daylight Time,1249982359,senatemajldr,Leader McConnell,,"This afternoon, the #Senate will vote to advance legislation from Senator @JerryMoran that would bolster the proper sovereignty of American Indian tribes in the face of excessive federal regulation.",['jerrymoran'],[],[],106,32,112,['#senate'],[],https://twitter.com/senatemajldr/status/985980394280488961,False,,0,,,,,,,"[{'user_id': '1249982359', 'username': 'senatemajldr'}, {'user_id': '18632666', 'username': 'JerryMoran'}]",
985972711376777217,985972711376777217,1523909187000,2018-04-16,13:06:27,Pacific Daylight Time,1249982359,senatemajldr,Leader McConnell,,"Over the weekend, America’s all-volunteer armed forces executed a challenging mission with precision and excellence. At @POTUS' order, the US joined w our British & French allies in military action to respond to Bashar al-Assad’s use of chemical weapons against the Syrian people.",['potus'],[],[],192,61,336,[],[],https://twitter.com/senatemajldr/status/985972711376777217,False,,0,,,,,,,"[{'user_id': '1249982359', 'username': 'senatemajldr'}, {'user_id': '822215679726100480', 'username': 'POTUS'}]",
984499123402543104,984499123402543104,1523557856000,2018-04-12,11:30:56,Pacific Daylight Time,1249982359,senatemajldr,Leader McConnell,,"American entrepreneurs thrive when we scrub the regulatory rust off our #economy and give farmers, ranchers, local communities, community banks, and small businesses more say over their own affairs.  #TaxReform is working for the American people.",[],[],[],339,63,296,"['#economy', '#taxreform']",[],https://twitter.com/senatemajldr/status/984499123402543104,False,,0,,,,,,,"[{'user_id': '1249982359', 'username': 'senatemajldr'}]",
984442796798087170,984442796798087170,1523544427000,2018-04-12,07:47:07,Pacific Daylight Time,1249982359,senatemajldr,Leader McConnell,,"It's time the federal gov changes the way it looks at #hemp, which is why Senator @RonWyden and I, along with @SenJeffMerkley, are introducing legislation that will modernize federal law in this area & empower American farmers to explore this promising new market.","['ronwyden', 'senjeffmerkley']",[],[],237,173,516,['#hemp'],[],https://twitter.com/senatemajldr/status/984442796798087170,False,,0,,,,,,,"[{'user_id': '1249982359', 'username': 'senatemajldr'}, {'user_id': '250188760', 'username': 'RonWyden'}, {'user_id': '29201047', 'username': 'SenJeffMerkley'}]",
984439424309227520,984439424309227520,1523543623000,2018-04-12,07:33:43,Pacific Daylight Time,1249982359,senatemajldr,Leader McConnell,,"Andrew Wheeler is ready and waiting... and waiting, thanks to #Senate Dems, to clock in as Deputy Administrator of the @EPA. His qualifications are beyond question. He has won the support of the American @FarmBureau Federation and has won bipartisan praise.","['epa', 'farmbureau']",[],[],290,44,139,['#senate'],[],https://twitter.com/senatemajldr/status/984439424309227520,False,,0,,,,,,,"[{'user_id': '1249982359', 'username': 'senatemajldr'}, {'user_id': '14615871', 'username': 'EPA'}, {'user_id': '20957191', 'username': 'FarmBureau'}]",
984438376878231553,984438376878231553,1523543373000,2018-04-12,07:29:33,Pacific Daylight Time,1249982359,senatemajldr,Leader McConnell,,"Despite months of waiting due to Democrats historic obstruction, today the #Senate confirmed Patrick Pizzella, @POTUS' highly qualified nominee to be the Deputy Secretary of @USDOL.","['potus', 'usdol']",[],[],651,154,629,['#senate'],[],https://twitter.com/senatemajldr/status/984438376878231553,False,,0,,,,,,,"[{'user_id': '1249982359', 'username': 'senatemajldr'}, {'user_id': '822215679726100480', 'username': 'POTUS'}, {'user_id': '20179628', 'username': 'USDOL'}]",
984113568286171141,984113568286171141,1523465933000,2018-04-11,09:58:53,Pacific Daylight Time,1249982359,senatemajldr,Leader McConnell,,"Today's confirmation of Mr. Ring will give the country a fully-staffed @NLRB once again, and turn the page on the previous administration’s efforts to remake this bipartisan board into a one-sided political weapon.",['nlrb'],[],[],186,47,148,[],[],https://twitter.com/senatemajldr/status/984113568286171141,False,,0,,,,,,,"[{'user_id': '1249982359', 'username': 'senatemajldr'}, {'user_id': '44043034', 'username': 'NLRB'}]",
984109328427814912,984109328427814912,1523464922000,2018-04-11,09:42:02,Pacific Daylight Time,1249982359,senatemajldr,Leader McConnell,,"Following the confirmation of Ms. Boom to the District Court yesterday, the #Senate has moved to the nomination of John Ring to serve on the @NLRB. After his confirmation today, the Senate will vote on nominees to the @USDOL, the @EPA, and two more District Court vacancies.","['nlrb', 'usdol', 'epa']",[],[],120,45,128,['#senate'],[],https://twitter.com/senatemajldr/status/984109328427814912,False,,0,,,,,,,"[{'user_id': '1249982359', 'username': 'senatemajldr'}, {'user_id': '44043034', 'username': 'NLRB'}, {'user_id': '20179628', 'username': 'USDOL'}, {'user_id': '14615871', 'username': 'EPA'}]",
984093872589590528,984093872589590528,1523461237000,2018-04-11,08:40:37,Pacific Daylight Time,1249982359,senatemajldr,Leader McConnell,,"Today, @POTUS signed another piece of bipartisan legislation to help law enforcement and victims with new tools to fight sex trafficking. Thank you to @senrobportman for your continued leadership in furthering #SESTA and helping those caught up in this national epidemic.","['potus', 'senrobportman']",[],[],163,101,347,['#sesta'],[],https://twitter.com/senatemajldr/status/984093872589590528,False,,0,,,,,,,"[{'user_id': '1249982359', 'username': 'senatemajldr'}, {'user_id': '822215679726100480', 'username': 'POTUS'}, {'user_id': '18915145', 'username': 'senrobportman'}]",
983762331078479873,983762331078479873,1523382191000,2018-04-10,10:43:11,Pacific Daylight Time,1249982359,senatemajldr,Leader McConnell,,"In #Kentucky, @GovMattBevin announced certification of 144 #OpportunityZones. My friends & colleagues on the state & local level are excited & optimistic. This creative policy, along w/ the rest of #TaxReform has the Kentuckians I serve looking forward to a brighter future.",['govmattbevin'],[],[],345,23,89,"['#kentucky', '#opportunityzones', '#taxreform']",[],https://twitter.com/senatemajldr/status/983762331078479873,False,,0,,,,,,,"[{'user_id': '1249982359', 'username': 'senatemajldr'}, {'user_id': '3141213592', 'username': 'GovMattBevin'}]",
983708802527703040,983708802527703040,1523369429000,2018-04-10,07:10:29,Pacific Daylight Time,1249982359,senatemajldr,Leader McConnell,,"If yesterday’s vote to advance Claria Horn Boom’s district court nomination were any indication, we’d be in for a productive week. 96 Senators voted in support.   With such bipartisan support, you might think that filing cloture should not have been necessary in the first place.",[],[],[],213,54,234,[],[],https://twitter.com/senatemajldr/status/983708802527703040,False,,0,,,,,,,"[{'user_id': '1249982359', 'username': 'senatemajldr'}]",
983442341766758400,983442341766758400,1523305900000,2018-04-09,13:31:40,Pacific Daylight Time,1249982359,senatemajldr,Leader McConnell,,"The Senate offers our condolences to the families of two former colleagues who have recently passed away, Senator Zell Miller & Senator Daniel Akaka. These committed public servants will be missed.",[],[],[],49,26,110,[],[],https://twitter.com/senatemajldr/status/983442341766758400,False,,0,,,,,,,"[{'user_id': '1249982359', 'username': 'senatemajldr'}]",
983425291816263680,983425291816263680,1523301835000,2018-04-09,12:23:55,Pacific Daylight Time,1249982359,senatemajldr,Leader McConnell,,"This week, the #Senate will work to advance more of @POTUS' highly qualified nominees.",['potus'],[],[],824,181,938,['#senate'],[],https://twitter.com/senatemajldr/status/983425291816263680,False,,0,,,,,,,"[{'user_id': '1249982359', 'username': 'senatemajldr'}, {'user_id': '822215679726100480', 'username': 'POTUS'}]",
983423251815763969,983423251815763969,1523301349000,2018-04-09,12:15:49,Pacific Daylight Time,1249982359,senatemajldr,Leader McConnell,,"I know I speak for all Senators in welcoming our new colleague, Senator Cindy Hyde-Smith. I look forward to working together to continue this Congress’s record of accomplishment for the American people.",[],[],[],192,32,171,[],[],https://twitter.com/senatemajldr/status/983423251815763969,False,,0,,,,,,,"[{'user_id': '1249982359', 'username': 'senatemajldr'}]",
979432288697176064,979432288697176064,1522349829000,2018-03-29,11:57:09,Pacific Daylight Time,1249982359,senatemajldr,Leader McConnell,,"Rebuilding America's #infrastructure is a critical issue that @POTUS, his Administration, and Congress are continuing to work to achieve together.",['potus'],[],[],2182,839,4975,['#infrastructure'],[],https://twitter.com/senatemajldr/status/979432288697176064,False,,0,,,,,,,"[{'user_id': '1249982359', 'username': 'senatemajldr'}, {'user_id': '822215679726100480', 'username': 'POTUS'}]",
976884128162484229,976884128162484229,1521742300000,2018-03-22,11:11:40,Pacific Daylight Time,1249982359,senatemajldr,Leader McConnell,,"At the request of Parkland families, @SpeakerRyan and I ensured the omnibus spending bill will include Senator @JohnCornyn's #FixNICS and @senorrinhatch's STOP School Violence Act.","['speakerryan', 'johncornyn', 'senorrinhatch']",[],[],944,112,334,['#fixnics'],[],https://twitter.com/senatemajldr/status/976884128162484229,False,,0,,,,,,,"[{'user_id': '1249982359', 'username': 'senatemajldr'}, {'user_id': '18916432', 'username': 'SpeakerRyan'}, {'user_id': '13218102', 'username': 'JohnCornyn'}, {'user_id': '262756641', 'username': 'senorrinhatch'}]",
976852191435788288,976852191435788288,1521734686000,2018-03-22,09:04:46,Pacific Daylight Time,1249982359,senatemajldr,Leader McConnell,,"Soon, I will be delivering farewell remarks honoring @SenThadChochran's nearly 4 decades of service in the US #Senate.",[],[],[],202,19,77,['#senate'],[],https://twitter.com/senatemajldr/status/976852191435788288,False,,0,,,,,,,"[{'user_id': '1249982359', 'username': 'senatemajldr'}]",
976848996844101635,976848996844101635,1521733924000,2018-03-22,08:52:04,Pacific Daylight Time,1249982359,senatemajldr,Leader McConnell,,"It's time to rebuild America's crumbling #infrastructure, and the spending bill will help accomplish just that. It will fund long-overdue improvements to roads, rails, airports and inland waterways, creating #jobs and growing our #economy along the way.",[],[],[],335,46,126,"['#infrastructure', '#jobs', '#economy']",[],https://twitter.com/senatemajldr/status/976848996844101635,False,,0,,,,,,,"[{'user_id': '1249982359', 'username': 'senatemajldr'}]",
976843415534088192,976843415534088192,1521732593000,2018-03-22,08:29:53,Pacific Daylight Time,1249982359,senatemajldr,Leader McConnell,,"This spending bill scales up research, treatment and prevention funding and provides grants to first responders to help confront the scourge of the #OpioidEpidemic head-on and help save lives. For rural communities, like many in #Kentucky, this is a big deal.",[],[],[],197,32,87,"['#opioidepidemic', '#kentucky']",[],https://twitter.com/senatemajldr/status/976843415534088192,False,,0,,,,,,,"[{'user_id': '1249982359', 'username': 'senatemajldr'}]",
976829397121544192,976829397121544192,1521729251000,2018-03-22,07:34:11,Pacific Daylight Time,1249982359,senatemajldr,Leader McConnell,,"The House will vote soon on a landmark appropriations bill for the remainder of FY 2018, after which we will take it up here in the #Senate. The is legislation that neither side sees as perfect, but which contains significant victories and achievements for the American people.",[],[],[],240,29,84,['#senate'],[],https://twitter.com/senatemajldr/status/976829397121544192,False,,0,,,,,,,"[{'user_id': '1249982359', 'username': 'senatemajldr'}]",
976553584652443648,976553584652443648,1521663492000,2018-03-21,13:18:12,Pacific Daylight Time,1249982359,senatemajldr,Leader McConnell,,"From coal country to farming communities & everywhere in between, Obama-era over regulation was holding our #economy back. Opportunity zones offer a chance for real relief. #Kentucky officials say they may designate 144 new zones, prioritizing growth in areas that need it most.",[],[],[],497,92,295,"['#economy', '#kentucky']",[],https://twitter.com/senatemajldr/status/976553584652443648,False,,0,,,,,,,"[{'user_id': '1249982359', 'username': 'senatemajldr'}]",
976523763402657792,976523763402657792,1521656382000,2018-03-21,11:19:42,Pacific Daylight Time,1249982359,senatemajldr,Leader McConnell,,"The best way to breathe new life into struggling communities is not to invent a new federal program, it’s to make those communities attractive places to do business, open new facilities, and create good-paying jobs. That's exactly what #TaxReform does.",[],[],[],527,84,422,['#taxreform'],[],https://twitter.com/senatemajldr/status/976523763402657792,False,,0,,,,,,,"[{'user_id': '1249982359', 'username': 'senatemajldr'}]",
