id,conversation_id,created_at,date,time,timezone,user_id,username,name,place,tweet,mentions,urls,photos,replies_count,retweets_count,likes_count,hashtags,cashtags,link,retweet,quote_url,video,near,geo,source,user_rt_id,user_rt,retweet_id,reply_to,retweet_date
1080883356957622273,1080883356957622273,1546537648000,2019-01-03,09:47:28,Pacific Daylight Time,1249982359,senatemajldr,Leader McConnell,,"Welcome @MarshaBlackburn, Mike Braun, @SenKevinCramer, Josh Hawley, @SenMcSallyAZ, @SenatorRomney, @SenJackyRosen, @SenatorSinema to the US Senate #116thCongress","['marshablackburn', 'senkevincramer', 'senmcsallyaz', 'senatorromney', 'senjackyrosen', 'senatorsinema']",[],[],953,636,3237,['#116thcongress'],[],https://twitter.com/senatemajldr/status/1080883356957622273,False,,0,,,,,,,"[{'user_id': '1249982359', 'username': 'senatemajldr'}, {'user_id': '278145569', 'username': 'MarshaBlackburn'}, {'user_id': '1048784496', 'username': 'SenKevinCramer'}, {'user_id': '2964949642', 'username': 'SenMcSallyAZ'}, {'user_id': '1078693601356509184', 'username': 'SenatorRomney'}, {'user_id': '818554054309715969', 'username': 'SenJackyRosen'}, {'user_id': '1080844782', 'username': 'SenatorSinema'}]",
1080626572707745792,1080626572707745792,1546476426000,2019-01-02,16:47:06,Pacific Daylight Time,1249982359,senatemajldr,Leader McConnell,,The Senate has reached an agreement to confirm more of the Administration’s well-qualified nominees. I’m glad these newly-confirmed nominees will be able to get to work on important business for the American people.,[],[],[],1827,2877,9673,[],[],https://twitter.com/senatemajldr/status/1080626572707745792,False,,0,,,,,,,"[{'user_id': '1249982359', 'username': 'senatemajldr'}]",
1080626491560521730,1080626491560521730,1546476407000,2019-01-02,16:46:47,Pacific Daylight Time,1249982359,senatemajldr,Leader McConnell,,"Democrats will have to get serious about border security so that a government funding agreement can pass the House, earn 60 votes in the Senate, and receive a presidential signature. All three of these things are needed. One partisan vote in the House won't solve anything.",[],[],[],9448,7000,23195,[],[],https://twitter.com/senatemajldr/status/1080626491560521730,False,,0,,,,,,,"[{'user_id': '1249982359', 'username': 'senatemajldr'}]",
1076528609525940229,1076528609525940229,1545499396000,2018-12-22,09:23:16,Pacific Daylight Time,1249982359,senatemajldr,Leader McConnell,,"I’m glad productive discussions are continuing between our Democratic colleagues and the White House. When those negotiations produce a solution that can pass the Senate and the House and receive @POTUS’s signature, it will receive a vote on the Senate floor.",['potus'],[],[],4530,2070,7635,[],[],https://twitter.com/senatemajldr/status/1076528609525940229,False,,0,,,,,,,"[{'user_id': '1249982359', 'username': 'senatemajldr'}, {'user_id': '822215679726100480', 'username': 'POTUS'}]",
1076171992603246592,1076171992603246592,1545414372000,2018-12-21,09:46:12,Pacific Daylight Time,1249982359,senatemajldr,Leader McConnell,,Let’s not end this year the way it began: Another shutdown over the issue of illegal immigration because the Democrats are unwilling to support common-sense measures. I am proud to vote for the additional border security that the House added to government funding legislation.,[],[],[],11258,8803,30762,[],[],https://twitter.com/senatemajldr/status/1076171992603246592,False,,0,,,,,,,"[{'user_id': '1249982359', 'username': 'senatemajldr'}]",
1075406568076791808,1075406568076791808,1545231880000,2018-12-19,07:04:40,Pacific Daylight Time,1249982359,senatemajldr,Leader McConnell,,"Later this morning, we’ll introduce a continuing resolution that will ensure continuous funding for the federal government. The measure will provide the resources necessary to continue normal operations through February 8th.",[],[],[],7852,1109,3112,[],[],https://twitter.com/senatemajldr/status/1075406568076791808,False,,0,,,,,,,"[{'user_id': '1249982359', 'username': 'senatemajldr'}]",
1075051944836820992,1075051944836820992,1545147331000,2018-12-18,07:35:31,Pacific Daylight Time,1249982359,senatemajldr,Leader McConnell,,General John Kelly has served the president and the nation with great distinction. The Marine Corps is stronger for John Kelly’s years of leadership. America is better for his distinguished career of service. I extend my deep gratitude for his job well done.,[],[],[],973,2350,11248,[],[],https://twitter.com/senatemajldr/status/1075051944836820992,False,,0,,,,,,,"[{'user_id': '1249982359', 'username': 'senatemajldr'}]",
1075051869775507457,1075051869775507457,1545147313000,2018-12-18,07:35:13,Pacific Daylight Time,1249982359,senatemajldr,Leader McConnell,,"As the entire nation mourned the loss of Sen. John McCain, Jon Kyl volunteered his even keel and sound judgement to serve Arizona. I am grateful for this second opportunity to work alongside such a dear friend.",[],[],[],153,54,444,[],[],https://twitter.com/senatemajldr/status/1075051869775507457,False,,0,,,,,,,"[{'user_id': '1249982359', 'username': 'senatemajldr'}]",
1073252371122348032,1073252371122348032,1544718279000,2018-12-13,08:24:39,Pacific Daylight Time,1249982359,senatemajldr,Leader McConnell,,"I want to thank @JeffFlake for his service. As part of this Senate majority, he’s had a hand in many policy accomplishments that have tangibly made life better for Arizonans and the nation.",['jeffflake'],[],[],1195,94,465,[],[],https://twitter.com/senatemajldr/status/1073252371122348032,False,,0,,,,,,,"[{'user_id': '1249982359', 'username': 'senatemajldr'}, {'user_id': '16056306', 'username': 'JeffFlake'}]",
1073251729712537600,1073251729712537600,1544718127000,2018-12-13,08:22:07,Pacific Daylight Time,1249982359,senatemajldr,Leader McConnell,,"When President Trump signs the #FarmBill into law, it will be a big win for farmers in Kentucky and across our country. Farming families deserve more stability, and that is precisely what they will have.",[],[],[],366,281,981,['#farmbill'],[],https://twitter.com/senatemajldr/status/1073251729712537600,False,,0,,,,,,,"[{'user_id': '1249982359', 'username': 'senatemajldr'}]",
1073251612435599365,1073251611043090433,1544718099000,2018-12-13,08:21:39,Pacific Daylight Time,1249982359,senatemajldr,Leader McConnell,,It strengthens protections for victims. It ensures that it is members of Congress who will be held responsible for their own misconduct -- not taxpayers. Thank you @SenAmyKlobuchar and @RoyBlunt for working hard to get this done.,"['senamyklobuchar', 'royblunt']",[],[],257,283,970,[],[],https://twitter.com/senatemajldr/status/1073251612435599365,False,,0,,,,,,,"[{'user_id': '1249982359', 'username': 'senatemajldr'}, {'user_id': '22044727', 'username': 'SenAmyKlobuchar'}, {'user_id': '21269970', 'username': 'RoyBlunt'}]",
1073251611043090433,1073251611043090433,1544718098000,2018-12-13,08:21:38,Pacific Daylight Time,1249982359,senatemajldr,Leader McConnell,,The Senate and the House have reached a landmark agreement to reform the process by which Capitol Hill handles claims of sexual harassment and discrimination in the workplace. It is a bicameral and bipartisan agreement.,[],[],[],862,984,3311,[],[],https://twitter.com/senatemajldr/status/1073251611043090433,False,,0,,,,,,,"[{'user_id': '1249982359', 'username': 'senatemajldr'}]",
1072872513871511552,1072872513871511552,1544627714000,2018-12-12,07:15:14,Pacific Daylight Time,1249982359,senatemajldr,Leader McConnell,,I’m sad to bid farewell to a living example of the American dream at its most extraordinary. @senorrinhatch has been the longest-serving Republican Senator in our nation’s history. I wish him a peaceful and happy retirement.,['senorrinhatch'],[],[],2544,3552,18043,[],[],https://twitter.com/senatemajldr/status/1072872513871511552,False,,0,,,,,,,"[{'user_id': '1249982359', 'username': 'senatemajldr'}, {'user_id': '262756641', 'username': 'senorrinhatch'}]",
1072872368190705665,1072872368190705665,1544627680000,2018-12-12,07:14:40,Pacific Daylight Time,1249982359,senatemajldr,Leader McConnell,,"The Senate took a major step yesterday by passing the Farm Bill, which will deliver a big shot in the arm to farmers and rural communities. I’m especially proud it will open a new door for industrial #hemp farmers in #Kentucky and around the country.",[],[],[],352,551,2153,"['#hemp', '#kentucky']",[],https://twitter.com/senatemajldr/status/1072872368190705665,False,,0,,,,,,,"[{'user_id': '1249982359', 'username': 'senatemajldr'}]",
1072522201671307265,1072522201671307265,1544544194000,2018-12-11,08:03:14,Pacific Daylight Time,1249982359,senatemajldr,Leader McConnell,,"At a time when farm income is down and growers are struggling, industrial hemp is a bright spot of agriculture’s future. My provision in the Farm Bill will not only legalize domestic hemp, but it will also allow state departments of agriculture to be responsible for its oversight",[],[],[],900,1197,4036,[],[],https://twitter.com/senatemajldr/status/1072522201671307265,False,,0,,,,,,,"[{'user_id': '1249982359', 'username': 'senatemajldr'}]",
1072515481217744899,1072515481217744899,1544542591000,2018-12-11,07:36:31,Pacific Daylight Time,1249982359,senatemajldr,Leader McConnell,,Senate Republicans are working with the President and his Homeland Security team on $5.02 billion of targeted funding to bolster security measures at the US-Mexico border.,[],[],[],2133,3358,9455,[],[],https://twitter.com/senatemajldr/status/1072515481217744899,False,,0,,,,,,,"[{'user_id': '1249982359', 'username': 'senatemajldr'}]",
1072514780806680576,1072514780806680576,1544542424000,2018-12-11,07:33:44,Pacific Daylight Time,1249982359,senatemajldr,Leader McConnell,,"At the request of the president and following improvements to the legislation that have been secured by several members, the Senate will take up the recently revised Criminal Justice bill this month.",[],[],[],1131,2952,12811,[],[],https://twitter.com/senatemajldr/status/1072514780806680576,False,,0,,,,,,,"[{'user_id': '1249982359', 'username': 'senatemajldr'}]",
1070716282318794752,1070716281144438784,1544113629000,2018-12-06,08:27:09,Pacific Daylight Time,1249982359,senatemajldr,Leader McConnell,,". @SenBobCorker has been a brilliant Chairman of the Foreign Relations Committee. He has been a powerful voice for American interests and our allies, and a thorn in the side of those who might wish us harm. The Senate will miss his enthusiasm and expertise.",['senbobcorker'],[],[],436,37,188,[],[],https://twitter.com/senatemajldr/status/1070716282318794752,False,,0,,,,,,,"[{'user_id': '1249982359', 'username': 'senatemajldr'}, {'user_id': '73303753', 'username': 'SenBobCorker'}]",
1070698357658714112,1070698357658714112,1544109355000,2018-12-06,07:15:55,Pacific Daylight Time,1249982359,senatemajldr,Leader McConnell,,"Coal deserves a level playing field, not runaway regulation that will do little to actually help the environment. I applaud @POTUS and @EPA to end the War on Coal and bring relief to hardworking Kentucky families.","['potus', 'epa']",[],[],5608,4339,14820,[],[],https://twitter.com/senatemajldr/status/1070698357658714112,False,,0,,,,,,,"[{'user_id': '1249982359', 'username': 'senatemajldr'}, {'user_id': '822215679726100480', 'username': 'POTUS'}, {'user_id': '14615871', 'username': 'EPA'}]",
1067800029019164672,1067800028171898880,1543418340000,2018-11-28,07:19:00,Pacific Daylight Time,1249982359,senatemajldr,Leader McConnell,,"With needless delays- & a record-breaking number of cloture votes on nominations, my Democratic colleagues have made this body drag its feet along the way. But the Senate will press on this week to put to rest more of the people’s business before the close of the 115th Congress.",[],[],[],1267,528,1915,[],[],https://twitter.com/senatemajldr/status/1067800029019164672,False,,0,,,,,,,"[{'user_id': '1249982359', 'username': 'senatemajldr'}]",
1067800028171898880,1067800028171898880,1543418340000,2018-11-28,07:19:00,Pacific Daylight Time,1249982359,senatemajldr,Leader McConnell,,"The Senate is focused on wrapping up this year’s remaining priorities: getting more of the president’s team in place, confirming well-qualified nominees to our federal courts, and attending to the pressing legislative business the American people expect us to handle.",[],[],[],2403,2120,7317,[],[],https://twitter.com/senatemajldr/status/1067800028171898880,False,,0,,,,,,,"[{'user_id': '1249982359', 'username': 'senatemajldr'}]",
1067442150760243201,1067442149086633984,1543333015000,2018-11-27,07:36:55,Pacific Daylight Time,1249982359,senatemajldr,Leader McConnell,,Some of this Congress' biggest accomplishments have been bipartisan. From landmark opioids legislation to improvements in veterans’ services to historic progress on appropriations. Our remaining work on nominations and legislation will require more of that bipartisan spirit.,[],[],[],791,346,1469,[],[],https://twitter.com/senatemajldr/status/1067442150760243201,False,,0,,,,,,,"[{'user_id': '1249982359', 'username': 'senatemajldr'}]",
1067442149086633984,1067442149086633984,1543333015000,2018-11-27,07:36:55,Pacific Daylight Time,1249982359,senatemajldr,Leader McConnell,,"Even after two historic years full of accomplishments for the American people, there are still important items left for this Congress to check off our list before the end of this year.",[],[],[],2293,2141,8107,[],[],https://twitter.com/senatemajldr/status/1067442149086633984,False,,0,,,,,,,"[{'user_id': '1249982359', 'username': 'senatemajldr'}]",
1067188419057586176,1067188417698693122,1543272521000,2018-11-26,14:48:41,Pacific Daylight Time,1249982359,senatemajldr,Leader McConnell,,"We’ll continue to make nominations a top priority, as we have this entire Congress. The nominees we’ll consider this week are highly regarded and well equipped for public service. I look forward to confirming each of them without further undue delay.",[],[],[],735,706,2666,[],[],https://twitter.com/senatemajldr/status/1067188419057586176,False,,0,,,,,,,"[{'user_id': '1249982359', 'username': 'senatemajldr'}]",
1067188417698693122,1067188417698693122,1543272520000,2018-11-26,14:48:40,Pacific Daylight Time,1249982359,senatemajldr,Leader McConnell,,"As the 115th Congress comes to a close, my colleagues will have much to be proud of. But we aren’t finished yet. The Senate still has a full slate of important business that we must complete before the end of the year.",[],[],[],2978,2839,12405,[],[],https://twitter.com/senatemajldr/status/1067188417698693122,False,,0,,,,,,,"[{'user_id': '1249982359', 'username': 'senatemajldr'}]",
1063122138415149058,1063122136104124417,1542303044000,2018-11-15,09:30:44,Pacific Daylight Time,1249982359,senatemajldr,Leader McConnell,,"Marshaling resources against the opioid crisis, reforming Dodd Frank, funding our armed forces, taking care of our veterans, and improving the nation’s infrastructure are some of the things we have done in this Congress on a bipartisan basis.",[],[],[],752,384,1747,[],[],https://twitter.com/senatemajldr/status/1063122138415149058,False,,0,,,,,,,"[{'user_id': '1249982359', 'username': 'senatemajldr'}]",
1063122136104124417,1063122136104124417,1542303043000,2018-11-15,09:30:43,Pacific Daylight Time,1249982359,senatemajldr,Leader McConnell,,"Yesterday’s Coast Guard reauthorization was just the latest installment in a long list of bipartisan successes passed by this Senate, in this Congress, on behalf of the American people.",[],[],[],828,1235,4863,[],[],https://twitter.com/senatemajldr/status/1063122136104124417,False,,0,,,,,,,"[{'user_id': '1249982359', 'username': 'senatemajldr'}]",
1062798242470076416,1062798242470076416,1542225821000,2018-11-14,12:03:41,Pacific Daylight Time,1249982359,senatemajldr,Leader McConnell,,The Senate just passed legislation to reauthorize @USCG funding to ensure that the brave men and women who put themselves in harm’s way every single day have access to the resources they need.,['uscg'],[],[],501,1052,3910,[],[],https://twitter.com/senatemajldr/status/1062798242470076416,False,,0,,,,,,,"[{'user_id': '1249982359', 'username': 'senatemajldr'}, {'user_id': '15113565', 'username': 'USCG'}]",
1062798181950521345,1062798181950521345,1542225807000,2018-11-14,12:03:27,Pacific Daylight Time,1249982359,senatemajldr,Leader McConnell,,"It is my honor to have been asked by my colleagues to continue serving as leader. Not a day goes by when I am not humbled and honored by this opportunity to serve my colleagues, the institution of the Senate, and our incredible country in whatever measure I am capable.",[],[],[],4005,4577,25195,[],[],https://twitter.com/senatemajldr/status/1062798181950521345,False,,0,,,,,,,"[{'user_id': '1249982359', 'username': 'senatemajldr'}]",
1062460849028321280,1062460849028321280,1542145380000,2018-11-13,13:43:00,Pacific Daylight Time,1249982359,senatemajldr,Leader McConnell,,"The Senate is back and continuing to work hard for the American people.  We will pass legislation on a bipartisan basis that will reauthorize funding for @USCG to help continue its important work. Great news for #Kentucky – 13,000 jobs depends on the state’s inland waterways.",['uscg'],[],[],704,308,1252,['#kentucky'],[],https://twitter.com/senatemajldr/status/1062460849028321280,False,,0,,,,,,,"[{'user_id': '1249982359', 'username': 'senatemajldr'}, {'user_id': '15113565', 'username': 'USCG'}]",
1055185886772711424,1055185885644369920,1540410894000,2018-10-24,12:54:54,Pacific Daylight Time,1249982359,senatemajldr,Leader McConnell,,It provides states the tools they need to improve access to treatment and encourages educational programs in schools to help prevent addiction. It invests in the development of non-addictive painkillers and in research of mental-health factors that may contribute to addiction.,[],[],[],108,130,584,[],[],https://twitter.com/senatemajldr/status/1055185886772711424,False,,0,,,,,,,"[{'user_id': '1249982359', 'username': 'senatemajldr'}]",
1055185885644369920,1055185885644369920,1540410894000,2018-10-24,12:54:54,Pacific Daylight Time,1249982359,senatemajldr,Leader McConnell,,"Good news: @POTUS just signed the “SUPPORT for Patients and Communities Act,” a landmark #opioids bill that includes new programs to keep families safe. The bill takes steps to stop illegal drugs and synthetic opioids from crossing the border.",['potus'],[],[],367,1196,5470,['#opioids'],[],https://twitter.com/senatemajldr/status/1055185885644369920,False,,0,,,,,,,"[{'user_id': '1249982359', 'username': 'senatemajldr'}, {'user_id': '822215679726100480', 'username': 'POTUS'}]",
1050742830153502720,1050742830153502720,1539351587000,2018-10-12,06:39:47,Pacific Daylight Time,1249982359,senatemajldr,Leader McConnell,,"Thanks to the hard work of @chuckgrassley and the @senjudiciary Committee, we’ve been able to confirm 84 of @POTUS’ judges during this Congress to lifetime appointments on the federal bench—including two Supreme Court Justices and a record number of circuit court judges.  #SCOTUS","['chuckgrassley', 'senjudiciary', 'potus']",[],[],1895,5140,16549,['#scotus'],[],https://twitter.com/senatemajldr/status/1050742830153502720,False,,0,,,,,,,"[{'user_id': '1249982359', 'username': 'senatemajldr'}, {'user_id': '10615232', 'username': 'ChuckGrassley'}, {'user_id': '704320143824953344', 'username': 'senjudiciary'}, {'user_id': '822215679726100480', 'username': 'POTUS'}]",
1050527612999802880,1050527609912811520,1539300275000,2018-10-11,16:24:35,Pacific Daylight Time,1249982359,senatemajldr,Leader McConnell,,Nearly one out of every six circuit court of appeals judges has been appointed by @POTUS and confirmed by this Republican Senate,['potus'],[],[],623,2593,9552,[],[],https://twitter.com/senatemajldr/status/1050527612999802880,False,,0,,,,,,,"[{'user_id': '1249982359', 'username': 'senatemajldr'}, {'user_id': '822215679726100480', 'username': 'POTUS'}]",
1050527609912811520,1050527609912811520,1539300274000,2018-10-11,16:24:34,Pacific Daylight Time,1249982359,senatemajldr,Leader McConnell,,"The Senate has confirmed President Trump’s judicial nominees at a historic pace – 84 total, including Brett Kavanaugh and Neil Gorsuch to the Supreme Court, 29 circuit judges, and 53 district court judges.",[],[],[],1698,7916,29654,[],[],https://twitter.com/senatemajldr/status/1050527609912811520,False,,0,,,,,,,"[{'user_id': '1249982359', 'username': 'senatemajldr'}]",
1050420424566341633,1050420424566341633,1539274719000,2018-10-11,09:18:39,Pacific Daylight Time,1249982359,senatemajldr,Leader McConnell,,"The Senate’s list of accomplishments keeps growing. Water #infrastructure, FAA reauthorization, and a landmark #opioids bill are the latest additions to the accomplishments of the 115th Congress.",[],[],[],608,661,2076,"['#infrastructure', '#opioids']",[],https://twitter.com/senatemajldr/status/1050420424566341633,False,,0,,,,,,,"[{'user_id': '1249982359', 'username': 'senatemajldr'}]",
1050030983846789120,1050030981997101056,1539181869000,2018-10-10,07:31:09,Pacific Daylight Time,1249982359,senatemajldr,Leader McConnell,,"Our economic boom is not “Armageddon,” or “crumbs,” or “disaster,” as some have suggested. It is rising wages, more job opportunities, and new investment. The real winners here are the American people. Republicans are just proud our policies are helping them do what they do best.",[],[],[],836,1128,3192,[],[],https://twitter.com/senatemajldr/status/1050030983846789120,False,,0,,,,,,,"[{'user_id': '1249982359', 'username': 'senatemajldr'}]",
1050030981997101056,1050030981997101056,1539181869000,2018-10-10,07:31:09,Pacific Daylight Time,1249982359,senatemajldr,Leader McConnell,,Unemployment in America has now fallen to 3.7 percent. That’s our lowest unemployment rate since 1969. Let's be clear: Government itself is not creating this prosperity. Republicans know that growth starts with workers and entrepreneurs.,[],[],[],1155,3989,11159,[],[],https://twitter.com/senatemajldr/status/1050030981997101056,False,,0,,,,,,,"[{'user_id': '1249982359', 'username': 'senatemajldr'}]",
1050030146923757568,1050030146923757568,1539181670000,2018-10-10,07:27:50,Pacific Daylight Time,1249982359,senatemajldr,Leader McConnell,,"America’s Water Infrastructure Act is a major step toward meeting the challenge of improving our nation’s infrastructure. From dams, levees, and flood control to safer drinking water and sewage systems, this legislation meets all sorts of pressing needs.",[],[],[],555,1337,4182,[],[],https://twitter.com/senatemajldr/status/1050030146923757568,False,,0,,,,,,,"[{'user_id': '1249982359', 'username': 'senatemajldr'}]",
1049749934046683137,1049749934046683137,1539114862000,2018-10-09,12:54:22,Pacific Daylight Time,1249982359,senatemajldr,Leader McConnell,,"Saturday’s vote to confirm Justice Brett Kavanaugh was also a victory for the Senate, and for the integrity of our institution. Justice Kavanaugh will be a thoughtful, fair-minded justice who’s committed to applying our laws and Constitution as they are actually written.",[],[],[],2366,6216,29013,[],[],https://twitter.com/senatemajldr/status/1049749934046683137,False,,0,,,,,,,"[{'user_id': '1249982359', 'username': 'senatemajldr'}]",
1049749853549539329,1049749853549539329,1539114843000,2018-10-09,12:54:03,Pacific Daylight Time,1249982359,senatemajldr,Leader McConnell,,"This week we’ll be voting on America’s Water Infrastructure Act, another major victory for American infrastructure under this Congress. Thank you @SenJohnBarrasso and @SenatorCarper for getting this important, bipartisan legislation across the finish line.","['senjohnbarrasso', 'senatorcarper']",[],[],250,272,1065,[],[],https://twitter.com/senatemajldr/status/1049749853549539329,False,,0,,,,,,,"[{'user_id': '1249982359', 'username': 'senatemajldr'}, {'user_id': '202206694', 'username': 'SenJohnBarrasso'}, {'user_id': '249787913', 'username': 'SenatorCarper'}]",
1048333712281284609,1048333712281284609,1538777208000,2018-10-05,15:06:48,Pacific Daylight Time,1249982359,senatemajldr,Leader McConnell,,I’ll be on the @IngrahamAngle program talking about Judge Kavanaugh tonight at 10 PM ET. #ConfirmKavanaugh,['ingrahamangle'],[],[],1735,2483,9138,['#confirmkavanaugh'],[],https://twitter.com/senatemajldr/status/1048333712281284609,False,,0,,,,,,,"[{'user_id': '1249982359', 'username': 'senatemajldr'}, {'user_id': '50769180', 'username': 'IngrahamAngle'}]",
1048216722854096897,1048216718747865088,1538749316000,2018-10-05,07:21:56,Pacific Daylight Time,1249982359,senatemajldr,Leader McConnell,,"Today, we can send a message to the American people that some core principles remain unfettered by the partisan passions of this moment. Facts matter. Fairness matters.",[],[],[],2307,3038,9526,[],[],https://twitter.com/senatemajldr/status/1048216722854096897,False,,0,,,,,,,"[{'user_id': '1249982359', 'username': 'senatemajldr'}]",
1048216721465724928,1048216718747865088,1538749315000,2018-10-05,07:21:55,Pacific Daylight Time,1249982359,senatemajldr,Leader McConnell,,"We will either give notice that totally uncorroborated allegations are now, officially, enough to destroy an American’s life - or we will declare that our society cannot, must not, set the bar so low.",[],[],[],736,2056,7009,[],[],https://twitter.com/senatemajldr/status/1048216721465724928,False,,0,,,,,,,"[{'user_id': '1249982359', 'username': 'senatemajldr'}]",
