"I want to thank Chairman @ChuckGrassley for leading @senjudiciary through a thorough, transparent examination of Judge Kavanaugh’s qualifications. The Senate is fortunate to have a fair, gracious, and dedicated public servant at the helm of this important process."
Judge Kavanaugh’s judicial temperament and brilliance were on full display during this week’s hearings. It’s easy to see why he is widely viewed as one of the finest legal minds in the nation. He will make an excellent Supreme Court Justice.
The Senate confirmed 8 more of @POTUS’s judicial nominees today.
"Judge Brett Kavanaugh is an impressive, brilliant and mainstream nominee. He gave thoughtful, expansive answers while also respecting the independence of the judiciary. I look forward to more excellent testimony from Judge Kavanaugh today."
Looking forward to being on Special Report with @BretBaier at 6 PM EST tonight.
"I’m happy that our colleagues have chosen @JimInhofe to serve as the next chairman of the Armed Services Committee. He possesses rich experience on the committee, including decades of work on behalf of American servicemembers, as well as his own military service."
The American Bar Association “has determined by a unanimous vote that Judge Kavanaugh is ‘Well Qualified’ for the position of Associate Justice of the Supreme Court” – its highest possible rating. Leading Democrats’ have called this the Gold Standard.
"It is only right that today, near the end of his long journey, John lies here -- in this great hall, under this mighty dome, like other American heroes before him. Here, as a “restless wave” approaches the shores of eternity, we thank God for giving this country John McCain."
"John McCain had America’s fighting spirit, our noble idealism, our solemn patriotism, and our slightly irreverent streak -- all rolled into one."
"The Senate’s having a productive summer. We’ve passed appropriations that cover 87% of next year’s discretionary spending. We’ve authorized resources for our armed forces in a bill named for Sen. McCain. And this month, we’ve confirmed eight more of @POTUS’s judicial nominees"
"I’ve announced the formation of a bipartisan ‘gang’ to come up with a suitable, lasting tribute to the legacy of our friend @SenJohnMcCain"
"Very sad to hear this morning’s update from the family of our dear friend @SenJohnMcCain. We are so fortunate to call him our friend and colleague. John, Cindy, and the entire McCain family are in our prayers at this incredibly difficult hour."
"In my home state of Kentucky, we’re looking forward to increased funding for Pell Grants, and the millions we’ve secured to support work colleges like @bereacollege and @ALCeagles."
"This continues to be a productive August in the US Senate. Funding @DeptofDefense, @USDOL, @HHSGov, and @usedgov will make America stronger - overseas and right here at home."
That’s why I announced today that the Senate will continue working through August until another set of @POTUS’s nominees is completely confirmed.
"We’re funding more resources for treatment, prevention, and recovery programs to address the opioid epidemic. There’s over $100 million in targeted help for rural communities -- like those in Kentucky -- which continue to bear the brunt of this national crisis."
"The Senate’s funding for Labor, Health and Human Services, and Education will provide $220 million for dislocated workers, with a special $30 million emphasis on displaced workers in rural communities, like those I represent in Eastern and Western Kentucky"
"I’m proud that, on this Congress’s watch, our economy has produced so many job opportunities. That growth and prosperity need to reach all families and all communities. The appropriation measures the Senate is considering this week invest in human capital from all angles."
"During the Obama years, West Virginia’s economy was hit hard. But today, the state’s unemployment rate has been lower during each of the past 19 months under this united Republican government than it was during any month of the Obama administration."
Getting this legislation done for the men and women who wear the uniform was one of our top priorities.
"The NDAA authorizes the resources that our men and women in uniform depend on, from Ft. Knox and Ft. Campbell in my home state of Kentucky to installations around the country -- and around the world."
"Today, @POTUS signed the John S. McCain 2019 National Defense Authorization Act. It gives U.S. servicemembers a raise and authorizes vital programs for our nation’s defense. I’m very proud of this legislation."
"This good economic news is an inconvenient truth for Senate Democrats, who have opposed our pro-growth policies. But the rest of America isn’t hiding from these numbers. We’re celebrating them."
We learned last week that second quarter real GDP growth exceeded 4%. That’s the best quarterly growth rate in four years and one of the strongest reports since the Great Recession.
What’s really startling is when prominent Democrat leaders let far-left talking points form the basis for their own policy positions. Senate Democrats advocating to #AbolishICE? @JohnCornyn had it right: “Get a grip.”
"The #AbolishICE movement has said our nation would be better off with no borders and no immigration laws. Period. But the American people know @ICEgov’s mission is essential, and the nation is better for it."
"Today, Vice President Pence is visiting West Virginia to discuss Republicans’ pro-growth agenda. The state’s unemployment rate has been lower every month under this united Republican government than it was in any month under President Obama."
"Today, w/ help from a united GOP government, job creators are back doing what they do best. The number of Americans saying now is a good time to find a quality job is at a 17-year high. And the number filing for new unemployment benefits is at a 48-year low. Results > rhetoric."
"Rhetoric vs. Results: Pres. Obama said “the true engine of job creation in this country will always be America’s businesses.” But his administration set two all-time records for pages in the Federal Register, including many burdensome regulations that tied job creators’ hands."
"I’m proud of the continued hard work of Chairman @SenShelby, @SenatorLeahy, and subcommittee leaders @lisamurkowski, @SenatorCollins, @SenJohnHoeven, and @SenatorLankford for managing this bipartisan appropriations process."
The appropriations measures being considered by the Senate this week cover about 1/8th of federal govt. discretionary spending for the coming year. They include resources for pressing national needs like rebuilding America’s infrastructure and confronting the opioid epidemic.
"Now, less than two years into this united Republican government, the results are different. An all-time high 95.1% of manufacturers have a positive outlook, and two-thirds plan to hire in the coming year."
"For years, President Obama and Democrats in Congress talked about getting U.S. manufacturing moving. Rhetoric was never in short supply. But results were hard to come by: During the last administration, America lost 300,000 manufacturing jobs on net."
"This year, Chairman @SenShelby and @SenatorLeahy have led a bipartisan appropriations process through subcommittee and full committee work. I hope we can continue that same cooperative spirit on the Senate floor to achieve our shared goals for the American people."
"The Senate remembers USCP Detective John Gibson and Officer Jacob Chestnut, killed in the line of duty 20 years ago today. We renew our condolences to their families. We are grateful for them and for all who wear the uniform in harm’s way."
"In Robert Wilkie, @POTUS has chosen a Secretary of Veterans’ Affairs with whom the Senate can work side-by-side to continue advancing the interests of America’s veterans. I was proud to vote, along with the overwhelming, bipartisan majority of my colleagues, to confirm him today."
"Wishing a very happy 95th birthday to my friend, @SenatorDole. Bob has built an extraordinary life, grounded in ordinary American values. Today, and every day, we are grateful for his service."
Judge Kavanaugh’s apparent comments would be in line with mainstream views that have been strongly held across the political spectrum – including by Senate Democrats themselves.
"A bipartisan majority agreed to let the flawed “independent counsels” statute expire in 1999. It has nothing to do with special counsels, or any of the other tools currently in place for holding elected officials accountable."
The left’s latest made-up controversy is an attempt to make political hay out of comments Judge Kavanaugh made about the long-ago expired “independent counsels” statute. But here are the facts:
"This week, even more of our colleagues have come away impressed after meeting with @POTUS’ #SCOTUS nominee, Judge Kavanaugh. But far-left special interests continue grasping at straws and trying to smear this nominee any way they can."
"This week, the Senate is confirming impressive nominees whom @POTUS has asked to serve our country. Two Asst. Secretaries for the Department of Education. A member of the Federal Reserve Board of Governors. Nominees for the Fifth and Ninth Circuit Courts of Appeals."
"I’m glad that this step by @IRSnews will make the right of Americans to freely advocate for their strongly-held beliefs less vulnerable to the malice of some in government, and to the proven failures of bureaucracies."
"In this country, good government means protecting citizens’ First Amendment rights to participate in the competition of ideas – not trying to shut down that competition."
"Last night, @IRSnews announced that it’s cutting back on the amount of nonpublic information the government collects and stockpiles about Americans who donate to nonprofit causes. It’s particularly welcome news for those of us dedicated to defending the First Amendment."
"But now that Democrats know his name, their attacks haven’t gotten any less hysterical. One flavor of the week: misrepresenting his decades-old writings. Perfect conspiracy theory catnip for their far-left base. The only problem? It wasn’t true. #SCOTUS"
"Even before he was nominated for #SCOTUS, Judge Kavanaugh was subjected to “fill in the blank” opposition. @POTUS hadn’t even named his selection, and already, our entire system of government was on its last legs? Give me a break."
"Judge Kavanaugh seems to impress everyone with whom he crosses paths -- at least those who haven’t blindly announced, in a fit of partisanship, their opposition to this nomination before he was even named. #SCOTUS"
"Judge Kavanaugh is the real deal. An extensive judicial record defined by fairness, thoughtfulness, and thoroughness. @POTUS has made an outstanding choice."
"Judge Kavanaugh compiled an extensive record on the federal bench, publishing more than 300 opinions, and earning considerable praise for his clear writing and reasoning. It gives us a clear picture of how he would conduct himself on the #SCOTUS."
"Judges need to be unbiased. They need to treat all parties fairly. They need to approach every case with open ears and an open mind. By all accounts, Judge Kavanaugh is precisely that sort of judge. #SCOTUS"
"Americans see beyond the far-left fear mongering. Senators should do the same. We should evaluate @POTUS’s nominee fairly, based on their qualifications. And we should treat this process with the respect and the dignity that it deserves. #SCOTUSNomination"
Our Democratic colleagues cry wolf whenever a Republican president nominates anyone to the Supreme Court. No matter their qualifications. No matter their record.  No matter their reputation. It’s the same hyperbole.  The same accusations. The same old story. #SCOTUSnominee
"American farm communities need stability and predictability, and they need it urgently. The time has come to deliver. The farm bill is too important a subject to keep our farmers and their families waiting."
"All week, I’ve highlighted some of the ways the farm bill will support the family farmers whose harvest feeds America and supplies the world. It’s an understatement to say this bill comes at an opportune time."
I’m confident Chairman Grassley will capably lead the Judiciary Committee through the confirmation process that lies before us.
"As I stated yesterday, the Senate stands ready to fulfill our constitutional role by offering advice and consent on @POTUS' nominee to fill the #SCOTUS vacancy that Justice Kennedy’s retirement will create."
"If you pick up a local paper in almost any state from Montana to Florida, you’ll find that Americans are paying less to keep the lights on. Tax reform is helping millions of families with the monthly bills."
"Despite warnings from our Democratic colleagues that tax reform savings would never reach consumers, utilities across America are already making that happen."
Let’s address farmers’ immediate needs. Let’s give them new tools to help secure their future. The farm bill before us is a prime example of the good that can come when we work together. I look forward to the Senate passing it for America’s farm families.
The Senate stands ready to fulfill its constitutional role by offering advice and consent on @POTUS @realDonaldTrump’s nominee to fill this vacancy. We will vote to confirm Justice Kennedy’s successor this fall.
I want to express gratitude for the extraordinary service that Justice Kennedy has offered our nation. We owe him a debt of thanks for his ardent defense of the First Amendment right to political speech. #SCOTUS
"The success of tax reform might come as a surprise to the Democrats who opposed it at every turn. But it certainly doesn’t surprise those of us who listened to the American people, and delivered."
"We’ve seen that tax reform is well-suited to the needs of young Americans on the first rungs of the economic ladder, whose employers can now offer more help with continuing education."
"In six short months, we’ve seen that tax reform is well-suited to the needs of the millions of American workers who’ve already pocketed thousand-dollar bonuses to put toward grocery bills and summer camp costs."
"In December, the Democratic Leader said on the Senate floor that there’s nothing about tax reform that’s “suited to the needs of the American worker.” Republicans knew better."
"From top to bottom, this farm bill takes serious steps to ensure the future of American agriculture -- for the sake of our farmers, our rural communities, and the entire country."
"Farm families across America face uncertainty: Natural disasters, from droughts to floods, volatile world markets, and falling commodity prices."
"As the proud senior senator from Kentucky, I know how important the farm bill is to agricultural communities in my home state and around the nation."
My Democratic colleagues are arguing with the facts. They’re arguing with the data. They’re arguing with American families who are keeping more of their own money. They’re arguing with the prosperity our agenda is already helping unleash.
Democrats may want to put Washington’s foot back on the brake by repealing tax reform and piling up more regulations. But they aren’t just arguing with those of us across the aisle.
"And thanks to the leadership of our colleagues at the subcommittee level, more bills will be on their way to the floor for prompt consideration."
"This week, we’ve been considering a regular-order appropriations package and voting on amendments. Thanks to Chairman @SenShelby and Ranking Member @SenatorLeahy for the transparent, bipartisan process that produced this bill."
"Six months later, here’s a remarkable fact: There are now more job openings all across this country than there are Americans looking for work. The optimism and prosperity unleashed by tax reform are part of the reason why."
"Republicans wanted working families to keep more of what they earn and send less to the IRS. Meanwhile, the Democratic Leader in the House said it was “the worst bill in the history of the United States Congress.”"
Yesterday marked six months since Congress passed our overhaul of America’s tax code. I remember debating the Tax Cuts and Jobs Act back in December. There were two different philosophies on display.
"I support, and all of the members of the Republican Conference support, a plan that keeps families together while their immigration status is determined."
"Led by Chairman @SenShelby, Ranking Member @SenatorLeahy, and all the subcommittee leadership, the Appropriations committee has engaged in precisely the kind of thorough, considered committee work that ought to define this process."
"The spending agreement reached earlier this year achieved a great deal, but the process wasn’t anybody’s best-case scenario. So here in the Senate, we made it a top bipartisan priority to bring some regular order back into the appropriations process."
"Fortunately, the facts are the facts. Americans know success when they see it. And Republicans will keep fighting to unleash more prosperity for the middle class."
There are more job openings than Americans looking for work for the first time in at least 20 years. But Democrats scoff at falling unemployment. Do they really think an outstanding job market doesn’t matter to American families?
"In #Kentucky, agriculture is part of who we are. Our farm families produce everything from poultry to soybeans. The farm bill that the Agriculture Committee passed yesterday will assist them, encourage economic growth, and increase investment in rural communities."
"Today, on the 243rd birthday of the @USArmy, I’m glad we're voting to continue advancing this critical legislation on behalf of America’s brave men and women in uniform."
"The Armed Services Committee considered and included 300 amendments in the defense bill. On the floor, Chmn @JimInhofe and @SenJackReed included more than 40 more."
"For months, Secretary Mattis and our military leaders have detailed our servicemembers’ most pressing needs and explained the importance of steady resources in the face of evolving threats. We heard them loud and clear – it’s time to put the defense bill across the finish line."
On one side of the aisle are those who mock the good economic news -- those who can’t grasp why an 18-year low in unemployment would matter to American families. On the other side are those of us who helped make it happen.
"Unemployment is lower today than at any time since 2000. Last week, the House Democratic leader responded: “Hip-hip hooray. Unemployment is down. What does that mean to me?”"
I’d like to thank the Chairman & @SenStabenow for working w/ me to include my #HempFarmingAct in the bill. It builds on the success of the pilot program I championed in the 2014 farm bill by removing federal roadblocks to industrial hemp.
"This morning, I’m joining my colleagues on the Agriculture Committee to mark up the farm bill. It’s an impressive piece of legislation, built on bipartisan collaboration and guided by Chairman @SenPatRoberts’ leadership."
"I want to share the Senate’s warmest wishes for a speedy recovery with Larry Kudlow. Larry's a happy warrior for pro-growth, pro-opportunity economics and one of the best guys in Washington. We hope he gets well soon."
"Just hours ago, the American delegation concluded their summit meeting with North Korean officials. I congratulate @POTUS on this major step and share his hope that it will begin a process that leads to an historic peace."
I just got off the phone with my friend @SenatorDole. I was grateful to catch up and thank him for his many years of honorable public service.
It’s one of our most important jobs here in Congress. The 2019 defense authorization is the top item on our to-do list. And we’ll tackle it this week.
"Congress has passed defense authorization acts for 57 consecutive years. In doing so, we’ve taken steps to fulfill one of our most fundamental constitutional responsibilities: authorizing the funds that our men and women in uniform require to keep us safe."
This is part of what we were elected to do: Get Washington D.C.’s foot off the brake. Let hard-working Americans and small businesses spend less time and energy hurdling obstacles put up by the federal government.
"In 2016, under President Obama, the Federal Register printed nearly 39,000 pages of rules (an all-time high) and another 21,000 pages of proposed rules. 60,000 pages to pile on American workers and job creators. In 2017, we slashed those numbers by more than 50 percent."
- Lowest unemployment in 18 yrs.  - More open positions than workers seeking jobs for 1st time on record.  - Optimism among small biz and manufacturers at an all-time high.  - More Americans say now is a good time to find a job than at any time in past 17 yrs.
"Sixteen months ago, @POTUS Trump & GOP majorities arrived in Washington w/ simple instructions from the American people: get the federal government out of our way. Today, under this Republican government, the U.S. economy is healthier than it’s been in a long time."
"The defense bill will support military posts that form the backbone of local communities and advance our National Defense Strategy. Kentuckians are proud of those serving at our state's Army and National Guard installations. When I vote for this defense bill, I'll do it for them."
This isn’t due diligence. It isn’t good government. It’s what happens when our colleagues across the aisle put political slogans about “the resistance” ahead of the country’s needs.
"Not a single Senator voted against confirming Robert Wier or Fernando Rodriguez to serve as district judges yesterday. But Democrats forced us to invoke cloture on each of them, and then made sure they soaked up #Senate floor time, even though literally no Senator opposed them."
"Cloture votes used to be a rare tool of last resort, only used in a tiny handful of cases. Not these days. In many cases, the nominees in question are completely uncontroversial."
"As the #Senate works to give America’s armed forces the resources they need to keep us safe, I’m proud that @POTUS has signed into law our effort to give our veterans the quality care they deserve. #VAMISSIONAct"
"The John S. McCain 2019 National Defense Authorization Act is the result of months of serious, bipartisan work by the Armed Services Committee. And it’s a major step toward delivering the resources our military needs to tackle today's challenges."
"The #Senate has been attacking the #opioid crisis from all angles, but major challenges are rarely solved in Washington. I’m proud of the work of innovators like @USWorldMeds in Louisville to deliver treatments for the millions of Americans affected by opioid addiction."
"Today, the #Senate confirmed Robert Wier to serve on the Eastern District Court of #Kentucky by a vote of 95-0. Despite needless delays, I’m proud that another of @POTUS’ well-qualified nominees is now on the job."
The bipartisan work of the Armed Services Committee has produced a strong NDAA. This legislation sends a clear message that we have our warfighters’ backs.
"After years of spending caps harming the readiness of our military, Congress passed a two-year agreement that included the largest year-on-year increase in funding for our military in 15 years. It’s time to take the next step with the critical National Defense Authorization Act."
Always great to sit down with @BretBaier. Tune in for our conversation this evening on @SpecialReport @FoxNews.
"One bill after another, one confirmation after another, the Senate is producing accomplishments that will directly improve the lives of the American people."
The #Senate is having a productive week:  -Passed VA MISSION Act to keep our promise to our vets -Confirming more of @POTUS’s nominees -Updated how Senate handles claims of harassment -Committees working on annual defense & appropriations bills
"This morning, @POTUS signed a law that will help middle-class families/small businesses access credit. It was the product of hard work by Chairman @MikeCrapo and the Banking Committee, and I was proud to support it."
"Veterans of all eras rely on the promise of accessible, quality care when they return home. But too often, the VA has fallen short of fulfilling it, with long waiting lists and limited treatment options. The shortcomings of the federal bureaucracy were apparent. (1/2)"
"Local lenders and the communities that depend on them needed relief from the inefficient, imprecise, one-size-fits-all regulatory approach of Dodd-Frank. Thanks to Chairman @MikeCrapo and the Banking Committee, that’s just what Congress and @POTUS are poised to deliver."
The bill before us carries the support of @POTUS Trump and 38 veterans advocacy organizations. It’s based on a simple idea: Promises made to those who sacrifice for our freedoms must be promises kept. I’m grateful to @SenatorIsakson for leading the charge to keep this promise.
"Today, the brave men and women of the @CIA welcomed their colleague, Gina Haspel, to a new role for which she is uniquely well-qualified. I am proud the Senate confirmed the right woman for the right moment. Congratulations, Director Haspel."
"The prayers of the entire Senate are with the victims of today’s violence in Santa Fe, their families, and the community that is coming together to support them. We are especially grateful for the first responders and others who work to protect and save lives."
