"Debido al fracaso del gobierno federal, 33, 000 techos todavía siguen con toldos azules después del huracán María, que fue hace casi 2 años. El gobierno federal debe proveer todos los recursos, por el tiempo que sea necesario, para preparar a nuestros conciudadanos para lo peor."
"Under the so-called ""War on Drugs,"" men on street corners dealing pot were thrown in jail. I want to see a war on the corporate greed that is killing Americans. I want to see top executives held personally liable for actions that led to the deaths of more than 42,000 people."
"Under my legislation, the Opioid Crisis Accountability Act, Johnson & Johnson would be fined $7.8 billion—13 times as much as this penalty, about half of the company's profits, and 10 percent of the total annual cost of the terrible opioid crisis afflicting our country."
"Over 40 years, income per person doubled. But half our people live paycheck to paycheck. Why?  Because the top 1% captured 45% of new income. And the median hourly wage grew by $2 over 40 years.  This is a rigged economy. And the working class needs to come together to fix it."
"Some say we can't afford tuition-free public college.   Let me get this straight: 40 years ago, in an economy with half the income per person, some of the best public schools were essentially free.   But guaranteeing college for all is so ""radical"" that we can't afford it today?"
"On the issue of guns, we are not so divided: Over 90% of the public supports universal background checks.    @SenateGOP and @realDonaldTrump: the country is demanding action right now. Will you side with the American people or will you just do what the @NRA wants?"
"El pueblo boricua se unió, se levantó, y le forzó a Rosselló a renunciar. Nos muestra lo que la gente común puede lograr cuando nos organizamos. Ahora tenemos que asegurar de que reciban una representación justa y receptiva. Puerto Rico se merece la democracia, no la austeridad."
Esto es inaceptable. El gobierno de los Estados Unidos le ha fallado al pueblo de Puerto Rico por demasiado tiempo. Eso debe acabar ya. El presidente Trump debe asegurar que el gobierno federal esté haciendo todo lo que esté en su poder para reconstruir a Puerto Rico.
"It makes no sense for young people to be denied jobs because they were arrested for smoking marijuana. It is time to decriminalize marijuana, expunge past marijuana convictions and end the failed war on drugs."
"Esta persona debe ayudar a la isla a recuperarse luego de décadas de devastación económica y del huracán María, que arrasó la isla hace casi dos años. Sin demora, garantizaremos el apoyo total del gobierno federal en la reconstrucción y recuperación de Puerto Rico."
"Felicito a los milliones de boricuas que se unieron a exigir que el gobernador Rosselló renunciara. Cuando nos unimos, no hay nada que no podemos lograr. La próxima persona que gobierne la isla debe escuchar a la gente y oponerse a la corrupción y la austeridad de Wall Street."
"His successor must stand against corruption and Wall Street-imposed austerity to help the island recover from decades of economic devastation and Hurricane Maria. Together, we will ensure the full support of the federal government in the rebuilding and recovery of Puerto Rico."
"Does Donald Trump want a war with Iran? Who knows? Nobody in the world knows what they'll do tomorrow. And given the confusion in this administration, it’s possible they may.   But this I do know: The United States Congress must do everything it can to prevent this war."
"Me uno al reclamo del pueblo boricua, que ha salido a la calle en un #ParoNacional, para exigir la renuncia inmediata del gobernador Ricardo Rosselló. Debemos garantizar el apoyo del gobierno federal en los esfuerzos de reconstrucción y recuperación de Puerto Rico."
"I stand with the people of Puerto Rico, who have taken to the streets for a national strike, to demand the immediate resignation of Governor Rosselló. We must ensure the full support of the federal government in the rebuilding and recovery of Puerto Rico."
"Me uno al reclamo del pueblo boricua que salió a la calle a exigir la rendición de cuentas por parte del gobernador y el fin de la corrupción. Ante los huracanes y 10 años de austeridad, los boricuas tienen derecho a la democracia y a todo el apoyo federal para salir de la crisis"
#IStandWithIlhan and am proud to work with her in Congress.   Trump is stoking the most despicable and disturbing currents in our society. And that very hatred and racism fuels him. We must fight together to defeat the most dangerous president in the history of our country.
"We are having a ""milk toast,"" the finest beverage of the great state of Vermont."
"""A democracy cannot function effectively when its constituent members believe laws are being bought and sold."" This was Justice John Paul Stevens’ prophetic dissent against Citizens United. During his tenure on the Supreme Court, he was astute and fair. We will miss him."
"One might have thought given all the Republicans in the House and Senate, a vast number would be standing up and saying the president's racist comments do not reflect the views of their party. It is sad and disappointing the degree to which Trump's ideology has dominated the GOP."
I must admit that today I felt the burn.
"I applaud the House of Representatives for voting to end all U.S. participation in the disastrous Saudi-led war in Yemen. Congress has the power to end this brutal, unconstitutional military intervention. I will do everything in my power in the Senate to see that it becomes law."
"We must stop family separation; reunite families that have been separated; end detention of families, children and anyone who doesn't pose a danger; eliminate private detention facilities; and protect asylum seekers. We also must oppose Trump's nightmarish mass-deportation plans."
Thank you. My condolences and thoughts are with you and your family. Your father is an example of what America is all about.
"El Congreso asignó fondos para asistencia nutricional de emergencia hace semanas. Mientras los puertorriqueños pasan hambre, @USDA, @SecretarySonny, @OMBPress, y @MickMulvaneyOMB mantienen esta ayuda en el limbo burocrático. ¡La administración debe proveer estos fondos ahora!"
We are saying that all public colleges and universities should be tuition-free and debt-free for ALL Americans.   All Americans are entitled to Social Security. All Americans are entitled to health care. All Americans are entitled to education as a right.
"During the financial crisis, Wall Street received the largest taxpayer bailout in American history. Now it is Wall Street’s turn to help rebuild the disappearing middle class. #CancelStudentDebt"
"Nearly half of all college students are going hungry and the average college senior takes on $30,000 in debt.   But let's go beyond statistics. Share your personal story in a video or tweet, with the hashtag #CollegeForAll. And tell me what we should be doing to fix this crisis."
"Hoping for a full recovery for Red Sox great David ""Big Papi"" Ortiz, one of the most outstanding and popular baseball players in recent memory."
"75 years ago at Normandy, the United States and its allies led the largest land invasion in history to help free Europe from Nazi barbarism. We will never forget the young people who gave their lives. We honor them by working toward a world of freedom, dignity and peace for all."
LGBTQ people face unacceptable workplace discrimination and abuse. I say to the huge corporations rainbow-branding themselves for #PrideMonth:  Pay your employees fairly. Let them unionize. Support their right to health care.  Do not cheapen the struggle for dignity and freedom.
I’ve said it before and I’ll say it again: It is outrageous that the Walton family makes more in one minute than a Walmart worker earns in a year. It is not radical to end taxpayer subsidies for this wealthy corporation and have it pay its employees a living wage of $15 an hour.
"While we honor those who made the ultimate sacrifice, we must also remember our veterans. As the former Chair of the Veterans Affairs Committee, I believe we must strengthen the VA and guarantee that all veterans receive the quality health care they earned."
"Today, on this Memorial Day, we remember and honor all those men and women who gave their lives to defend our country, American values and our democracy. Their sacrifice will not be forgotten."
"It is obvious that the President is a pathological liar who does not understand the Constitution. The fact is that if Mr. Trump continues to disregard the right of Congress to subpoena, he will leave House Members with no choice but to begin an impeachment inquiry."
"We must not only make public colleges tuition-free, but we must substantially reduce student debt in this country. It is absolutely absurd that millions of Americans are paying off debts for decades because they got a higher education."
"I thank my colleagues @SenSherrodBrown, @SenBobCasey, @RonWyden, @SenatorBaldwin, @SenBlumenthal, @SenMarkey, @SenWarren, and @SenJeffMerkley for joining me in this effort to stand with workers and against the outrageous greed of Delta Air Lines."
"The Alabama Senate voted to outlaw nearly all abortions. These hypocrites decry ""big government,"" yet they want to control every aspect of women's bodies, private decisions, and futures.   Our job is to fight at every step to protect reproductive rights."
"Join me live on Twitter and Facebook in a few moments, as I lay out my strong opposition to the Trump Administration's attempts to put us on the brink of a catastrophic and unconstitutional war with Iran."
"Jane and I, our four kids and seven grandchildren, want to take this opportunity to wish all of the great mothers of our country a very happy Mother's Day."
"Making certain that future generations have a planet that is healthy and habitable is a moral imperative. With their activism, young people are taking the lead in the fight against climate change. I look forward to speaking to the @sunrisemvmt tomorrow."
There can be no free society without a free media. The work of journalists in this country is absolutely essential to our communities and to a free and functioning democracy. Journalists should never have to fear for their lives as they do their work. #WorldPressFreedomDay
"This is the beginning of a bipartisan process to take back our responsibility over these most important matters. My likeminded colleagues and I, in a bipartisan fashion, will utilize all of the legislative tools at our disposal—including further use of the War Powers Act."
"The bad news today: we were unable today to override Trump’s veto regarding U.S. intervention in this horrific war in Yemen. The good news: for the first time in 45 years, Congress used the War Powers Act to reassert its constitutional responsibility over the use of armed forces."
"Today, the Senate will vote on overriding Trump's veto of our bipartisan bill to end unlawful U.S. participation in the Saudi-led war in Yemen. This is not about partisan politics. What’s at stake are millions of innocent lives and our Constitution. I urge my colleagues vote yes."
Attorney General Barr's handling of the Mueller report has been a disaster. This is what I feared and why I opposed his nomination. I look forward to Special Counsel Mueller's testimony and believe Congress must continue to investigate whether the president obstructed justice.
"Six trillion dollars have been spent on the so-called war on terror. That is an unbelievable amount of money. Do we really need to spend more than the next ten nations combined on the military, when our infrastructure is collapsing and young people can't afford to go to college?"
"Today is #EarthDay. Unless we take bold action to reverse climate change, future generations will look back and ask a very simple question: ""Where were they? Why didn’t the United States of America lead on preventing the devastating damage that scientists were sure would come?"""
"The House will vote soon on our resolution to end U.S. support for the Saudi-led war in Yemen, which has created the world's worst humanitarian crisis. Trump has said he opposes ""endless wars."" He can show us he means it by signing this resolution when it comes to his desk."
"The Senate Republican Budget:   - Throws 32 million off healthcare  - Cuts Medicare and Medicaid  - Kicks 175,000 kids off Head Start  - Denies nutrition assistance to 5 million pregnant moms and babies  - Provides more tax breaks to the Top 1%"
"While Trump provided a trillion dollar tax giveaway to the top 1% and profitable corporations, his budget would deny high-quality childcare and early childhood education to nearly 150,000 kids by cutting Head Start by $7.6 billion over the next ten years."
"16 years ago, the United States invaded Iraq. I opposed it at the time, warning of unintended consequences. We are still dealing with those disastrous consequences today and will be for many years. We need a foreign policy that focuses on diplomacy, not war."
"Yemen is experiencing the worst humanitarian disaster in the world due to the Saudi-led war.   The U.S. has been Saudi Arabia's partner in this horrific war. Too often, our weapons are being used to kill civilians.   Today, the Senate can take a major step toward ending this war."
"85,000 children have starved to death in Yemen as a result of the Saudi-led war.  U.S. participation in this war has not been authorized by Congress and is therefore unconstitutional.  Tomorrow the Senate will vote to end U.S. support for this disastrous and unconstitutional war."
"Medicaid covers nearly half of all births in the U.S.  But Donald Trump wants to cut Medicaid by $1.5 trillion.  Our job: Stop Trump's cruel budget and guarantee health care to every woman, man and child in this country, not throw more people off the health care they have."
We spend more on the military than the next 10 countries combined.   Now Trump is proposing an $861 billion increase in base defense spending over 10 years.   And he wants to pay for it by cutting over $1 trillion from programs working families depend on. That is a disgrace.
Trump's budget is breathtaking in its cruelty. It cuts:  - $1.5 trillion from Medicaid - $845 billion from Medicare - $25 billion from Social Security  This budget does the exact opposite of what Trump promised the American people.
"600,000 people, disproportionately people of color, were arrested for possession of marijuana in 2017.  It is time to decriminalize marijuana, expunge past marijuana convictions and end the failed war on drugs."
"Today’s House Oversight hearing with Michael Cohen confirms what we already knew: the president is a liar, a racist, and very likely a criminal."
"The people of Venezuela are enduring a serious humanitarian crisis. The Maduro government must put the needs of its people first, allow humanitarian aid into the country, and refrain from violence against protesters."
"Combined 2018 profit of Amazon, GM, Netflix & Goodyear: $24.5 billion  Federal income taxes paid: $0  Combined federal tax refund: $275 million  Our job: Repeal all of the Trump tax giveaways to the top 1 percent and large corporations and rebuild the disappearing middle class."
"Why does Trump want to repeal the estate tax? Maybe because without it, a majority of the assets held by households worth $100 million or more would never be taxed.   We must reduce inequality, not make it worse. Our job is to increase the estate tax on billionaires like Trump."
"Artificial intelligence and robotics are positive creations of the human mind. They should be used to improve the lives of working people, not just to increase corporate profits.  Human beings must control technology, not the other way around."
"Before Social Security was created in 1932, about half of seniors lived in poverty.   Today, the senior poverty rate is just 8.8% and in 2016 Social Security lifted 22 million Americans out of poverty.   Our job is not to cut Social Security. Our job is to expand it."
Trump and his friends believe in voter suppression and billionaires buying elections.   We want: ✅ Automatic voter registration ✅ The overturn of Citizens United ✅ Election day as a national holiday    History is on our side. We will win this struggle.
"The current fight in DC is about more than a wall. It's about whether we are a nation of laws, where the president obeys the Constitution and democratic processes. The American people must inform Trump that we will not become an authoritarian nation."
"Donald Trump may not like it, but we are not an authoritarian country. We have a constitution and separation of powers. There is no ""national emergency,"" and Trump cannot build his wall without congressional approval."
"The American people, the Congress and the courts must show Trump what the Constitution and separation of powers is about. Trump cannot declare a ""national emergency"" whenever he wants, and spend money on his pet project. Not gonna happen!"
"There is not a ""national emergency"" with regard to the southern border. What President Trump is doing is unlawful and must be opposed vigorously in the courts and legislatively."
Today we remember the Parkland students and teachers who lost their lives.  Thank you to the young people who have courageously led the movement to end gun violence. With your leadership and the strong support of the American people we will pass commonsense gun safety legislation
Amazon made $16.8 billion in profits over the past two years but have paid ZERO in federal income taxes. In fact it got a $269 million tax refund.  Our job: Demand large corporations pay their fair share in taxes so that we can rebuild the disappearing middle class.
"I will vote against William Barr’s nomination. I cannot support someone for attorney general who will not make public the full Mueller report, who opposes a woman’s right to control her own body and who supports the failed war on drugs. Mr. Barr’s nomination must be defeated."
Donald Trump made $694 million in 2016. That means he stopped paying Social Security taxes 40 minutes into the year.  Meanwhile a middle-class worker paid Social Security taxes the entire year.  I say to Trump: pay your fair share. Let's scrap the cap and expand Social Security.
"It is not too much to demand that in our democracy, everyone 18 years of age should be automatically registered to vote. End of discussion."
We have got to end the embarrassment of being the only major country on Earth that does not guarantee paid leave. #FAMILYAct
"Our health care system today essentially says that if you happen to be poor, you are less deserving of getting care than a wealthy person. That is fundamentally immoral and that is not the kind of nation we should be."
"Too many seniors are living in desperate poverty, unable to afford their medicine or basic needs. Many Republicans want to cut Social Security benefits. That's wrong. We need to expand them. Tomorrow, I will be outlining my plan to do that."
What kind of economy allows for the top 0.00025% of the population to own more wealth than the bottom 150 million? A rigged economy.  That is why we demand that the very wealthy and large corporations pay their fair share in taxes.
"Today in 1922, researchers at the University of Toronto announced the discovery of insulin. They sold the patent for $1 so it would be available to all.  97 years later, Eli Lilly is charging ~$300 and Americans die because they can’t afford their medication. Outrageous."
"Our infrastructure is collapsing, our health care system is dysfunctional, our political system is corrupt and we have massive levels of income and wealth inequality. And Trump spends most of his time talking about a wall. It's time for a real change."
"In the richest country in the world, our teachers should be the best-paid, not among the worst-paid. I stand with Denver teachers. We must invest in public education because our students and teachers deserve better. #DenverTeacherStrike"
"75 years ago, FDR talked about the need to guarantee every person in this country a good job as a fundamental right. That was true in 1944. It is true today."
"Trump gave the top 1% and large corporations $1 trillion in tax breaks.  Now, he wants to repeal the Estate Tax and make his billionaire friends even richer. Wrong! At a time of massive wealth inequality, the very rich must pay their fair share of taxes."
We can no longer tolerate an economy and a political system that have been rigged to benefit the wealthiest Americans in this country at the expense of everyone else.
"Trump is worried about America becoming a ""socialist nation."" That is exactly what Republicans said about Social Security in 1935 and what they said about Medicare in 1965. Guess what? These are the two most popular programs in the country."
"What if, instead giving tax breaks to billionaires and massive corporations, we gave 40 million Americans a raise by making the federal minimum wage a living wage of $15 an hour?"
"Donald Trump rants against undocumented immigrants, and wants to spend billions on a wall to keep them out. Yet, surprise, surprise. Trump's golf clubs and resorts have knowingly hired low-wage undocumented workers for years. What a fraud!"
The U.S. is the most powerful economy on earth and we must lead the world in the fight against climate change. We can do that by passing the Green New Deal to save the planet and create millions of new jobs.
Fighting for Medicare for all will mean taking on special interests who will spend enormous sums of money to defend our dysfunctional health care system. They have the money. We have the people.
"The American people are tired of a health care system that works for Wall Street investors, insurance companies and the pharmaceutical industry—but ignores their needs. They want to move to a Medicare-for-all, single-payer system."
President Trump believes we should listen to fossil fuel executives and ignore climate change.   I believe we should listen to the scientists who tell us we must aggressively combat climate change and transform our energy system to sustainable energy.
"Trump's demonization of Latinos is racist, it’s wrong and it also happens to be factually inaccurate. Undocumented Latino immigrants commit fewer crimes in America than the general public."
I agree with the joint statement from the Virginia House and Senate Democrats. Very serious and credible allegations have been made by two women against Lieutenant Governor Fairfax. He needs to resign.
Climate change is an existential disaster facing the entire world. We must transform our energy system away from fossil fuels to energy efficiency and sustainable energy. A Green New Deal can save the planet and create millions of new jobs.
Millions of our people are working for starvation wages. Here is the simple truth. Nobody can raise a family or pay the rent on poverty wages of $8 or $9 an hour.  We are the wealthiest country in the world. We can do better. We can raise the minimum wage to $15 an hour.
"Yes, the economy is great—for the top 1 percent, who now earn 46 percent of all new income. Not for the nearly 80 percent of Americans living paycheck to paycheck."
"We have got to think big, not small. Canada guarantees free health care for all, Finland provides free tuition at public colleges, France provides generous retirement benefits. We are the wealthiest country on Earth. Why can't we do the same?"
"Tonight, Trump repeated some of the most extreme anti-women attacks coming from the far right. At a time when we see an unprecedented and coordinated attack against a woman’s right to choose, we must fight to make sure that every woman has the right to control her own body. #SOTU"
"If we are serious about transforming our country, rebuilding the middle class and reinvigorating our democracy: let us bring our people together to take on and defeat a ruling class whose greed is destroying our nation. #SOTU"
"Trump said tonight, “We are born free, and we will stay free.”  I say to Trump: People are not truly free when they can’t afford health care, prescription drugs, or a place to live. People are not free when they cannot retire with dignity or feed their families. #SOTU"
Tonight Trump—who in less than two years in the White House has seen 5 aides either plead guilty or be convicted of criminal charges—claimed the strength of the economy was dependent on him being free from necessary oversight and investigations. The exact opposite is true. #SOTU
How can a president of the United States give a State of the Union speech and not mention climate change? #SOTU
"Despite what President Trump says, it is not “a hot economy” when 43% of households can't afford to pay for housing, food, child care, health care, transportation and a cell phone without going into debt. That is not a hot economy. #SOTU"
"Let me guess. President Trump tonight will talk about crimes committed by undocumented Latinos. Do you think he will mention the mass shootings done by white men, or the need for common sense gun safety legislation?"
Will Trump talk about climate change in his State of the Union address tonight?
"Today, we have the highest rate of childhood poverty of almost any major nation, our child care system is dysfunctional, our teachers are underpaid and many public schools are struggling. We need to invest in our kids, not a wall with Mexico."
"Instead of wasting billions on a wall with Mexico, tax breaks for billionaires and a bloated military budget, we need to end childhood poverty, rebuild our crumbling infrastructure, combat climate change and invest in our kids and seniors."
