"There is virtually unanimous agreement in Congress that the murder of Jamal Khashoggi must be addressed. I look forward to supporting my colleagues’ additional legislative proposals at the appropriate time, but right now I am focused on securing an up or down vote on S.J.Res. 54."
"I look forward to an up-or-down vote next week to end U.S involvement in the disastrous Saudi-led war in Yemen. I am confident that we have the bipartisan votes to pass the War Powers resolution in the Senate, which would be an historic step forward."
"12 million people in Yemen are suffering from severe hunger and 85,000 kids have already died from starvation as a result of the Saudi-led war.  The United States should not be supporting Saudi Arabia in this disastrous war. The U.S. Senate must vote to end our involvement."
"Our job is to be bold. Our job is to think very big and to go forward in a moral struggle that says: we will protect our planet, not just for our own children but for all the children of the world. #ClimateTownHall"
"Think for a moment—that instead of spending well over a trillion dollars on weapons of destruction, we could be spending that money on transforming our energy system and protecting the planet. #ClimateTownHall"
Americans living with HIV/AIDS should not have to suffer because they can’t afford the outrageous prices charged for medicine they need to live.  Our job is to bring down the cost of prescription drugs and make health care a right for all. #WorldAIDSDay
President George H.W. Bush served our country honorably. He and Barbara will be remembered for their humble and devoted service to the country they loved. Jane and I send our deepest condolences to the entire Bush family.
"A renegotiated NAFTA must stop the outsourcing of U.S. jobs, end the race to the bottom, protect the environment and lower the outrageously high price of prescription drugs.   Trump’s NAFTA 2.0 does not meet these standards and I will strongly oppose it in its current form."
"Do not forget: it was a U.S. bomb that killed 40 children on a school bus in Yemen in August—some of the many thousands of civilians who have died in this horrific, Saudi-led war.  The Senate must vote today to end our support for these atrocities."
The United States should not be supporting a catastrophic war led by a despotic regime with a dangerous and irresponsible military policy.   The Senate must vote to end U.S. support for the unconstitutional Saudi-led war in Yemen.
"At a time when voting rights are under grave attack, there is absolutely no place on the federal bench for Thomas Farr, who both authored and defended tactics designed to suppress minority voters. I strongly oppose his nomination."
"85,000 children have starved to death during the Saudi-led intervention in Yemen.  The U.S. should not be part of Saudi Arabia's destructive foreign policy. Congress must end our participation in that war now, and help provide immediate humanitarian aid there to save lives."
"We must do everything we can to protect our trans brothers and sisters from violence, and we will work every day until hatred and discrimination truly have no place in our society. #TDOR"
Trump is clearly very afraid of the prospect of the Senate delivering a serious rebuke to his policy by voting to end U.S. support for the Yemen war. But that is exactly what we will do when we vote on SJ Res 54 next week.
"Trump also blamed Iran for the disastrous war in Yemen, despite the fact that the Saudi-led coalition has caused the most destruction by far."
"Today President Trump, in a rambling and dishonest statement, tried to defend the despotic Saudi regime and cast doubt on the CIA’s conclusion that the crown prince was personally involved in the murder of Jamal Khashoggi."
"At a time of massive corporate profits, and an already regressive tax system, Amazon and other large corporations do not need corporate welfare. Instead, they need to pay their fair share of taxes."
"It is grossly unfair for millions of workers in this country to be earning starvation wages, while the companies they work for make billions in profits and pay their CEOs outrageously high compensation packages."
The bill I'm introducing today would prohibit large corporations from buying back stock unless they:  -Pay all employees at least $15/hr -Allow employees to earn up to 7 days of paid sick leave -Ensure CEO compensation is not more than 150x median employee pay  #StopWALMART
"The Walton family of Walmart is the wealthiest family in America, worth $180 billion. Middle class taxpayers should not have to subsidize Walmart’s horrendously low wages to the tune of at least $6.2 billion every year."
"While Walmart claims it cannot afford to pay its workers $15 an hour, it was able to find enough money to pay its CEO more than $22 million last year.  Tomorrow @RepRoKhanna and I will be introducing The Stop WALMART Act to put an end to their outrageous greed."
Here is the simple truth:  We have a president who is a racist. A president who is a sexist. A president who is a homophobe. A president who is a xenophobe. And a president who is a religious bigot.  We have got to confront that truth and reject Trump's bigotry.
"The Walton family of Walmart owns more wealth than the bottom 40% of Americans.  Meanwhile 55% of Walmart’s associates are food insecure.  This is what we mean when we talk about a rigged economy, and why I'm introducing a bill tomorrow to make Walmart start paying a living wage."
"Trump describes the free media as an ""enemy of the people""; attacks leaders of democratic countries while cozying up to authoritarian nations; and now uses his influence to try to stop the counting of votes in FL and GA.  There is only one way to describe him: Authoritarian."
"Last year, 4 members of the Walton family of Walmart made $12.7 billion in 1 day.  It would take a full-time Walmart worker making $11/hr over 653,000 years to make that much.  Thursday, @RepRoKhanna and I are introducing legislation to make Walmart pay its workers a living wage."
"While we set aside this day to recognize their service, we must commit ourselves to keep America’s promise to our veterans, just as they kept their promise to us."
"Today, in addition to commemorating Veterans Day, we also recognize the centennial of Armistice Day and the end of World War I, a war in which many Vermonters bravely served and lost their lives."
"On days like this we are reminded of the sacrifices made by all those women and men who have worn the uniform in defense of our nation. We owe our veterans a tremendous debt of gratitude, which we will never truly be able to repay."
In the first week of the new Congress I will be re-introducing my legislation to raise the federal minimum wage from $7.25 to $15 an hour. We have got to end starvation wages in the richest country in the world.
"Further, at a time when too many Americans are harboring homicidal and/or suicidal thoughts, we must greatly improve access to mental health counseling."
"Congress and President Trump must finally have the courage to stand up to the NRA, and do what the American people want – pass common sense gun safety legislation."
"There is no magical or simple solution to the epidemic of gun violence in our country. The mass shooting in Thousand Oaks, California, tells us, however, that we must do everything possible to stop these never-ending tragedies."
"Congress must pass legislation to protect Special Counsel Mueller’s investigation, demand that Acting AG Whitaker recuse himself from overseeing the probe based on his previous statements and only confirm a new attorney general who vows to protect Mueller's investigation."
Today we observe #LatinaEqualPay Day because Latina women still make only 53 cents on the dollar compared to white men. It should not be a radical idea to address that issue of basic equality.
"The Republican agenda is clear:  1) Take health care away from 32 million Americans 2) Give huge tax cuts to billionaires and large, profitable corporations 3) Slash Medicare, Medicaid and Social Security 4) Allow the planet to be destroyed"
"A worker making the federal minimum wage needs to work 99 hours a week, 52 weeks a year just to afford a modest one-bedroom apartment   That is a national disgrace."
"The wealth of the Walton family, the owners of Walmart, increased more than 9,000% since 1982.  Walmart still doesn’t pay their workers a living wage.  This is what a rigged economy is all about."
"If this country stands for anything it has got to stand for the right of people to practice their religion, to live their lives without bigotry, without fear and certainly within their houses of worship."
"In this country we battle with words and ideas, not fists and bombs.     Acts of violence, appeals to violence and condoning violence have no place in American society."
"The news about bombing attempts against President Obama, Secretary Clinton, George Soros, CNN, various Democratic officials and others is gravely disturbing. While many more details will come to light, these deeply un-American acts of violence have no place in our democracy."
Congratulations to United Catering Operations workers for winning your union election with @unitehere! Now it’s time to bargain your first contract. Keep fighting and winning! #EqualityatUnited
"By attacking the media and condoning violent behavior toward journalists, Trump is giving a green light to authoritarians all over the world to endanger the lives of those who work for a free press."
"We cannot have an ally who murders a dissident in cold blood, in their own consulate. That is unacceptable by any government, but especially by one so closely aligned with the United States."
"Of the many issues with Trump, his movement to an authoritarian type society here in American and his support for authoritarians around the world should be of concern to every American who believes in democracy."
"If your plan to get elected is to suppress as many minority voters, young voters, and voters with disabilities as possible, it's pretty clear you shouldn't be in politics in the first place."
4 Republican policies led to a $779 billion deficit in 2018:  - Bush Tax Cuts: $488 B - Trump Tax Cuts: $164 B - Wars in Iraq and Afghanistan: $127 B - Defense increases since 9/11: $156 B  Without tax cuts for the wealthy and endless wars we would've had a $156 billion SURPLUS.
"Next month, I plan to give the Senate another chance to vote on my resolution to end our support for the war in Yemen, to reassert Congressional authority over matters of war, and to show the Saudis that they do not have a blank check to continue human rights violations."
The Saudi-led war in Yemen has become the world's largest humanitarian disaster. The recent disappearance and likely assassination of Jamal Khashoggi only underscores how urgent it has become for the United States to redefine our relationship with Saudi Arabia.
"In Georgia, in order to try to win the election, cowardly Republicans are blatantly suppressing the vote and denying many African Americans the right to vote. Every American, no matter their political view, must vigorously protest this outrageous action."
Election Day must become a national holiday. In America we should be celebrating our democracy and doing everything possible to make it easier for people to participate in the political process.
Authoritarians seek power by promoting division and hatred. We will promote unity and inclusion. #SandersSAIS
Our job is to make sure that we commit more resources to taking care of people than we do on weapons designed to kill them. #SandersSAIS
"The world spends a total of $1.7 trillion a year on the military.  The cost to end poverty is $175 billion per year for 20 years, about 10% of what the world spends on weapons.  Donald Trump thinks we should spend more on these weapons. I want to spend less. #SandersSAIS"
"Our job is to rally the entire planet to stand up to the fossil fuel industry, which continues to make huge profits while their carbon emissions destroy the planet for our children and grandchildren. #SandersSAIS"
"The idea that political donors in America expect a specific policy result in exchange for their contributions—a quid pro quo, the definition of corruption—is no longer even seen as scandalous. This sort of corruption is common among authoritarian regimes. #SandersSAIS"
"We need to understand that the struggle for democracy is bound up with the struggle against kleptocracy and corruption, both here in the United States as well as abroad. #SandersSAIS"
"Even as Trump draws closer to authoritarian leaders like Putin, Orban in Hungary, Erdogan in Turkey, Duterte in the Philippines, and North Korea’s Kim Jong Un, Trump is needlessly increasing tensions with our democratic European allies. #SandersSAIS"
"It’s hard to imagine that Israel’s Netanyahu government would have passed the recent “Nation State law,” which essentially codifies the second-class status of Israel’s non-Jewish citizens, if Netanyahu wasn’t confident that Trump would support him. #SandersSAIS"
"Three years ago, who would have imagined that the United States would refuse to take sides between Canada—our democratic neighbor and second largest trading partner—and Saudi Arabia on an issue of human rights. #SandersSAIS"
"If it is true that the Saudi regime murdered Jamal Khashoggi, a journalist critic, in their own consulate, there must be accountability, and an unequivocal condemnation by the United States. #SandersSAIS"
There’s no question that authoritarian leaders around the world have drawn inspiration from the fact that the president of the world’s oldest and most powerful democracy shatters democratic norms and attacks the independent media and judiciary. #SandersSAIS
"We need to counter oligarchic authoritarianism with a strong global progressive movement that speaks to the needs of working people, that recognizes that many of the problems we are faced with are the product of a failed status quo. #SandersSAIS"
"Leaders in the new authoritarian axis share key qualities: intolerance toward minorities, hostility toward democratic norms, antagonism toward a free media, and a belief that leaders of government should be able use their power to serve their own financial interests. #SandersSAIS"
"On one hand, we see a worldwide movement toward authoritarianism, oligarchy, and kleptocracy. On the other hand, we see a movement toward strengthening democracy, egalitarianism, and justice. #SandersSAIS"
"We spend $700 billion a year on the military and have been at war in Afghanistan for 17 years and Iraq for 15. The time is long overdue for a vigorous discussion about our foreign policy, and how it needs to change in this new era. #SandersSAIS"
The disgrace of what has taken place with Brett Kavanaugh’s nomination will not be lost on the American people. We are mobilized from coast to coast.
Judge Kavanaugh is not worthy of joining the Supreme Court.  - He will become a part of the hard-right majority on the Supreme Court - There are very credible allegations of sexual assault against him - He lied to Congress
Let me say this to all the survivors out there: I hear you. I believe you. Thank you for speaking out.
"Trump’s remarks last night were unusually horrendous.   Dr. Ford has received death threats. Nazis have protested outside her house. Last week, she was forced to publicly answer questions about an experience so painful it still haunts her.  And Trump's response was to mock her."
"The 4 largest banks in this country (JP Morgan Chase, Citigroup, Bank of America, and Wells Fargo) are on average 80% larger today than they were before we bailed them out.  If these banks were too big to fail 10 years ago, what would happen if any of them were to fail today?"
"I want to congratulate Jeff Bezos for doing exactly the right thing by raising the minimum wage at Amazon and Whole Foods to $15 an hour.  Let me thank the hundreds of Amazon workers who contacted my office and the Fight for $15 movement, which has been leading this effort."
One year ago 58 people were killed and 800 injured by a gunman in Las Vegas. My thoughts are with those victims' families today. We have got to prevent more innocent Americans from becoming victims of gun violence by passing commonsense gun safety legislation.
"Kavanaugh claimed that he and Dr. Ford “did not travel in the same social circles.” Dr. Ford said she dated Chris Garrett, referenced as a friend in his yearbook. In fact she testified Garrett introduced her to Kavanaugh. (9/x)"
Judge Kavanaugh testified he treated women “as friends and equals” and “with dignity and respect.” Numerous entries in his school yearbook would seem to contradict this. Was Judge Kavanaugh’s statement to the committee truthful? (8/x)
"Kavanaugh repeatedly told the committee he never drank to the point where he didn’t remember something. He also denied ever becoming aggressive when he drinks. There have been many reports from Kavanaugh's high school, college and law school classmates that contradict this. (7/x)"
"Kavanaugh testified before the committee that he did not believe polygraphs were reliable. In 2016 he wrote, “The Government has satisfactorily explained how polygraph examinations serve law enforcement purposes.” What changed his opinion or was he misleading the committee? (6/x)"
"In 2006 Judge Kavanaugh testified, “I was not involved and am not involved in the questions about the rules governing detention of combatants.” New evidence released as part of these confirmation hearing contradicts that assertion. (5/x)"
In 2004 Judge Kavanaugh testified the nomination of William Pryor to the 11th Circuit “was not one that I worked on personally.” Documents now contradict that statement. (4/x)
In 2006 Kavanaugh told Congress he didn't know anything about the NSA warrantless wiretapping program prior to it being reported by the NYT. This year an email revealed that while at the White House he might have been involved in some conversations about this program. (3/x)
Kavanaugh was asked more than 100 times if he knew about files stolen by Republican staffers from Judiciary Committee Democrats. He said he knew nothing. Newly released emails show that these files were regularly shared with Kavanaugh while he was on the WH staff. (2/x)
The FBI investigation of Brett Kavanaugh must include a review of his numerous untruthful statements in his previous testimony before Congress. Lying to Congress is a federal crime.   Here are his statements that appear to not be true: (1/x)
"If @ChuckGrassley and Senate Republicans are concerned a thorough FBI investigation would delay this confirmation process, remember that you refused to allow the Senate to consider Merrick Garland’s nomination for nearly a year."
A man who uses the same hostile and aggressive tactics as Donald Trump when faced with credible allegations of sexual assault does not deserve a lifetime seat on the Supreme Court.
"I listened to Dr. Ford and Judge Kavanaugh. I believe Dr. Ford.   Brett Kavanaugh does not belong on the Supreme Court.  If Judge Kavanaugh wants to clear his name of these serious charges he should demand an FBI investigation. If not, the Senate must reject his nomination."
"Today we need to remember: Dr. Christine Blasey Ford and the others who have come forward have done so with incredible courage, fully knowing that their character would be attacked and terrible things said about them. Their lives will never be the same. We owe them our respect."
Trump and Judge Kavanaugh have two options. Trump can withdraw Judge Kavanaugh's nomination. Or Kavanaugh himself can call for an FBI investigation if he truly believes the allegations are false.
For far too many people it's too difficult to get to the polls. We need to make it much easier for everyone to participate in the democratic process. Election Day should be a national holiday.
"Dr. Christine Blasey Ford and Deborah Ramirez have risked their lives to come forward and tell their stories. Republican Senators, their staff and the Trump administration must stop disparaging these brave women and treat them with respect."
"If Brett Kavanaugh refuses to withdraw from consideration for the Supreme Court following these two very serious allegations of sexual assault, then the Senate Judiciary Committee must postpone any votes on his nomination until a full and fair investigation is conducted."
"One year since #HurricaneMaria, the people of Puerto Rico are still suffering. We must use the full resources of the US government to not only help the island recover, but to go forward and create a strong, sustainable economy and energy system."
40% of fast-food workers have reported experiencing sexual harassment. That is simply unacceptable.   We must stand with the brave McDonald’s workers walking out today to demand the company address this epidemic of sexual harassment.
"Yesterday the President of the United States lied about the deaths of thousands of American citizens for his own personal gain.  Mr. President, try working with the people of Puerto Rico for a change, not against them."
"We are not going to let Social Security be destroyed. Today, 18 senators and 140 House members are founding the Expand Social Security Caucus to make sure seniors can retire in dignity.  Hear that, Paul Ryan?"
"Today while we remember the lives lost on 9/11, we must also honor the courageous men and women who continue to serve and die in Afghanistan, Iraq and many other places, and consider whether these wars—the longest in our history—have made us safer."
"We must not only work to end terrorist violence. We must fight the conditions that give rise to it: corruption, authoritarianism, inequality and ethnic and religious hatred."
"If this is the wealthiest country on Earth, why are one in five American adults skipping medical care because they can't afford it?  Answer: our health care system is built to make corporate profits — not give people the care they need. #MedicareForAll"
"Today we remember the nearly 3,000 lives lost on 9/11 and many brave people who risked their lives that day to help. Those acts of selfless sacrifice speak to the very best of us as a nation—we are a people prepared to come together and work for the good of our fellow Americans."
"If we are bold, if we have the courage to take on the fossil fuel industry, if we are prepared to invest in sustainable energy, we can make the necessary changes to save the planet. And that’s exactly what we have to do. #RiseForClimate"
"The issue about Amazon is not just that the wealthiest person on earth, Jeff Bezos, is paying workers unlivable wages. It's about the ""new economy"" and the degradation of the human spirit—breaking down people, spitting them out and simply replacing them with new bodies."
"Our job now is to energize people, revitalize American democracy and fight for a government that will work for all of us, and not the wealthy few."
"This week we have seen more and more evidence of President Trump’s dangerous disregard for the democratic norms of our country, and stunning revelations about his erratic and misguided policy decisions and his pathological lying. We live in dangerous and unprecedented times."
Brett Kavanaugh's nomination is a dire threat to:  -Abortion rights -Campaign finance reform -Voting rights -Workers' rights -Health care -Climate change -Environmental protection -Gun safety  He cannot be given a lifetime seat on the Supreme Court.
Let's be clear: the government has a moral responsibility to provide for the vulnerable. But taxpayers should not have to expend huge sums of money subsidizing profitable corporations owned by some of the wealthiest people in the country and the world.
"If employers in this country simply paid workers a living wage, taxpayers would save about $150 billion a year on federal assistance programs and millions of workers would be able to live in dignity and security."
"President Trump is an unindicted co-conspirator in a crime. We should not confirm his Supreme Court justice nominee Brett Kavanaugh, a man who believes the president cannot be indicted or deposed."
"What is the Trump administration trying to hide about Brett Kavanaugh? If Republicans believe he deserves a lifetime seat on the Supreme Court, they must stop hiding his records and release all of his documents."
"The trade union movement has led the fight for equal rights and economic and social justice. Today, Labor Day, we reflect on those struggles, and pledge our support to protecting workers’ rights and building an economy based on human needs, not corporate greed."
"The median Amazon employee makes $13.67 an hour.  Many of those employees rely on food stamps, Medicaid and public housing to survive.  You know who pays for that? You do.  You know what Jeff Bezos makes every hour? $10,833,33  It's time for Amazon to get off corporate welfare."
"Amazon’s warehouses are one of the most dangerous places to work in the U.S. According to the NCOSH, seven Amazon workers have died on or near the job since 2013. I will be asking OSHA to investigate unsafe working conditions at Amazon fulfillment centers."
"Just 3% of Brett Kavanaugh's records have been released. If Republicans believe Kavanaugh deserves a lifetime seat on the Supreme Court, why are they afraid to show the American people what Kavanaugh has written?"
"Billionaires shouldn't be on welfare. If the owners of large, profitable corporations won't pay workers a living wage, then we are going to tax them for 100% of the public assistance benefits their workers are forced to rely on."
