"John McCain was an American hero, a man of decency and honor and a friend of mine. He will be missed not just in the U.S. Senate but by all Americans who respect integrity and independence. Jane and I send our deepest condolences to his family."
"Betsy DeVos has a brilliant idea. While paltry school budgets deny kids a decent education, she may let states use federal funds to buy guns for educators—not books, computers or pay raises. Guns. Meanwhile the Trump administration opposes all commonsense gun safety legislation."
"At a time when Trump is an unindicted co-conspirator in a crime, we shouldn’t confirm a Supreme Court justice picked by Trump, who believes the president cannot be indicted or deposed. The Senate must postpone Kavanaugh’s hearings until the ongoing investigations are complete."
Americans deserve to know the truth about the 2016 election. Any attempt by the president to interfere with Special Counsel Robert Mueller’s investigation or pardon Cohen or Manafort would be a very serious offense.
President Trump's associates who have pleaded guilty to or been convicted of serious crimes – so far:  - His campaign chairman - His deputy campaign chairman - His lawyer - His national security advisor - His foreign policy advisors
"11) So, the question that must be asked is why would the corporate media would put their blind faith in a far right-wing economist whose past reports have been so thoroughly discredited by mainstream economists and experts?"
3) What Tapper and others have done is say we're wrong because Blahous didn't actually intend to find that Medicare for All would be a great deal for Americans. The problem is: Blahous did find it would save $2 trillion – he just doesn't like that people are celebrating it.
...Any score that replaces Medicare reimbursement rates with some other set of rates is not a score of our plan.
"2) Tapper says, “The study’s author says that that $2 trillion drop is not actually his conclusion. He says that’s based on assumptions by Senator Sanders.” Wrong. Provider payment rates in our plan are not assumptions, they are written into the bill..."
"This is how our rigged system works:  1) Republicans give huge tax breaks to their wealthy campaign contributors  2) Billionaires spend millions to elect Republicans  3) Republicans push cuts to Social Security, Medicare & Medicaid to make the rich richer and everyone else poorer"
"Remember: our ""crazy idea"" of universal health care is a reality in:  Australia Austria Belgium Canada Chile Czech Rep. Denmark Finland France Germany Greece Hungary Iceland Israel Italy Japan Netherlands New Zealand Norway Poland Portugal S. Korea Spain Sweden Switz. Turkey U.K."
"A year ago, countless people were injured protesting white supremacy and Neo-Naziism in Charlottesville and and one person, Heather Heyer, was killed. Today, we honor Heather, and all who stood up to hate, by recommitting ourselves to fighting all forms of racism and bigotry."
"Maybe, just maybe, we should make sure our people are not dying because they lack health insurance before we start spending billions to militarize outer space. #SpaceForce"
"Despite Trump’s tax giveaway to the wealthy and large corporations, real wages have actually gone down, not up, since June 2017. The economy may be the best in history for billionaires like Jeff Bezos, but it is not ""booming"" for the average worker."
"What insurance company CEOs made in 2017: -Leonard Schleifer (Regeneron): $95.3 million -Dave Wichmann (UnitedHealth): $83.2 million -Mark Bertolini (Aetna): $58.7 million  We need a system that provides health care for all, not massive compensation for a few CEOs.#MedicareForAll"
"If every major country on Earth can guarantee health care to all and achieve better health outcomes, while spending substantially less per capita, please don't tell me that the United States cannot do the same."
"I can't believe we have to say this in the year 2018: Poverty is not a crime.  Hundreds of thousands of Americans, convicted of nothing, should not be in jail because they can't afford their bail."
"Does anyone really believe Trump is concerned with human rights in Iran, when he’s had only kind things to say about authoritarians around the world, including Putin in Russia, Kim Jong Un in North Korea, Duterte in the Philippines and Mohammad Bin Salman in Saudi Arabia?"
"Thank you to the young people leading the fight to put people over profits and transform our energy system away from fossil fuels to renewable energy. When we stand together, we can overcome the power of the fossil fuel industry. #ThisIsZeroHour #YouthClimateMarch"
"Today we mark the 100th birthday of Nelson Mandela, who led the struggle to end the horrible apartheid system in South Africa. Let his courage and commitment to equality and justice serve as an example to all of us as we work to create a better world."
"5) And finally, the Congress must make it clear to President Trump that his job is to protect the values that millions of Americans struggled, fought and died to defend: democracy, justice and equality."
"4) The Congress must make it clear that we will not accept any interference with the ongoing investigation of Special Counsel Mueller, such as the offer of preemptive pardons or the firing of Rod Rosenstein, and that the president must cooperate with this investigation."
3) The Congress must demand that the sanctions against Russia that were passed last year be fully implemented.
"2) The Congress must move aggressively to protect our election systems from interference by Russia or any foreign power, and work closely with our democratic partners around the world to do the same."
1) The Congress must make it clear that we accept the assessment of our intelligence community with regard to Russian election meddling in our country and in other democracies.
"If President Trump won't confront Putin about interference in our elections and his destabilizing policies, Congress must act. Tweets and speeches are fine, but we need more from Republican senators now.  Congress must take these 5 actions to rein in Trump's dangerous behavior:"
"McDonald’s gave its CEO a 42% raise last year, while it reneged on a commitment it made to pay at least $1 an hour above the local minimum wage to its low wage workers. #CEOsvsWorkers"
"Walmart's CEO, Doug McMillon, made more than $22 million in compensation lsat year—or almost $11,000 an hour. #CEOsvsWorkers"
The Walton Family of Walmart owns more wealth than the bottom 40% of Americans. Meanwhile 55% of Walmart’s associates are food insecure. #CEOsvsWorkers
"Jeff Bezo’s newly renovated home in Washington DC will have 25 bathrooms. Meanwhile, Amazon workers skip bathroom breaks in order to meet their grueling work targets. #CEOsvsWorkers"
"Last year, Amazon reported nearly $5.6 billion in U.S. profits and did not pay a penny of federal income taxes on it. #CEOsvsWorkers"
"How does it happen that there are many major corporations in America where CEOs receive extravagant compensation packages, who pay their workers wages so low that many of them are forced to rely on food stamps to survive?  #CEOsvsWorkers"
While Disney’s CEO makes up to $423 million: - 1 in 10 Disneyland workers have been homeless in the past 2 years - More than 2 in 3 are food insecure - 3 in 4 don’t make enough money to afford basic needs  That is simply not acceptable. #CEOsvsWorkers
The average cashier at McDonald's would have to work for 895 years to make what the company's CEO makes in one year. #CEOsvsWorkers
Today is a good day for Putin and the oligarchs in Russia. It is a bad day for people in the United States and all over the world who believe in democracy and who are trying to understand what world our idiot president lives in.
Millions of Americans have risked their lives to defend our democracy. What would those brave men and women think if they saw President Trump's pathetic performance today?
Will Jeff Bezos have the guts to face Amazon workers at our town hall tonight at 7 pm ET and explain why he's worth $151 billion but won't pay them a living wage?
"President Trump’s press conference with Putin was an embarrassing spectacle. Rather than make clear that interference in our elections is unacceptable, Trump instead accepted Putin’s denials and cast doubt on the conclusions of our intelligence community. This is not normal."
Last year American Airlines made $1.9 billion in profits. Its CEO Doug Parker is on track to make $31 million this year.  They need to explain why 27% of workers at their subsidiary Envoy Air said they must accept food stamps and other public assistance to make ends meet.
"Universal health care in America is not a radical idea anymore, thanks to the millions who have spoken out to demand a just health care system. 63% of American voters now support a Medicare-for-all health care system."
"Walmart’s CEO Doug McMillon made about $11,000/hour in compensation last year. I'd like to hear from him why he thinks his workers don't deserve to be paid a living wage of $15/hour."
"The Walton family, the owners of Wal-Mart, is the wealthiest family in America. Middle class taxpayers should not have to subsidize Walmart’s low wages to the tune of at least $6.2 billion each and every year. That's absurd."
"I'd like McDonald's CEO Steve Easterbrook to explain why the company had enough money to reward its wealthy shareholders with $7.7 billion in stock buybacks, but reneged on a commitment it made to its low-wage workers to pay them at least $1-an-hour above the local minimum wage."
"The Trump administration declaring the war on poverty “largely over"" is a callous attempt to justify their efforts to make massive cuts to Medicaid, Medicare, Social Security disability, education and affordable housing, while they give huge tax breaks to billionaires."
Does Disney CEO Bob Iger have a good explanation for why he is being compensated more than $400 million while workers at Disneyland are homeless and relying on food stamps to feed their families?
"""The only way that I can see to deploy this much financial resource is by converting my Amazon winnings into space travel."" –Jeff Bezos, worth $147 billion  Mr. Bezos, here's another idea. Pay your workers enough so that thousands of them no longer have to rely on food stamps."
"Over and over again, Donald Trump tells us the U.S. economy is “absolutely booming.” Then why have wages gone down, not up, by 5 cents an hour since June of last year after adjusting for inflation?"
"President Trump’s Supreme Court nominee Brett Kavanaugh will be a rubber-stamp for an extreme, right-wing agenda pushed by corporations and billionaires. We must mobilize the American people to defeat Trump’s right-wing, reactionary nominee."
"If you are serious about this issue, tell your Republican pals in Congress to pass bills requiring Medicare to negotiate drug prices and enabling the importation of safe, low-cost drugs from Canada and other countries. (2/2)"
"Ed Schultz was a passionate defender of American workers and strongly supported trade policies that work for all, not just large corporations. For many years his voice has been strong, steady & against forces of corporate greed. Ed was a friend of mine and will be sorely missed."
I will do everything possible to see that the next EPA administrator actually believes in environmental protection.
"Instead of protecting our environment and combating climate change, Pruitt has worked to protect the interests of the fossil fuel industry and polluters all over the country. His resignation is a positive step forward for our country."
"The United States must lead the world in transforming our energy system by moving aggressively to energy efficiency and sustainable energy. When we do that, we protect the planet, create jobs and save consumers money."
"We must not be about forcing over 10 million undocumented people, many of whom have been here for decades, to continue living in fear and anxiety. Congress must do what the American people want. Let us create a humane and rational immigration system."
"That will mean restructuring the agencies that enforce our immigration laws, including ICE. We must not be about tearing small children away from their families. We must not be about deporting DREAMers, young people who have lived in this country virtually their entire lives."
"In 2002 I voted against the creation of DHS and the establishment of ICE. That was the right vote. Now, it is time to do what Americans overwhelmingly want: abolish the cruel, dysfunctional immigration system we have today and pass comprehensive immigration reform."
Have you worked a minimum wage fast food job? What is it like to try to support yourself or your family? Do you have access to benefits or career opportunities?
Thank you to the thousands of people turning out today to protest Trump's cruel policy of separating families. The United States of America must never be about tearing apart families or locking up children in cages. #FamiliesBelongTogether
There can be no free society without a free media. The work of journalists in this country is absolutely essential to our communities and to a free and functioning democracy. Journalists should never have to fear for their lives as they do their work.
"When it comes time to decide on a replacement for Justice Kennedy, I hope that my Republican colleagues who believe that women, not the government, have the right to control their bodies will stand with those of us who oppose any nominee who would deny women the right to choose."
"While today’s ruling is a major setback for working families, we must redouble our efforts to make it easier, not harder, to join a union. We cannot rebuild the disappearing middle class without revitalizing the trade union movement."
"What the Kochs and other billionaires understand is that if they can destroy the trade union movement in America, it will be even more difficult for workers to earn decent wages and benefits, and the political power of working people will be diminished."
"America loses when we become divided by religion, race, national origin or sexual orientation. We are stronger when we come together."
"Trump's pathological dishonesty is undermining our democracy, setting a terrible example for our children and isolating us from our democratic allies around the world.  Now is the time for the American people to fight back on every front."
"Trump tells us every day how much he hates immigrants and how much he loves American workers. But last year, Trump chose to hire only one American worker even though thousands of Americans wanted to work at his Mar-a-Lago resort. The rest were low-wage temporary guest workers."
"What a hypocrite! @realDonaldTrump makes hateful and racist rants every day about how immigrants are “bad” for the country, but he had no problem hiring undocumented immigrants to help him build the Trump Hotel in DC or Trump Tower in New York City."
"Trump's political strategy:  1) Give tax breaks to billionaires, throw millions off health insurance, cut Social Security, Medicare, Medicaid 2) Blame immigrants (or blacks, Muslims, gays, Jews) as the cause of all problems  This is the kind of hate politics demagogues always use"
"I am hopeful that, as we have seen with other racist and xenophobic Trump policies, the courts will step in to rein in these unlawful actions."
"When you have the most powerful nation on earth saying that it is acceptable to tear children from the arms of their parents, you are sending a signal to countries around the world that this is how they can treat immigrants and minorities. That is a very dangerous signal."
"To be politically successful, Trump needs to create enemies and divide us up. He needs to turn men against women, white against black, straight against the LGBT community, Christian against Muslim, native born against immigrant. We will not let him win."
We cannot spend more on our military than the next 10 nations combined while millions of Americans do not have food and housing and health care. It’s about time we got our national priorities right. That is why I voted against spending $716 billion on the military today.
"This is America, a nation of compassion and generosity. We will not allow Trump, Sessions or anyone else to continue a policy of ripping babies from the arms of their mothers. Together, we will defeat this inhumane and un-American action."
"The Trump admin, in its unabashed cruelty, is carving out a unique place in American history. It's not just support for racism, sexism, homophobia, xenophobia and religious bigotry. They've hit a new low by separating kids from their parents and placing them in detention centers."
"The Trump administration’s “zero tolerance” policy of separating children, including infants as young as one year old, from their parents at the border is inhumane, cruel and an affront to our values as Americans."
"Two years after 49 people were killed at the Pulse nightclub in Orlando, it is a national tragedy that we have not done a single thing to prevent another mass shooting. We must pass gun safety legislation now. My thoughts are with those who are remembering their loved ones today."
"While very light on substance, Trump and Kim Jong Un's meeting is a positive step in de-escalating tensions and addressing the threat of North Korea’s nuclear weapons. Congress has a key role to play in making sure this is a meaningful process, not just a series of photo ops."
"Since 1995, Boeing, Lockheed Martin and United Technologies have paid nearly $3 billion in fines or related settlements for fraud or misconduct. Yet, those three companies alone received about $800 billion in defense contracts over the past 18 years."
"Over and over again, Republicans say we cannot possibly afford to make health care a right through a Medicare-for-all program.  But when it comes to spending $716 billion on the military, all of a sudden there's deafening silence from my Republican colleagues about the deficit."
"I find it very strange that President Trump has such a hard time getting along with the leaders of the world's major democracies but feels very comfortable with despots and authoritarian leaders like Putin, Xi Jinping, Duterte and Mohammad Bin Salman."
"In their never-ending quest to throw millions off health insurance and raise premiums, the Trump Administration is now arguing in court that it should be legal for insurance companies to discriminate against the 130 million people with pre-existing conditions. That is a disgrace."
"Employee-owned companies won't provide starvation wages to workers and huge compensation packages to CEOs. They will not shut down and send their own jobs to China. In fact, study after study has shown that employee ownership increases employment, sales and wages."
"Instead of giving huge tax breaks to corporations who shut down in the United States and send jobs abroad to low-wage countries, we must invest in creating worker-owned companies."
"We all hope that the summit between Trump and Kim Jong Un is successful. Getting rid of North Korea's nuclear weapons through a credible process would be a major step forward for world peace. But when Trump praises Kim as “very honorable,” he makes a mockery of American values."
I believe that we have become far too comfortable with the United States engaging in military interventions all over the world. We need to ask this very hard question: is a perpetual war necessary to keep us safe?
"If we were a poor country, it would be reasonable to question whether we can achieve universal health care.  But we are not. We're the richest country in the history of the world. We can and must make health care a right to all."
We have to decide as a nation whether information about what we do with our lives should be sold to companies that will exploit that information.
"It costs $30,000 to send a California student to UCLA for a year. To send someone to prison, it costs $75,000.  We need to be a nation that invests in jobs and education, not jails and incarceration."
"This is what a rigged economy looks like: Working 100 hours in a week, not getting paid and actually owing the company a check.  Port truck drivers in this country deserve justice!"
"I strongly support imposing penalties on countries like China, Russia, South Korea and Vietnam to stop illegal dumping of steel and aluminum. But it makes no sense to start a trade war with Canada, the EU and others who are engaged in fair trade and pay workers a living wage."
"Trump’s haphazard and reckless plan to impose tariffs on Canada and the European Union is an absolute disaster that will cause unnecessary economic pain to farmers, manufacturers and consumers in Vermont and around the country."
I have a feeling ABC will not be asking on its nightly news program tonight how Disney can make $9 billion in profits while three-quarters of Disneyland employees can’t afford basic living expenses.
"Memorial Day is a time to pay special tribute to service members who paid the ultimate sacrifice and to honor and support their families. We should be united in commemorating the sacrifices of those who gave, as Lincoln said, “the last full measure of devotion” to our country."
"Our job: Increase the minimum wage to $15 an hour, create up to 15 million good jobs rebuilding America, expand Social Security, enact Medicare for all, and make it easier for workers to join unions."
"When Trump tells us the economy is ""booming,"" please remember: - Over 40% of Americans don't have enough savings to cover a $400 emergency expense - 43% can't afford the basics to live - Over 25% of adults skipped necessary medical care last year because they couldn't afford it"
"With the apparent cancellation of the summit, the Trump administration should now commit itself to working with our allies in Asia and the international community on a genuine diplomatic strategy to remove the threat of North Korea’s nuclear weapons."
"I am concerned that despite some very good provisions in the VA MISSION Act, it continues a trend toward the slow, steady privatization of the VA. I will vote against it."
"At a time of exploding profits, I would hope that @Amazon would pay everyone who works in your fulfillment centers a living wage. Thank you very much for your invitation to visit a fulfillment center. I look forward to doing that. Let’s work out a mutually convenient time."
"In Vermont, Planned Parenthood is the only provider of Title X services, and without federal funding, their ability to serve thousands of low-income Vermonters will be seriously limited."
"I always find it curious that ""conservatives"" tell us how much they want to get the government off the backs of the people. But when it comes to women and family planning, they want to the government to tell every woman in America what she can and cannot do with her body."
"The American people, gun owners and non-gun owners alike, overwhelmingly support common sense gun safety legislation. It's time to act."
It is not a radical idea to say that every American citizen over the age of 18 should be automatically registered to vote.
The Senate just took an important step toward reversing the Trump administration’s disastrous decision to repeal #NetNeutrality. Now the House must side with the 86% of Americans who support net neutrality and pass this resolution to protect our free speech and democracy.
"Up to 20% of incarcerated people in America are imprisoned because they lack the money to pay cash bail or fines for minor violations.   Let me say that again. Some 400,000 people are incarcerated today for crimes they haven't been convicted of. That is insane."
We need to stop imprisoning people for smoking marijuana and start prosecuting the crooks on Wall Street whose greed and illegal behavior caused the greatest economic downturn since the Great Depression.
"The United States must play an aggressive role in bringing Israel, the Palestinian Authority, Egypt and the international community together to address Gaza’s humanitarian crisis and stop this escalating violence."
"Over 50 killed in Gaza today and 2,000 wounded, on top of the 41 killed and more than 9,000 wounded over the past weeks. This is a staggering toll. Hamas violence does not justify Israel firing on unarmed protesters."
"If we're going to reverse the 40-year decline of the middle class and reduce the widening gap between the super-rich and everyone else, we must restore the constitutional right of workers to collectively bargain for a better life."
"Unlike Trump, Congress must take real action to lower the price of prescription drugs. That means passing legislation requiring Medicare to negotiate for lower drug prices and allowing the reimportation of safe, low-cost prescription drugs from Canada and other countries."
"The president made clear today that he will not keep the promises he made during the campaign to lower the outrageously high cost of prescription drugs. Instead, he has become a supporter of the pharmaceutical industry's extraordinary greed."
We need a new CIA director who is committed to the rule of law and will heed the advice of U.S. military leaders who vigorously oppose torture and uphold the values that have made us a great and respected nation. Ms. Haspel is the wrong choice to lead the CIA.
"In America today, if an employee is engaged in a union organizing campaign, that employee has a one in five chance of getting fired. That is unacceptable and that has got to change."
"If we're serious about reducing income inequality and rebuilding the middle class, we must increase the number of union jobs in this country."
