"Three people own more wealth than the bottom half of our country. 25 hedge fund managers earn twice as much as all 140,000 kindergarten teachers. One family (Kochs) spent $400 million to buy elections. That's why we need a political revolution."
Let's not kid ourselves. What we have today is a campaign finance system that amounts to legalized bribery.
"Remember when Trump promised that his tax giveaway to the rich would put an extra $4,000 into the pockets of middle-class families?  The reality: bonuses for average workers are up by just two cents an hour since Trump’s tax plan was signed into law. Two cents."
Every other major country has made the morally principled and financially responsible decision to make health care a right to all of their people. Those who say this goal is unachievable are selling the American people short.
Gov. Northam should resign. Lt. Gov. Justin Fairfax should step in and begin a new day for Virginia.
"Trump’s withdrawal from the INF treaty is dangerous and irresponsible. We should strengthen these treaties, not end them. We should invest in our children, our seniors and our working families, not in an incredibly expensive arms race."
"The grotesque level of wealth inequality, from a moral, economic and political perspective, is the great challenge we face. We cannot have a vibrant democracy or a just economy when so few have so much, and so many have so little."
"Our infrastructure is collapsing. Teachers are underpaid. Veterans sleep on the streets. Families can't afford child care.  But, according to my Republican colleagues, one of our highest priorities must be to give hundreds of billions of dollars to a few billionaire families."
It is not just a coincidence that 46% of all new income is going to the top 1%. That is the result of an economy that is rigged in favor of the wealthy.
"Incredibly, Republican leaders in the Senate have introduced a bill to repeal the estate tax for the richest 1,700 families in America. That's absurd.  From a moral, economic and political perspective our nation will not thrive when so few have so much and so many have so little."
Our bill only applies to the richest 0.2% of Americans. It would establish a:  -45% tax on estate values $3.5M to $10M -50% tax on estate values $10M to $50M -55% tax on estate values over $50M -77% tax on estate values over $1 billion
"Somehow, we have billions of dollars available for more jails and incarceration, but we ""can't afford"" to provide kids with the college education they need to survive in modern America. That doesn't make any sense to me."
"When Yemenis see “Made in USA” on the bombs that are killing them, it tells them that the USA is responsible for this war.  This is not the message we should be sending to the world. Congress must end support for the catastrophic war in Yemen led by a despotic Saudi regime."
"After Trump shut down the government for 35 days the first bill Sen. McConnell introduced wasn't to provide back-pay to 1.2 million federal contractors.  It wasn't to guarantee health care or lower drug prices.  It was to repeal the estate tax for the 1,700 wealthiest families."
"If we think big, not small, we can end the grotesque level of income and wealth inequality, guarantee health care for all, have a livable minimum wage and make public colleges and universities tuition-free. The struggle continues."
"While I do not support the BDS movement, we must defend every American’s constitutional right to peacefully engage in political activity. It is clear to me that S.1 would violate Americans’ First Amendment rights."
As a nation we have a choice: are we going to join every other major country and make health care a right? Or will we continue to allow insurance and pharma companies to make huge profits off of people's suffering?
I do not believe that men and women fought and died for our right to vote so that billionaires could buy elections. We must move to real campaign finance reform and public funding of elections.
"In the year 2019, no one in America, especially those working for profitable corporations with billionaire CEOs, should be living in poverty or struggling economically.  We must raise the minimum wage to a living wage—$15 an hour."
"Mr. President. 800,000 federal employees and their families are human beings, not your play things. Do not treat them with contempt and disrupt their lives. They have kids. They have needs. Do not shut down the government again."
"Our infrastructure is crumbling. Instead of building a wall on the Mexican border, we should create millions of good-paying jobs rebuilding our roads, bridges, water systems, wastewater plants, schools, airports and affordable housing."
"When an undocumented person commits a murder, Trump talks about it incessantly. When, in 2017,  a white guy like Stephen Paddock kills 58 people in Las Vegas and wounds 851, Trump has very little to say."
"Today, on Holocaust Remembrance Day, we pledge to never forget the 6 million Jews murdered by Hitler. At a time of increased tribalism and  xenophobia, we must recommit ourselves to fight against all forms of bigotry and intolerance."
"Thank you air traffic controllers, flight attendants, federal workers and contract employees for standing up for your rights, holding rallies, organizing and sharing  heartbreaking stories over the past 35 days. You are the reason that the government shutdown finally ended."
"How pathetic. On Dec. 19, the Senate unanimously passed essentially the same legislation that we will vote on today. We are back to exactly where we started. Thank you, Mr. President, for shutting down the government and holding 800,000 federal employees hostage. All for nothing!"
"The Constitution and federal law bans indentured servitude. That means no worker, including federal employees, should be forced to work without getting paid. Trump's anti-worker government shutdown is an ugly attack on the working class of this country."
"But we must learn the lessons of the past and not be in the business of regime change or supporting coups—as we have in Chile, Guatemala, Brazil & the DR. The US has a long history of inappropriately intervening in Latin American nations; we must not go down that road again. 3/3"
"The United States should support the rule of law, fair elections and self-determination for the Venezuelan people. We must condemn the use of violence against unarmed protesters and the suppression of dissent. 2/3"
"The Maduro government has waged a violent crackdown on Venezuelan civil society, violated the constitution by dissolving the National Assembly and was re-elected last year in an election many observers said was fraudulent. The economy is a disaster and millions are migrating. 1/3"
"President Trump, you want to talk about a crisis? 7 million Americans have become uninsured since you took office. The uninsured rate is the highest in 5 years.  We must end the embarrassment of being the only major country not to guarantee health care for all. #MedicareForAll"
"Trump stated loudly and clearly: ""I am proud to shut down the government.""   Now, Mr. President, with 800,000 federal employees struggling to pay their bills, end the crisis you created. Pay federal employees. Open the government."
"If Trump were serious about protecting our national security, he would recognize that climate change is not a ""hoax"" and is already causing destruction and instability worldwide. The time for bold action is now."
The bad news: We have just 11 years to take bold steps to rapidly transform our energy system to sustainable energy if the planet is going to remain habitable.  The good news: We can revitalize our economy and create tens of millions of jobs in the process.
"Today, 46 years after Roe v. Wade, abortion is a right in name only for millions of women in America. Our job: do everything we can to protect and expand reproductive rights and access to abortion across the country."
"We must stop incarcerating millions of Americans and funding militarism, and end racism in the criminal justice system and in the voting booth. Our attention should be on lifting up all Americans."
"9 years ago the disastrous Citizens United decision opened the door for billionaires and corporate interests to buy our elections.  To restore our one person, one vote democracy, we must pass a constitutional amendment to overturn Citizens United and stop the slide to oligarchy."
"We have a president who is a racist.  Today we say to Trump: We aren't going back to more bigotry, discrimination and division. We're going forward."
"Dr. King's vision of ending the triple evils of racism, economic injustice and war is as important today as it was when Dr. King fought for those principles, and must motivate us in all of our work. #MLKDay"
"We must do more than just “honor and remember” Dr. King. We must be faithful to his revolutionary spirit, his call for a “radical revolution of values” and his incredible courage in taking on virtually the entire political and economic establishment of his time. #MLKDay"
"Trump is shutting down the government not just for his absurd wall. When you don't pay 800,000 federal workers you are destroying the concept of government in a democratic society, and moving to more privatization and corporate control over our lives."
"Interesting. Trump and Putin are not only billionaire, anti-democratic authoritarians but they deny the crisis of climate change and push fossil fuels. What's the connection?"
"It is not a radical idea to say that instead of throwing millions of Americans off of the health care they have, we must join every other major country on Earth and guarantee health care as a right, not a privilege, through a Medicare for All system."
"""When machines and computers, profit motives and property rights are considered more important than people, the giant triplets of racism, materialism and militarism are incapable of being conquered.” -Dr. Martin Luther King, Jr., Riverside Church, 1967"
Mr. President. Stop holding federal employees hostage and stop holding the young people in DACA hostage. End the federal shutdown and reinstate legal status for these young Americans. #NoWall
"Since Trump was elected, the five richest people in America have seen their wealth go up by over $100 billion.  Over the past year, wages for average workers are up by $9.11 a week after adjusting for inflation.  That is the economic reality under Trump."
"Instead of an austerity program for working families and the poor, we need austerity for billionaires and large multinational corporations."
"President Trump said that ""nobody has been better at the military"" than him.  So why is he keeping the government shut down and leaving 42,000 service members without paychecks for the first time in history?"
"The wealth gap between white Americans and African Americans has more than TRIPLED over the past 50 years.  Today, the median white family has almost 10 times as much wealth as the median black family.  We must fight for racial and economic justice for all."
"We must repeal the Trump tax breaks for the top 1% and large, profitable corporations. At a time of massive income and wealth inequality, we need to rebuild our crumbling infrastructure and create a sustainable economy, not make the very rich even richer."
"Maybe I’m the “radical” one, but I don’t think it's acceptable that the top 25 Wall Street hedge fund managers made over $15 billion in compensation in 2017—nearly double what all 140,000 kindergarten teachers in America made last year."
"Over the past 40 years there has been an enormous transfer of income from the middle class to rich. Since 1979, the bottom 90% of Americans have seen their share of national income decline from 58% to just 46%—costing them nearly $11,000 per household."
"We need to change national priorities in this country. Instead of giving a trillion dollars in tax breaks to the top 1 percent and large, profitable corporations, we need to raise the minimum wage to a living wage of $15 an hour."
"On nearly every ""radical"" idea the American people are with us:  72% want to expand Social Security. 70% want Medicare for All. 65% want a jobs guarantee. 64% want to legalize marijuana. 60% want tuition-free public colleges. 58% want $15 min wage. 57% want to break up big banks."
"While labor productivity has more than doubled since the late 1960s, nearly half of all new income generated in the U.S. since 1993 has gone to the top 1 percent.  This is what we mean when we say the economy is rigged in favor of the wealthy."
"Think big, not small. It is not ""radical"" to demand that all Americans receive decent wages, guaranteed health care, quality education, affordable housing and a clean environment. We need a government that represents all of us, not just the 1%."
"We need a revolution in education. Teachers in LA should not be forced to strike for decent wages and smaller classes. All parents deserve high quality, affordable childcare.  Young people should not leave college deeply in debt. We must get our priorities right."
"Trump says the economy is ""booming."" It is—for the top 10 CEOs who saw their combined compensation soar by 60% in 2017.   For the average worker, however, real wages went up by just 1.2% over the past year.   The very rich get richer. Working families continue to struggle."
"The federal minimum wage of $7.25 is a starvation wage. That is why I, along with many other members of Congress, will introduce legislation this week to raise that wage to $15 an hour. If you work 40 hours a week, you should not live in poverty."
"Mr. President. Do you want to know what a real ""national emergency"" is? The scientists tell us that if we don't combat climate change aggressively, the severe damage done to our country and planet will be irreversible. Now that's a ""crisis."""
Do Trump and his billionaire friends understand that many federal employees live paycheck to paycheck? They have kids to feed and mortgages to pay.    Mr. President. Grow up. End the shutdown you created. Pay federal employees.
"Today, the top 0.1% owns more wealth than the bottom 90%.    Uncontrolled greed cannot be the driving force behind our economy.    Our job: demand that all Americans have good paying jobs, health care, quality education, and a healthy environment."
"Today, the 3 wealthiest Americans own more wealth than the bottom half of our people, and income and wealth inequality is worse now than at any time since the 1920s. This is a moral outrage and bad economics. Not acceptable."
Things that are national emergencies: -30 million without health insurance -15 million children in poverty -Tens of thousands dying from opioids and gun violence -Climate change  Things that are not national emergencies: -Building a border wall to satisfy Fox News
"Last year, the five largest drug companies in America made nearly $60 billion in profits. The top five pharma CEOs made over $113 million in total compensation in 2017.  Meanwhile, 1 in 5 Americans can’t afford their prescriptions. That should outrage every member of Congress."
"Trump has told the American people several hundred times that Mexico would pay for the wall. That is a lie. If his wall were to be built, Mexico would not pay for it. American taxpayers would."
"Why do Americans pay the highest prices for prescription drugs in the world?  Why are there no restrictions on what a drug company can charge?  The answer is simple: other than Wall Street, the pharmaceutical industry is the most powerful political force in the country."
"There's no crisis at the border. President Trump, you want to talk about crises?   -30 million Americans have no health insurance -Climate change threatens our planet -Half of older Americans have no retirement savings -40 million are dealing with outrageous student debt"
"We do not need to waste billions on an unneeded wall so that Trump can appease right-wing extremists.  We need to create millions of good-paying jobs by rebuilding our crumbling infrastructure — roads, bridges, water systems, rail and affordable housing."
"As a result of Trump's shutdown, 800,000 federal employees are in danger of not receiving a paycheck.  They're worried about how they'll pay their mortgages, feed their families and put gas in their cars.  Unbelievably, Republican leader Mitch McConnell refuses to take action."
"Jimmy Carter was right when he said that America is ""an oligarchy, with unlimited political bribery.""  Every day we are sliding further away from democracy into an oligarchic form of government.   Democracy should be about one person, one vote—not billionaires buying elections."
"As a result of Trump's government shutdown, many federal employees will be unable to pay their mortgages or feed their kids. The Senate's first act must be to re-open the government.    Leader McConnell: Let the Senate vote on the House bills to re-open the government."
"If President Trump is really concerned about national security then why isn't he paying employees at the FBI, TSA and other security agencies who work every day to protect this country?   President Trump. End your shutdown of the government. Pay federal employees."
"President Trump, federal employees are not billionaires. They have to feed their kids and pay their mortgages. End the shutdown now and treat federal employees with the respect they are due."
"Congratulations to Republican Senators Cory Gardner and Susan Collins for understanding that 800,000 federal employees must be paid. If Leader McConnell allows the Senate to vote, we can end the government shut down now."
"Rep. Liz Cheney, daughter of Dick Cheney, yesterday attacked ""the fraud of socialism."" Really? I wasn't aware that it was ""socialism"" that lied about weapons of mass destruction in Iraq, and got us into a horrific war that we should never have started."
"Is it ""radical"" to demand that all Americans have health care, that billionaires pay their fair share of taxes, that workers earn at least $15 an hour and that we transform our energy system in order to combat climate change? I don't think so."
"At a time when climate change threatens our planet, when our infrastructure is crumbling, when 30 million people have no health insurance, I'm concerned that the concept of PAYGO will make it harder for Congress to address the many crises facing our working families."
"Health care is a right, not a privilege. We need Medicare for All so we can end the disgrace of 30 million Americans having no health insurance, and many more being underinsured with high deductibles and co-payments."
"Our job: pursue a bold agenda that transforms our energy system away from fossil fuels to energy efficiency and sustainable energy.   We're at war with climate change and, for the sake of our kids and grandchildren, we cannot lose."
We must look at climate change as if it were a devastating military attack against the United States and the entire planet. And we must respond accordingly.
"As 2018 comes to an end, Jane and I want to wish all of you a happy New Year's Eve and a healthy and wonderful new year."
"The fossil fuel industry is now the equivalent of the tobacco industry. It creates death and destruction, and then spends billions denying its responsibility.  We must transform our energy system away from fossil fuels and into energy efficiency and sustainable energy."
One of the great crises facing our democracy is power of the billionaire class over our political process. The needs of ordinary people are ignored when the very rich and their Super PACs buy elections. We need to overturn Citizens United and move to public funding of elections.
"If it is just ""bi-partisan politics"" to spend some $700 billion a year on the military, more than the next ten nations combined, why is it a ""radical"" idea to lower student debt and make public colleges and universities tuition-free?"
"The extraordinary power of the corporate establishment is not just over our economy and political life, it is over our imagination and our ability to envision a different kind of world."
"The American people are tired of a president who is a liar, a fraud, a narcissist and a bully. They want leadership which unites us, not divides us. They want policies which work for all, not just the wealthy few."
"As we enter the new year let us not forget that while the very rich become much richer, millions of Americans are unable to afford health care, housing, prescription drugs or education. In 2019 we can do better. We must do better."
"There will no real social progress in this country unless we have the courage to take on Wall Street, the insurance companies, the drug companies, the military-industrial complex, the fossil fuel industry, the prison industry and all the other forces of greed."
"The six largest banks now have over $10 trillion in assets—54% of GDP. We must break up these huge financial institutions. If a bank is too big to fail, it is too big to exist."
"As we celebrate Christmas and the holiday season, let us rededicate ourselves to a world of peace - and economic, social, racial and environmental justice."
Jane and I want to take this opportunity to wish everyone a very Merry Christmas and a happy holiday season.
"While Trump talks about a ""booming economy,"" the reality for working families is: -Real wages for average workers are lower than in 1973 -80% live paycheck to paycheck -Half of older Americans have no retirement savings New Year’s Resolution: Create an economy that works for all."
"Wealth inequality is a profound moral issue this country must address. The richest 3 Americans cannot continue owning more wealth than the bottom half of our country, while over 40% cannot afford the basics to live."
"This is what Christmas season looks like in Trumpland: -Take away paychecks of 800,000 workers by shutting the government. -Take away $1.40 meals from 755,000 hungry, unemployed Americans. - Give Pfizer a $26.5 billion tax cut after it increased the price of life saving drugs."
"Think about it for a minute.  Democrats and Republicans come together, after a whole lot of debate, and agree on how to keep the government open.  And then, after a day of right-wing media criticism, the president undermines all of that. To say the least, that is problematic."
"If Trump shuts the federal government down, should federal employees be available to escort him to his beachfront resort in Florida for a 16-day holiday? I don’t think so!"
"This is what happened:  1) The Senate unanimously voted to keep the government open 2) The House was ready to pass the bill 3) Rush and Fox & Friends criticized Trump 4) Trump now wants to shut down the government, putting 800,000 people out of work the week before Christmas"
"Last Tuesday, Trump said “I’m proud to shut down the government.” And he did. Despite unanimous Republican support in the Senate and overwhelming Republican support in the House, Trump will leave 800,000 federal employees without paychecks. How’s that for a holiday gift?"
Nearly half of American adults have had an immediate family member incarcerated at some point. HALF.  Imagine what we could accomplish if we invested in jobs and education instead of paying $80 billion a year to lock up 2.2 million people.
"Medicare for All is not a crazy idea.  What's crazy is that our health care system is designed to make as much profit for insurance and pharma executives as possible, while ordinary people die because they can't afford the care and medicine they need."
"I'm glad the First Step Act passed. But there is much more needed to achieve comprehensive criminal justice reform. We must:  -End cash bail -End private prisons -End mandatory minimums -Reinstate the federal parole system  Our primary goal must be rehabilitation, not punishment."
"Trump promised that his tax giveaway to the wealthy would put an extra $4,000 into the pockets of middle-class families.  He lied. Bonuses are up $0.02/hr since the GOP tax cuts passed.  Our job: Repeal Trump’s tax breaks for the wealthy and rebuild the disappearing middle class."
U.S. student loan debt outstanding reached a record $1.465 trillion last month.  You know the most revolting part of this crisis?  The federal government makes billions in profits off of student loans each year.
"I want to thank my colleagues and the many people at the grassroots level who helped us pass this historic resolution. Today, 45 years after the passage of the War Powers Act, the U.S. Senate finally used that authority for the first time."
"The Saudi-led intervention in Yemen has resulted in the worst humanitarian crisis on Earth. That crisis is 85,000 children starving to death; 10,000 new cases of cholera every single week; and the United Nations telling us that Yemen is on the verge of imminent famine."
"Let us show the world today that the U.S. Senate recognizes that real American power does not come from our ability to blow things up, but from our ability to bring people together.  We must finally end US support for the disastrous Saudi-led war in Yemen."
Today the U.S. Senate will vote on whether to end US support for the devastating Saudi-led war in Yemen.   This would be the first time ever that the Senate has voted to end an unauthorized war.   We must finally end US involvement in this humanitarian and strategic disaster.
Tomorrow I'll move to proceed to the resolution I've offered with @SenMikeLee and @ChrisMurphyCT to end US involvement in the Saudi-led war in Yemen. I am optimistic that a bipartisan coalition will vote to make clear we will no longer support Saudi Arabia in its destructive war.
Thankfully there is a way to make sure that nobody has to delay or cancel the care they need because they can't afford it. #MedicareForAll
